number,value,datetime_start,datetime_complete,duration,params_dt_criterion,params_dt_max_depth,params_dt_min_samples_leaf,params_dt_min_samples_split,params_dt_splitter,params_feature_selector,params_hgb_learning_rate,params_hgb_max_bins,params_hgb_max_depth,params_hgb_max_iter,params_lasso_alpha,params_lgb_feature_fraction,params_lgb_learning_rate,params_lgb_max_depth,params_lgb_n_estimators,params_lgb_num_leaves,params_model,params_rf_bootstrap,params_rf_criterion,params_rf_max_depth,params_rf_min_samples_leaf,params_rf_min_samples_split,params_rf_n_estimators,params_scaler,params_xgb_alpha,params_xgb_booster,params_xgb_lambda,params_xgb_learning_rate,params_xgb_max_depth,params_xgb_n_estimators,user_attrs_MAE,user_attrs_MSE,user_attrs_R2,user_attrs_error,state
194,18.763195658348618,2025-05-04 05:14:13.340754,2025-05-04 05:15:00.090852,0 days 00:00:46.750098,,,,,,none,,,,,,0.4320486884386547,0.04578143040246009,9.0,987.0,147.0,LightGBM,,,,,,,robust,,,,,,,7.0272971719626565,352.0575113134724,0.8358611764472346,,COMPLETE
195,18.658547755413544,2025-05-04 05:14:14.864368,2025-05-04 05:15:00.137480,0 days 00:00:45.273112,,,,,,none,,,,,,0.4476413816310663,0.04873576956842964,9.0,983.0,138.0,LightGBM,,,,,,,robust,,,,,,,7.058442499292286,348.14140434104775,0.8376869724342664,,COMPLETE
196,18.784190269078643,2025-05-04 05:14:14.946153,2025-05-04 05:14:52.236758,0 days 00:00:37.290605,,,,,,none,,,,,,0.5833093965610131,0.27868851001602046,9.0,886.0,78.0,LightGBM,,,,,,,robust,,,,,,,7.281085165969459,352.84580406494877,0.835493652844742,,COMPLETE
197,19.38961486168969,2025-05-04 05:14:15.172456,2025-05-04 05:14:54.398274,0 days 00:00:39.225818,,,,,,none,,,,,,0.459449091746026,0.2776940644080617,9.0,918.0,81.0,LightGBM,,,,,,,robust,,,,,,,7.3909409457744895,375.9571644846577,0.8247185056369971,,COMPLETE
198,18.043829569241606,2025-05-04 05:14:15.233665,2025-05-04 05:14:38.702101,0 days 00:00:23.468436,,,,,,none,,,,,,0.453138377566884,0.26905693257716884,9.0,859.0,34.0,LightGBM,,,,,,,robust,,,,,,,6.981932414736985,325.57978552383776,0.8482058150980306,,COMPLETE
199,18.435431184754695,2025-05-04 05:14:15.297227,2025-05-04 05:14:38.783698,0 days 00:00:23.486471,,,,,,none,,,,,,0.5915049720347714,0.07518390721585222,9.0,988.0,34.0,LightGBM,,,,,,,robust,,,,,,,6.827837758965985,339.86512296782587,0.8415456007672456,,COMPLETE
200,18.15428699349186,2025-05-04 05:14:16.725104,2025-05-04 05:14:41.752745,0 days 00:00:25.027641,,,,,,none,,,,,,0.6000782361561997,0.2845258245683186,9.0,881.0,36.0,LightGBM,,,,,,,robust,,,,,,,7.089460031263563,329.5781362420676,0.846341674831308,,COMPLETE
201,18.307475822627627,2025-05-04 05:14:17.856785,2025-05-04 05:14:46.553216,0 days 00:00:28.696431,,,,,,none,,,,,,0.45250018377948636,0.04938277469299064,0.0,944.0,32.0,LightGBM,,,,,,,robust,,,,,,,6.787222994688661,335.16367099609505,0.8437375460342296,,COMPLETE
202,18.973536437372506,2025-05-04 05:14:17.931459,2025-05-04 05:14:42.668726,0 days 00:00:24.737267,,,,,,none,,,,,,0.45860446230304247,0.28862645566869577,10.0,856.0,35.0,LightGBM,,,,,,,robust,,,,,,,7.278074057612509,359.9950849403022,0.8321604629129301,,COMPLETE
203,31.59918371531747,2025-05-04 05:14:18.051432,2025-05-04 05:14:20.041544,0 days 00:00:01.990112,,,,,,none,,,,,,0.4185033077793519,0.6463618533467418,1.0,819.0,34.0,LightGBM,,,,,,,robust,,,,,,,11.749607249244319,998.5084114743847,0.5344681175655566,,COMPLETE
204,18.514595882274175,2025-05-04 05:14:18.524940,2025-05-04 05:14:43.382288,0 days 00:00:24.857348,,,,,,none,,,,,,0.4018873866627794,0.07399714969395964,10.0,918.0,35.0,LightGBM,,,,,,,robust,,,,,,,6.999333582137111,342.79026068392386,0.8401818217026864,,COMPLETE
205,18.817342560483016,2025-05-04 05:14:18.730346,2025-05-04 05:14:41.093576,0 days 00:00:22.363230,,,,,,none,,,,,,0.4138171019714412,0.07191020217370667,10.0,788.0,37.0,LightGBM,,,,,,,robust,,,,,,,7.053241541605322,354.0923810385655,0.8349124646259363,,COMPLETE
206,19.83799474184113,2025-05-04 05:14:18.788611,2025-05-04 05:14:24.747749,0 days 00:00:05.959138,,,,,,none,,,,,,0.43681652648188524,0.29533001167616313,3.0,926.0,36.0,LightGBM,,,,,,,robust,,,,,,,7.898337168526909,393.54603537731623,0.8165180938202702,,COMPLETE
207,19.463441032394027,2025-05-04 05:14:20.047516,2025-05-04 05:14:41.419371,0 days 00:00:21.371855,,,,,,none,,,,,,0.5771987756763329,0.053580652523638056,10.0,613.0,82.0,LightGBM,,,,,,,robust,,,,,,,7.075027723915403,378.82553682147943,0.8233811921420493,,COMPLETE
208,19.488069593039558,2025-05-04 05:14:21.100438,2025-05-04 05:14:54.791174,0 days 00:00:33.690736,,,,,,none,,,,,,0.5760281450930443,0.2868878012952994,10.0,700.0,86.0,LightGBM,,,,,,,robust,,,,,,,7.369252445749728,379.784856463153,0.8229339311340171,,COMPLETE
209,19.090596092632133,2025-05-04 05:14:21.479521,2025-05-04 05:14:55.856691,0 days 00:00:34.377170,,,,,,none,,,,,,0.5767791207374752,0.04254958507894308,10.0,974.0,88.0,LightGBM,,,,,,,robust,,,,,,,6.867514747020233,364.45085917202124,0.8300830593157664,,COMPLETE
210,19.268080653978263,2025-05-04 05:14:21.688093,2025-05-04 05:15:11.071947,0 days 00:00:49.383854,,,,,,none,,,,,,0.7474191226527499,0.28342663362134046,10.0,936.0,82.0,LightGBM,,,,,,,robust,,,,,,,7.411649241507033,371.25893208821145,0.8269089498500835,,COMPLETE
211,19.881851833726916,2025-05-04 05:14:22.445686,2025-05-04 05:15:10.424672,0 days 00:00:47.978986,,,,,,none,,,,,,0.5771467057398145,0.2995078228209226,10.0,931.0,158.0,LightGBM,,,,,,,robust,,,,,,,7.630627489125886,395.2880323382704,0.8157059272775461,,COMPLETE
212,19.452481431777368,2025-05-04 05:14:23.118169,2025-05-04 05:15:03.346052,0 days 00:00:40.227883,,,,,,none,,,,,,0.6010830694247266,0.0381579902908464,10.0,989.0,161.0,LightGBM,,,,,,,robust,,,,,,,6.983537099473395,378.39903385364335,0.8235800394699226,,COMPLETE
213,19.530028035253334,2025-05-04 05:14:23.930077,2025-05-04 05:14:46.637391,0 days 00:00:22.707314,,,,,,none,,,,,,0.6067352089485218,0.045356788356706174,10.0,612.0,82.0,LightGBM,,,,,,,robust,,,,,,,6.9997274447522475,381.42199505778115,0.822170652424489,,COMPLETE
214,18.604643151302547,2025-05-04 05:14:24.350218,2025-05-04 05:15:05.618187,0 days 00:00:41.267969,,,,,,none,,,,,,0.602413405231286,0.08598502328583148,10.0,978.0,160.0,LightGBM,,,,,,,robust,,,,,,,6.871850200099082,346.13274678730875,0.8386234634256418,,COMPLETE
215,19.016850244257792,2025-05-04 05:14:24.751021,2025-05-04 05:14:57.383983,0 days 00:00:32.632962,,,,,,none,,,,,,0.6087324202787626,0.3032522279753004,10.0,696.0,84.0,LightGBM,,,,,,,robust,,,,,,,7.431117881968037,361.6405932125277,0.8313932820311993,,COMPLETE
216,19.06877337347416,2025-05-04 05:14:28.109296,2025-05-04 05:15:06.437364,0 days 00:00:38.328068,,,,,,none,,,,,,0.6052242044330399,0.049789831777990665,10.0,976.0,157.0,LightGBM,,,,,,,robust,,,,,,,6.891802210037415,363.61811796891703,0.8304713059999275,,COMPLETE
217,18.88600859609864,2025-05-04 05:14:30.536379,2025-05-04 05:15:10.612639,0 days 00:00:40.076260,,,,,,none,,,,,,0.6334160488372013,0.05631790919420307,10.0,988.0,248.0,LightGBM,,,,,,,robust,,,,,,,6.841231355201224,356.68132069191176,0.8337054302770199,,COMPLETE
218,19.225160614615067,2025-05-04 05:14:30.579356,2025-05-04 05:15:11.790812,0 days 00:00:41.211456,,,,,,none,,,,,,0.6330663383499425,0.04516113699387777,10.0,973.0,241.0,LightGBM,,,,,,,robust,,,,,,,6.889040724270523,369.6068006577464,0.8276792186290092,,COMPLETE
219,,2025-05-04 05:14:35.128330,2025-05-04 05:14:35.173301,0 days 00:00:00.044971,mse,21.0,23.0,10.0,random,none,,,,,,,,,,,DecisionTree,,,,,,,robust,,,,,,,,,,"The 'criterion' parameter of DecisionTreeRegressor must be a str among {'friedman_mse', 'absolute_error', 'poisson', 'squared_error'}. Got 'mse' instead.",PRUNED
220,19.069323116419934,2025-05-04 05:14:35.175907,2025-05-04 05:15:11.556870,0 days 00:00:36.380963,,,,,,none,,,,,,0.7229502027344674,0.06911595961780002,10.0,976.0,249.0,LightGBM,,,,,,,robust,,,,,,,6.939200284015702,363.6390841184276,0.8304615310086135,,COMPLETE
221,19.18439752619967,2025-05-04 05:14:37.819635,2025-05-04 05:15:16.168236,0 days 00:00:38.348601,,,,,,none,,,,,,0.614979580149857,0.06449132915734437,10.0,985.0,234.0,LightGBM,,,,,,,robust,,,,,,,6.938528358450085,368.0411084432561,0.8284091870855076,,COMPLETE
222,19.372625152444208,2025-05-04 05:14:38.132156,2025-05-04 05:15:23.322945,0 days 00:00:45.190789,,,,,,none,,,,,,0.4760550450243473,0.03723045358190663,10.0,1000.0,228.0,LightGBM,,,,,,,robust,,,,,,,6.9834044397222,375.298605297114,0.8250255439100338,,COMPLETE
223,,2025-05-04 05:14:38.706420,2025-05-04 05:14:38.759928,0 days 00:00:00.053508,,,,,,none,,,,,,,,,,,RandomForest,True,mse,30.0,32.0,9.0,158.0,robust,,,,,,,,,,"The 'criterion' parameter of RandomForestRegressor must be a str among {'friedman_mse', 'absolute_error', 'poisson', 'squared_error'}. Got 'mse' instead.",PRUNED
224,18.449076268413425,2025-05-04 05:14:38.761710,2025-05-04 05:14:56.195623,0 days 00:00:17.433913,,,,,,none,,,,,,0.47090930794493746,0.054230556783587396,10.0,894.0,22.0,LightGBM,,,,,,,robust,,,,,,,6.951529219256473,340.3684151577354,0.8413109522075632,,COMPLETE
225,19.05253087847517,2025-05-04 05:14:38.792388,2025-05-04 05:15:01.739273,0 days 00:00:22.946885,,,,,,none,,,,,,0.6119112083619634,0.04415095254342787,10.0,985.0,30.0,LightGBM,,,,,,,robust,,,,,,,6.949030851627825,362.9989328752498,0.8307599869954182,,COMPLETE
226,18.506210247372245,2025-05-04 05:14:40.051583,2025-05-04 05:15:01.277073,0 days 00:00:21.225490,,,,,,none,,,,,,0.46281702209906816,0.07654521624600163,10.0,881.0,31.0,LightGBM,,,,,,,robust,,,,,,,6.913593137087257,342.4798177199455,0.8403265586881224,,COMPLETE
227,18.172478707656143,2025-05-04 05:14:41.096807,2025-05-04 05:15:02.387323,0 days 00:00:21.290516,,,,,,none,,,,,,0.46421390925716893,0.07289975384663915,10.0,888.0,30.0,LightGBM,,,,,,,robust,,,,,,,6.786108399571168,330.23898238021593,0.8460335703194617,,COMPLETE
228,18.263310115495738,2025-05-04 05:14:41.423012,2025-05-04 05:14:59.278428,0 days 00:00:17.855416,,,,,,none,,,,,,0.6077046169454186,0.09241310704845188,10.0,998.0,20.0,LightGBM,,,,,,,robust,,,,,,,6.750556775841661,333.5484963747689,0.8444905845397501,,COMPLETE
229,18.571653304857175,2025-05-04 05:14:41.755507,2025-05-04 05:15:03.881403,0 days 00:00:22.125896,,,,,,none,,,,,,0.6146626829645065,0.3034245927738886,10.0,889.0,29.0,LightGBM,,,,,,,robust,,,,,,,7.1398109421234395,344.90630647581247,0.8391952633828011,,COMPLETE
230,18.380743306365584,2025-05-04 05:14:42.672284,2025-05-04 05:14:58.906182,0 days 00:00:16.233898,,,,,,none,,,,,,0.4707358398801209,0.07971622992219374,10.0,885.0,20.0,LightGBM,,,,,,,robust,,,,,,,6.955634546300712,337.8517244945033,0.8424843021047661,,COMPLETE
231,18.445641875703206,2025-05-04 05:14:43.385187,2025-05-04 05:14:59.510658,0 days 00:00:16.125471,,,,,,none,,,,,,0.46310686656994743,0.05364538036222803,10.0,882.0,20.0,LightGBM,,,,,,,robust,,,,,,,6.962269092949726,340.2417042066957,0.841370028312366,,COMPLETE
232,18.35152108081625,2025-05-04 05:14:44.445630,2025-05-04 05:15:00.907625,0 days 00:00:16.461995,,,,,,none,,,,,,0.6109755275065661,0.08103210121734114,10.0,888.0,21.0,LightGBM,,,,,,,robust,,,,,,,6.869515022024999,336.7783259796432,0.8429847497980282,,COMPLETE
233,18.417217149098086,2025-05-04 05:14:46.556521,2025-05-04 05:15:02.666423,0 days 00:00:16.109902,,,,,,none,,,,,,0.46063358985088376,0.08683104451321665,10.0,880.0,20.0,LightGBM,,,,,,,robust,,,,,,,6.9605515762731915,339.1938875170326,0.8418585490602932,,COMPLETE
234,18.33875308934872,2025-05-04 05:14:46.639713,2025-05-04 05:15:05.960231,0 days 00:00:19.320518,,,,,,none,,,,,,0.46384979561132433,0.07501979486574957,10.0,882.0,28.0,LightGBM,,,,,,,robust,,,,,,,6.922350436706623,336.30986487209725,0.843203159156164,,COMPLETE
235,18.431840993727636,2025-05-04 05:14:52.240820,2025-05-04 05:15:07.985603,0 days 00:00:15.744783,,,,,,none,,,,,,0.44932747163492626,0.08687865282179978,10.0,883.0,21.0,LightGBM,,,,,,,robust,,,,,,,7.1161454871254275,339.7327624180586,0.8416073108692188,,COMPLETE
236,18.58789715486879,2025-05-04 05:14:52.677696,2025-05-04 05:15:15.984747,0 days 00:00:23.307051,,,,,,none,,,,,,0.4646074785890537,0.08353625413674115,0.0,880.0,30.0,LightGBM,,,,,,,robust,,,,,,,6.882257385958157,345.5099206399793,0.8389138419797568,,COMPLETE
237,18.537979700721856,2025-05-04 05:14:52.879381,2025-05-04 05:15:08.647784,0 days 00:00:15.768403,,,,,,none,,,,,,0.45428256628076996,0.08823691138318031,10.0,877.0,20.0,LightGBM,,,,,,,robust,,,,,,,6.977812026642478,343.65669138437556,0.8397778680550805,,COMPLETE
238,19.029338494621587,2025-05-04 05:14:53.339454,2025-05-04 05:15:13.706449,0 days 00:00:20.366995,,,,,,none,,,,,,0.44517530927511634,0.08538928638410039,10.0,876.0,29.0,LightGBM,,,,,,,robust,,,,,,,7.1196155847896065,362.115723542887,0.8311717632993068,,COMPLETE
239,18.446178351589843,2025-05-04 05:14:54.401275,2025-05-04 05:15:13.934108,0 days 00:00:19.532833,,,,,,none,,,,,,0.4707928275971078,0.08760336562654907,10.0,878.0,29.0,LightGBM,,,,,,,robust,,,,,,,6.940033399021293,340.2614957786618,0.8413608009411713,,COMPLETE
240,18.24098960879734,2025-05-04 05:14:54.794634,2025-05-04 05:15:14.384825,0 days 00:00:19.590191,,,,,,none,,,,,,0.40634200529436604,0.08873655184336927,10.0,885.0,29.0,LightGBM,,,,,,,robust,,,,,,,6.97755212755216,332.73370190825244,0.8448704639653369,,COMPLETE
241,,2025-05-04 05:14:55.080243,2025-05-04 05:14:55.140658,0 days 00:00:00.060415,,,,,,lasso,,,,,0.001149698738880346,0.40562528607327,0.1063348747831435,0.0,881.0,20.0,LightGBM,,,,,,,robust,,,,,,,,,,"Input X contains NaN.
Lasso does not accept missing values encoded as NaN natively. For supervised learning, you might want to consider sklearn.ensemble.HistGradientBoostingClassifier and Regressor which accept missing values encoded as NaNs natively. Alternatively, it is possible to preprocess the data, for instance by using an imputer transformer in a pipeline or drop samples with missing values. See https://scikit-learn.org/stable/modules/impute.html You can find a list of all estimators that handle NaN values at the following page: https://scikit-learn.org/stable/modules/impute.html#estimators-that-handle-nan-values",PRUNED
242,18.76280910610985,2025-05-04 05:14:55.143363,2025-05-04 05:15:14.510278,0 days 00:00:19.366915,,,,,,none,,,,,,0.4705532638488733,0.07586994435160306,10.0,873.0,29.0,LightGBM,,,,,,,robust,,,,,,,6.97247625426016,352.0430055523187,0.8358679394291167,,COMPLETE
243,18.516088261715772,2025-05-04 05:14:55.607415,2025-05-04 05:15:18.261325,0 days 00:00:22.653910,,,,,,none,,,,,,0.4551307452774345,0.07743286190602945,10.0,997.0,31.0,LightGBM,,,,,,,robust,,,,,,,6.893814052027858,342.84552451564866,0.8401560561955381,,COMPLETE
244,18.345062956356358,2025-05-04 05:14:55.860312,2025-05-04 05:15:15.534678,0 days 00:00:19.674366,,,,,,none,,,,,,0.47542376065321346,0.07770360803606018,10.0,885.0,30.0,LightGBM,,,,,,,robust,,,,,,,6.845204663418176,336.5413348726783,0.843095241522362,,COMPLETE
245,18.516713134100335,2025-05-04 05:14:56.200115,2025-05-04 05:15:17.727858,0 days 00:00:21.527743,,,,,,none,,,,,,0.44496782716406397,0.08763474417153151,10.0,892.0,32.0,LightGBM,,,,,,,robust,,,,,,,7.065243872126927,342.8686652905639,0.8401452673344896,,COMPLETE
246,18.237608590180912,2025-05-04 05:14:56.341950,2025-05-04 05:15:16.197799,0 days 00:00:19.855849,,,,,,none,,,,,,0.45316736530041335,0.07470005903141644,10.0,873.0,31.0,LightGBM,,,,,,,robust,,,,,,,6.866023877129439,332.61036708864054,0.8449279660254937,,COMPLETE
247,18.48600752838194,2025-05-04 05:14:57.386926,2025-05-04 05:15:17.493140,0 days 00:00:20.106214,,,,,,none,,,,,,0.4768713579798325,0.06983763482003355,10.0,876.0,31.0,LightGBM,,,,,,,robust,,,,,,,6.880983622999844,341.7324743393938,0.8406749905759013,,COMPLETE
248,18.710423533991573,2025-05-04 05:14:58.241419,2025-05-04 05:15:18.818454,0 days 00:00:20.577035,,,,,,none,,,,,,0.4356378668710277,0.060964107766363324,10.0,892.0,28.0,LightGBM,,,,,,,robust,,,,,,,7.063757964254233,350.0799488213457,0.8367831700719374,,COMPLETE
249,18.74457933041201,2025-05-04 05:14:58.909542,2025-05-04 05:15:18.827351,0 days 00:00:19.917809,,,,,,none,,,,,,0.44325973099323523,0.07689283866176656,10.0,891.0,29.0,LightGBM,,,,,,,robust,,,,,,,7.075647079087891,351.3592542741091,0.8361867229426094,,COMPLETE
250,18.70036630113271,2025-05-04 05:14:59.281827,2025-05-04 05:15:47.393894,0 days 00:00:48.112067,,,,,,none,,,,,,0.4356971844753703,0.05850895453038329,10.0,998.0,158.0,LightGBM,,,,,,,robust,,,,,,,6.9753430936536445,349.70369979653987,0.8369585876395503,,COMPLETE
251,18.252348215452173,2025-05-04 05:14:59.513993,2025-05-04 05:15:20.171992,0 days 00:00:20.657999,,,,,,none,,,,,,0.47978203567763317,0.07864798930115395,10.0,994.0,28.0,LightGBM,,,,,,,robust,,,,,,,6.888199292072115,333.1482153781201,0.8446772064687507,,COMPLETE
252,17.98682630679063,2025-05-04 05:15:00.095513,2025-05-04 05:15:23.564142,0 days 00:00:23.468629,,,,,,none,,,,,,0.47502692245425077,0.07664413039580045,12.0,990.0,29.0,LightGBM,,,,,,,robust,,,,,,,6.751601702351589,323.5259205906554,0.849163383003942,,COMPLETE
253,,2025-05-04 05:15:00.139737,2025-05-04 05:15:00.200252,0 days 00:00:00.060515,mse,20.0,28.0,6.0,random,none,,,,,,,,,,,DecisionTree,,,,,,,robust,,,,,,,,,,"The 'criterion' parameter of DecisionTreeRegressor must be a str among {'friedman_mse', 'absolute_error', 'poisson', 'squared_error'}. Got 'mse' instead.",PRUNED
254,18.521489576353677,2025-05-04 05:15:00.206803,2025-05-04 05:15:20.975318,0 days 00:00:20.768515,,,,,,none,,,,,,0.42782654574299894,0.0678142891832355,10.0,988.0,27.0,LightGBM,,,,,,,robust,,,,,,,7.0734974105548165,343.0455761269779,0.8400627866725818,,COMPLETE
255,17.773172961177266,2025-05-04 05:15:00.910781,2025-05-04 05:15:29.816166,0 days 00:00:28.905385,,,,,,none,,,,,,0.4826246012556615,0.08363114086939173,10.0,996.0,27.0,LightGBM,,,,,,,robust,,,,,,,6.794754258006394,315.88567710792273,0.8527254731074416,,COMPLETE
256,17.96357769936283,2025-05-04 05:15:01.284051,2025-05-04 05:15:23.807694,0 days 00:00:22.523643,,,,,,none,,,,,,0.47745974875809455,0.0786691706472463,12.0,1000.0,27.0,LightGBM,,,,,,,robust,,,,,,,6.789881835093687,322.6901237610455,0.8495530543046038,,COMPLETE
257,18.42585375686106,2025-05-04 05:15:01.743526,2025-05-04 05:15:46.634915,0 days 00:00:44.891389,,,,,,none,,,,,,0.4368199044220952,0.07907051665056786,10.0,998.0,157.0,LightGBM,,,,,,,robust,,,,,,,7.008392050671682,339.5120866692308,0.8417101959281517,,COMPLETE
258,18.317052504773955,2025-05-04 05:15:02.392267,2025-05-04 05:15:41.842405,0 days 00:00:39.450138,,,,,,none,,,,,,0.4822071254764046,0.07954712704590082,10.0,1000.0,155.0,LightGBM,,,,,,,robust,,,,,,,6.861967134652124,335.51441246264585,0.8435740207866755,,COMPLETE
259,,2025-05-04 05:15:02.671770,2025-05-04 05:15:02.713800,0 days 00:00:00.042030,,,,,,none,,,,,,,,,,,RandomForest,True,mse,18.0,26.0,8.0,175.0,robust,,,,,,,,,,"The 'criterion' parameter of RandomForestRegressor must be a str among {'friedman_mse', 'absolute_error', 'poisson', 'squared_error'}. Got 'mse' instead.",PRUNED
260,18.65802339261007,2025-05-04 05:15:02.715607,2025-05-04 05:15:38.359678,0 days 00:00:35.644071,,,,,,none,,,,,,0.4840614050009358,0.08128639552494717,10.0,890.0,159.0,LightGBM,,,,,,,robust,,,,,,,6.9489480985540775,348.1218369191845,0.8376960953005635,,COMPLETE
261,18.126234409225855,2025-05-04 05:15:03.350415,2025-05-04 05:15:21.067989,0 days 00:00:17.717574,,,,,,none,,,,,,0.4688483444428566,0.0809912876908626,10.0,893.0,27.0,LightGBM,,,,,,,robust,,,,,,,6.868634354806154,328.5603738582034,0.8468161834413372,,COMPLETE
262,18.22286279104045,2025-05-04 05:15:03.884703,2025-05-04 05:15:22.630821,0 days 00:00:18.746118,,,,,,none,,,,,,0.4775602845936175,0.07910097493102496,12.0,892.0,26.0,LightGBM,,,,,,,robust,,,,,,,6.858528561642718,332.07272830108644,0.8451786279067194,,COMPLETE
263,18.381238659992537,2025-05-04 05:15:05.622875,2025-05-04 05:15:25.135318,0 days 00:00:19.512443,,,,,,none,,,,,,0.4742283756449683,0.08151369135988298,12.0,893.0,26.0,LightGBM,,,,,,,robust,,,,,,,6.9054654430517735,337.8699346756042,0.8424758120211675,,COMPLETE
264,18.36562917020572,2025-05-04 05:15:05.964093,2025-05-04 05:15:23.662066,0 days 00:00:17.697973,,,,,,none,,,,,,0.46865911686961526,0.07902455556369259,10.0,891.0,26.0,LightGBM,,,,,,,robust,,,,,,,6.911330411057032,337.29633481751137,0.8427432399352777,,COMPLETE
265,18.47317194023404,2025-05-04 05:15:06.440783,2025-05-04 05:15:24.162910,0 days 00:00:17.722127,,,,,,none,,,,,,0.4811269246779253,0.07687174322059893,10.0,888.0,26.0,LightGBM,,,,,,,robust,,,,,,,6.976442607754722,341.2580815334502,0.8408961654537757,,COMPLETE
266,18.27107225915171,2025-05-04 05:15:07.990072,2025-05-04 05:15:25.932492,0 days 00:00:17.942420,,,,,,none,,,,,,0.4804062190463062,0.08142580550533919,10.0,879.0,26.0,LightGBM,,,,,,,robust,,,,,,,6.922908545477659,333.8320814991431,0.8443583694124028,,COMPLETE
267,18.14324847162622,2025-05-04 05:15:08.653094,2025-05-04 05:15:27.127145,0 days 00:00:18.474051,,,,,,none,,,,,,0.4745470294269476,0.08454619813736221,10.0,887.0,26.0,LightGBM,,,,,,,robust,,,,,,,6.883955029777041,329.1774651031671,0.8465284786552778,,COMPLETE
268,18.221368244434498,2025-05-04 05:15:10.430966,2025-05-04 05:15:29.315432,0 days 00:00:18.884466,,,,,,none,,,,,,0.47881565845531016,0.08418594522966064,10.0,894.0,27.0,LightGBM,,,,,,,robust,,,,,,,6.856837539971094,332.0182606992859,0.8452040221897384,,COMPLETE
269,17.997357937812954,2025-05-04 05:15:10.616182,2025-05-04 05:15:30.264435,0 days 00:00:19.648253,,,,,,none,,,,,,0.47604963471458056,0.08647615445001276,12.0,882.0,26.0,LightGBM,,,,,,,robust,,,,,,,6.785351141744929,323.9048927417589,0.8489866958405029,,COMPLETE
270,18.518669340532792,2025-05-04 05:15:11.075685,2025-05-04 05:15:28.973282,0 days 00:00:17.897597,,,,,,none,,,,,,0.47677432411605375,0.08896386695696004,10.0,893.0,26.0,LightGBM,,,,,,,robust,,,,,,,6.910331687238026,342.94111414398924,0.8401114897010438,,COMPLETE
