number,value,datetime_start,datetime_complete,duration,params_dt_criterion,params_dt_max_depth,params_dt_min_samples_leaf,params_dt_min_samples_split,params_dt_splitter,params_feature_selector,params_hgb_learning_rate,params_hgb_max_bins,params_hgb_max_depth,params_hgb_max_iter,params_lasso_alpha,params_lgb_feature_fraction,params_lgb_learning_rate,params_lgb_max_depth,params_lgb_n_estimators,params_lgb_num_leaves,params_model,params_rf_bootstrap,params_rf_criterion,params_rf_max_depth,params_rf_min_samples_leaf,params_rf_min_samples_split,params_rf_n_estimators,params_scaler,params_xgb_alpha,params_xgb_booster,params_xgb_lambda,params_xgb_learning_rate,params_xgb_max_depth,params_xgb_n_estimators,user_attrs_MAE,user_attrs_MSE,user_attrs_R2,user_attrs_error,state
486,18.878391403131108,2025-05-04 05:17:30.002461,2025-05-04 05:17:40.165404,0 days 00:00:10.162943,,,,,,none,,,,,,0.41905934549460305,0.22767249247286803,13.0,524.0,22.0,LightGBM,,,,,,,robust,,,,,,,7.3192841125025705,356.3936619698145,0.833839544626842,,COMPLETE
487,18.124138149460112,2025-05-04 05:17:31.066796,2025-05-04 05:17:43.077891,0 days 00:00:12.011095,,,,,,none,,,,,,0.46893301828781503,0.16489899396154784,13.0,748.0,20.0,LightGBM,,,,,,,robust,,,,,,,6.934709497215805,328.4843836607155,0.8468516121460699,,COMPLETE
488,18.773586288292215,2025-05-04 05:17:31.182833,2025-05-04 05:17:55.547173,0 days 00:00:24.364340,,,,,,none,,,,,,0.4217350098380241,0.16723517981863112,13.0,621.0,293.0,LightGBM,,,,,,,robust,,,,,,,7.367137912951176,352.44754212395344,0.8356793334348732,,COMPLETE
489,18.549216638967362,2025-05-04 05:17:31.298206,2025-05-04 05:17:43.458219,0 days 00:00:12.160013,,,,,,none,,,,,,0.4275474578054666,0.16760605118191635,14.0,741.0,21.0,LightGBM,,,,,,,robust,,,,,,,7.306601148516679,344.0734379193437,0.8395835694425777,,COMPLETE
490,18.698170272123388,2025-05-04 05:17:31.746796,2025-05-04 05:17:44.906649,0 days 00:00:13.159853,,,,,,none,,,,,,0.4340265223043023,0.1664690472598375,13.0,638.0,30.0,LightGBM,,,,,,,robust,,,,,,,7.254251525438341,349.62157152531876,0.8369968780818373,,COMPLETE
491,18.54925388739846,2025-05-04 05:17:32.011498,2025-05-04 05:18:03.268499,0 days 00:00:31.257001,,,,,,none,,,,,,0.43104204175459726,0.17814384408375258,13.0,947.0,291.0,LightGBM,,,,,,,robust,,,,,,,7.467375516527533,344.0748197791669,0.839582925181801,,COMPLETE
492,18.421758084835385,2025-05-04 05:17:32.617753,2025-05-04 05:17:48.686646,0 days 00:00:16.068893,,,,,,none,,,,,,0.43417984350947736,0.16494240992361311,13.0,999.0,30.0,LightGBM,,,,,,,robust,,,,,,,7.121226126318235,339.36117093619794,0.8417805569631518,,COMPLETE
493,18.105009036629305,2025-05-04 05:17:33.203285,2025-05-04 05:17:45.028565,0 days 00:00:11.825280,,,,,,none,,,,,,0.46909186451605867,0.22531310428526827,13.0,591.0,30.0,LightGBM,,,,,,,robust,,,,,,,7.0499956499266645,327.7913522164288,0.8471747223263523,,COMPLETE
494,18.610490021207447,2025-05-04 05:17:33.782650,2025-05-04 05:18:03.861188,0 days 00:00:30.078538,,,,,,none,,,,,,0.427050654572947,0.1723990498236992,13.0,745.0,288.0,LightGBM,,,,,,,robust,,,,,,,7.3996489584519525,346.350338829462,0.8385220160749511,,COMPLETE
495,18.129431394154825,2025-05-04 05:17:34.458710,2025-05-04 05:17:47.027229,0 days 00:00:12.568519,,,,,,none,,,,,,0.4259839561582546,0.1764794510097347,14.0,738.0,30.0,LightGBM,,,,,,,robust,,,,,,,7.092314944775665,328.6762826753665,0.8467621435862648,,COMPLETE
496,17.847369077265164,2025-05-04 05:17:34.989154,2025-05-04 05:17:47.361949,0 days 00:00:12.372795,,,,,,none,,,,,,0.5326984438595435,0.17276420916523116,14.0,744.0,30.0,LightGBM,,,,,,,robust,,,,,,,6.816060432725918,318.52858298012075,0.8514932782339255,,COMPLETE
497,18.230123650019035,2025-05-04 05:17:35.415841,2025-05-04 05:17:49.549626,0 days 00:00:14.133785,,,,,,none,,,,,,0.4658657214355668,0.17009244713294067,14.0,998.0,30.0,LightGBM,,,,,,,standard,,,,,,,6.878825297533205,332.3374082949834,0.8450552268673435,,COMPLETE
498,,2025-05-04 05:17:35.541478,2025-05-04 05:17:35.624249,0 days 00:00:00.082771,,,,,,lasso,,,,,0.011425371413691545,0.46708427218885884,0.17337990284841623,13.0,743.0,30.0,LightGBM,,,,,,,standard,,,,,,,,,,"Input X contains NaN.
Lasso does not accept missing values encoded as NaN natively. For supervised learning, you might want to consider sklearn.ensemble.HistGradientBoostingClassifier and Regressor which accept missing values encoded as NaNs natively. Alternatively, it is possible to preprocess the data, for instance by using an imputer transformer in a pipeline or drop samples with missing values. See https://scikit-learn.org/stable/modules/impute.html You can find a list of all estimators that handle NaN values at the following page: https://scikit-learn.org/stable/modules/impute.html#estimators-that-handle-nan-values",PRUNED
499,19.381545836380322,2025-05-04 05:17:35.626663,2025-05-04 05:18:03.488273,0 days 00:00:27.861610,,,,,,none,,,,,,0.4661818932121781,0.17621895911716945,14.0,997.0,263.0,LightGBM,,,,,,,robust,,,,,,,7.40374661343022,375.64431900771143,0.8248643627395715,,COMPLETE
