number,value,datetime_start,datetime_complete,duration,params_dt_criterion,params_dt_max_depth,params_dt_min_samples_leaf,params_dt_min_samples_split,params_dt_splitter,params_feature_selector,params_hgb_learning_rate,params_hgb_max_bins,params_hgb_max_depth,params_hgb_max_iter,params_lasso_alpha,params_lgb_feature_fraction,params_lgb_learning_rate,params_lgb_max_depth,params_lgb_n_estimators,params_lgb_num_leaves,params_model,params_rf_bootstrap,params_rf_criterion,params_rf_max_depth,params_rf_min_samples_leaf,params_rf_min_samples_split,params_rf_n_estimators,params_scaler,params_xgb_alpha,params_xgb_booster,params_xgb_lambda,params_xgb_learning_rate,params_xgb_max_depth,params_xgb_n_estimators,user_attrs_MAE,user_attrs_MSE,user_attrs_R2,user_attrs_error,state
45,22.608384284330512,2025-05-04 05:13:20.735703,2025-05-04 05:14:05.984317,0 days 00:00:45.248614,,,,,,none,0.012652894735105058,132.0,8.0,317.0,,,,,,,HistGradientBosting,,,,,,,robust,,,,,,,8.241724616956727,511.13903994796294,0.7616930245972058,,COMPLETE
46,24.12000659831892,2025-05-04 05:13:20.752746,2025-05-04 05:14:04.227597,0 days 00:00:43.474851,,,,,,none,0.010203866715467592,139.0,10.0,287.0,,,,,,,HistGradientBosting,,,,,,,robust,,,,,,,8.6979274705508,581.7747183029483,0.728760742872032,,COMPLETE
47,23.567123978119394,2025-05-04 05:13:20.773067,2025-05-04 05:14:04.850351,0 days 00:00:44.077284,,,,,,none,0.011599434863463702,133.0,9.0,300.0,,,,,,,HistGradientBosting,,,,,,,robust,,,,,,,8.465053790919583,555.4093326000501,0.741053005507313,,COMPLETE
48,23.101902607895045,2025-05-04 05:13:20.785886,2025-05-04 05:14:04.759357,0 days 00:00:43.973471,,,,,,none,0.012057377019685765,135.0,8.0,301.0,,,,,,,HistGradientBosting,,,,,,,robust,,,,,,,8.352598640064286,533.6979041046679,0.751175466231376,,COMPLETE
49,23.791215841885556,2025-05-04 05:13:20.793283,2025-05-04 05:14:05.197169,0 days 00:00:44.403886,,,,,,none,0.010082102853575966,154.0,8.0,301.0,,,,,,,HistGradientBosting,,,,,,,robust,,,,,,,8.623870143584758,566.0219512351863,0.7361051129567848,,COMPLETE
50,23.5892428250226,2025-05-04 05:13:20.854627,2025-05-04 05:14:05.365448,0 days 00:00:44.510821,,,,,,none,0.011442817797137567,134.0,8.0,304.0,,,,,,,HistGradientBosting,,,,,,,robust,,,,,,,8.47658519323645,556.4523770578801,0.7405667097041566,,COMPLETE
51,24.224012991206205,2025-05-04 05:13:20.877106,2025-05-04 05:14:03.132578,0 days 00:00:42.255472,,,,,,none,0.01007614335858282,139.0,8.0,281.0,,,,,,,HistGradientBosting,,,,,,,robust,,,,,,,8.709978767589348,586.802805398127,0.7264165113927933,,COMPLETE
52,23.898659688126706,2025-05-04 05:13:20.905845,2025-05-04 05:14:03.545661,0 days 00:00:42.639816,,,,,,none,0.011277126169317106,139.0,8.0,289.0,,,,,,,HistGradientBosting,,,,,,,robust,,,,,,,8.515933399930928,571.1459348888925,0.7337161718838189,,COMPLETE
53,,2025-05-04 05:13:20.925446,2025-05-04 05:13:21.483367,0 days 00:00:00.557921,,,,,,none,,,,,,,,,,,RandomForest,False,mae,6.0,1.0,2.0,259.0,robust,,,,,,,,,,"The 'criterion' parameter of RandomForestRegressor must be a str among {'friedman_mse', 'absolute_error', 'poisson', 'squared_error'}. Got 'mae' instead.",PRUNED
54,,2025-05-04 05:13:20.938818,2025-05-04 05:13:21.494149,0 days 00:00:00.555331,,,,,,none,,,,,,,,,,,RandomForest,False,mae,7.0,4.0,2.0,266.0,robust,,,,,,,,,,"The 'criterion' parameter of RandomForestRegressor must be a str among {'friedman_mse', 'absolute_error', 'poisson', 'squared_error'}. Got 'mae' instead.",PRUNED
55,,2025-05-04 05:13:20.955122,2025-05-04 05:13:21.492366,0 days 00:00:00.537244,,,,,,none,,,,,,,,,,,RandomForest,False,mae,7.0,1.0,2.0,262.0,robust,,,,,,,,,,"The 'criterion' parameter of RandomForestRegressor must be a str among {'friedman_mse', 'absolute_error', 'poisson', 'squared_error'}. Got 'mae' instead.",PRUNED
56,,2025-05-04 05:13:20.959964,2025-05-04 05:13:21.489995,0 days 00:00:00.530031,,,,,,none,,,,,,,,,,,RandomForest,False,mae,7.0,1.0,2.0,260.0,robust,,,,,,,,,,"The 'criterion' parameter of RandomForestRegressor must be a str among {'friedman_mse', 'absolute_error', 'poisson', 'squared_error'}. Got 'mae' instead.",PRUNED
57,,2025-05-04 05:13:21.036710,2025-05-04 05:13:21.485546,0 days 00:00:00.448836,,,,,,none,,,,,,,,,,,RandomForest,False,mae,7.0,2.0,2.0,262.0,robust,,,,,,,,,,"The 'criterion' parameter of RandomForestRegressor must be a str among {'friedman_mse', 'absolute_error', 'poisson', 'squared_error'}. Got 'mae' instead.",PRUNED
58,22.567507061485383,2025-05-04 05:13:21.235461,2025-05-04 05:13:22.579917,0 days 00:00:01.344456,,,,,,none,,,,,,,,,,,XGBoost,,,,,,,maxabs,0.012247709929376294,dart,0.6880518155993521,0.08407884950881454,10.0,25.0,8.409874279081999,509.2923749701926,0.7625539898872375,,COMPLETE
59,23.335572429334533,2025-05-04 05:13:21.497713,2025-05-04 05:13:22.451587,0 days 00:00:00.953874,,,,,,none,,,,,,,,,,,XGBoost,,,,,,,maxabs,0.030714975752073936,dart,0.6785100198529612,0.08592021611850478,8.0,21.0,8.936450875042759,544.548940604718,0.7461163997650146,,COMPLETE
60,22.655773539839252,2025-05-04 05:13:21.506535,2025-05-04 05:13:22.822928,0 days 00:00:01.316393,,,,,,none,,,,,,,,,,,XGBoost,,,,,,,maxabs,0.07707111338007344,dart,0.633169407900902,0.0846552870776972,10.0,24.0,8.52816188542432,513.2840746884804,0.7606929540634155,,COMPLETE
61,22.57881079577457,2025-05-04 05:13:21.514047,2025-05-04 05:13:22.810886,0 days 00:00:01.296839,,,,,,none,,,,,,,,,,,XGBoost,,,,,,,maxabs,0.05034597060810453,dart,0.6653771518362642,0.08904307929582338,10.0,24.0,8.356722058203705,509.8026969513862,0.762316107749939,,COMPLETE
62,21.923422542852613,2025-05-04 05:13:21.521356,2025-05-04 05:13:23.215068,0 days 00:00:01.693712,,,,,,none,,,,,,,,,,,XGBoost,,,,,,,maxabs,0.0433108058068683,dart,0.6557669943748108,0.08141194772520252,10.0,30.0,8.04310284929223,480.6364559924582,0.775914192199707,,COMPLETE
63,22.539759645043844,2025-05-04 05:13:21.530752,2025-05-04 05:13:22.955499,0 days 00:00:01.424747,,,,,,none,,,,,,,,,,,XGBoost,,,,,,,maxabs,0.03875004929870385,dart,0.7514205964964072,0.07923237466237598,10.0,26.0,8.446812668476808,508.0407648563469,0.7631375193595886,,COMPLETE
64,32.138328112893454,2025-05-04 05:13:21.754983,2025-05-04 05:13:22.352679,0 days 00:00:00.597696,,,,,,none,,,,,,,,,,,XGBoost,,,,,,,maxabs,0.04877511548756597,gblinear,0.8056283226311809,0.12839292575148173,9.0,187.0,11.152564977217988,1032.8721338919977,0.5184468030929565,,COMPLETE
65,32.14061759036242,2025-05-04 05:13:22.360858,2025-05-04 05:13:23.236192,0 days 00:00:00.875334,,,,,,none,,,,,,,,,,,XGBoost,,,,,,,maxabs,0.05015569955627919,gblinear,0.8186602304689264,0.12165250623719531,9.0,200.0,11.157715183573474,1033.019299089914,0.5183781981468201,,COMPLETE
66,18.729780487422662,2025-05-04 05:13:22.460398,2025-05-04 05:13:47.139449,0 days 00:00:24.679051,,,,,,none,,,,,,,,,,,XGBoost,,,,,,,maxabs,0.030784853881290014,dart,0.6697887946229898,0.09520970562239602,8.0,188.0,6.576762894966096,350.8046771070387,0.8364452719688416,,COMPLETE
67,25.594999919831398,2025-05-04 05:13:22.586530,2025-05-04 05:13:23.565272,0 days 00:00:00.978742,,,,,,none,,,,,,,,,,,XGBoost,,,,,,,maxabs,0.013747330642123575,dart,0.6228073567542851,0.06008327275062158,10.0,21.0,10.588753198981538,655.1040208961692,0.6945726275444031,,COMPLETE
68,31.341156537348365,2025-05-04 05:13:22.819247,2025-05-04 05:13:23.584242,0 days 00:00:00.764995,,,,,,none,,,,,,,,,,,XGBoost,,,,,,,maxabs,0.008172909298821243,dart,0.5895630950849735,0.04736397888706406,3.0,24.0,13.34380802508382,982.2680930985742,0.5420397520065308,,COMPLETE
69,32.10432455423148,2025-05-04 05:13:22.831843,2025-05-04 05:13:23.434494,0 days 00:00:00.602651,,,,,,none,,,,,,,,,,,XGBoost,,,,,,,maxabs,0.013523441992589005,dart,0.5712345693346457,0.05091398681941613,3.0,20.0,13.858315973552493,1030.6876550834306,0.5194653272628784,,COMPLETE
70,29.211775005502844,2025-05-04 05:13:22.965289,2025-05-04 05:13:27.155659,0 days 00:00:04.190370,,,,,,none,,,,,,,,,,,XGBoost,,,,,,,maxabs,0.18708765561856155,dart,0.5503714759635453,0.040059989419729616,30.0,21.0,13.018138593054081,853.3277989721207,0.602155327796936,,COMPLETE
71,22.445703840269452,2025-05-04 05:13:23.223761,2025-05-04 05:13:30.057860,0 days 00:00:06.834099,,,,,,none,0.8677583405851971,129.0,5.0,132.0,,,,,,,HistGradientBosting,,,,,,,maxabs,,,,,,,9.071148289698241,503.80962088508676,0.7651101998701245,,COMPLETE
72,24.055227064489205,2025-05-04 05:13:23.242454,2025-05-04 05:13:25.830134,0 days 00:00:02.587680,,,,,,none,0.9959616044531147,128.0,4.0,214.0,,,,,,,HistGradientBosting,,,,,,,maxabs,,,,,,,9.72524746032568,578.6539491241339,0.7302157306655865,,COMPLETE
73,28.409137423104696,2025-05-04 05:13:23.443618,2025-05-04 05:13:31.527980,0 days 00:00:08.084362,,,,,,none,0.01007837676092609,165.0,3.0,181.0,,,,,,,HistGradientBosting,,,,,,,maxabs,,,,,,,11.31422366024847,807.0790891248478,0.6237176939962064,,COMPLETE
74,21.460898061607356,2025-05-04 05:13:23.569633,2025-05-04 05:13:27.126633,0 days 00:00:03.557000,,,,,,none,0.7531601396078806,135.0,4.0,118.0,,,,,,,HistGradientBosting,,,,,,,maxabs,,,,,,,8.49023920719702,460.57014561070235,0.7852696237554366,,COMPLETE
75,24.279097959043494,2025-05-04 05:13:23.594258,2025-05-04 05:13:29.216758,0 days 00:00:05.622500,,,,,,none,,,,,,,,,,,XGBoost,,,,,,,maxabs,0.18397726469084374,dart,0.4733756078989396,0.03473072369905545,13.0,46.0,9.547835966834876,589.47459770483,0.7251708507537842,,COMPLETE
76,24.595009351480055,2025-05-04 05:13:25.856744,2025-05-04 05:13:30.143008,0 days 00:00:04.286264,,,,,,none,,,,,,,,,,,XGBoost,,,,,,,maxabs,0.2046056339233873,dart,0.43346134267127334,0.034469032576380676,13.0,44.0,9.806773687408718,604.9144849993913,0.7179723381996155,,COMPLETE
77,24.409316469477396,2025-05-04 05:13:26.101179,2025-05-04 05:13:30.334926,0 days 00:00:04.233747,,,,,,none,,,,,,,,,,,XGBoost,,,,,,,maxabs,0.21017888293390544,dart,0.4427998933040684,0.03430734718779439,13.0,45.0,9.708177036170685,595.8147305071004,0.722214937210083,,COMPLETE
78,23.617056057122063,2025-05-04 05:13:27.140812,2025-05-04 05:13:31.929302,0 days 00:00:04.788490,,,,,,none,0.08316364401871347,134.0,3.0,120.0,,,,,,,HistGradientBosting,,,,,,,maxabs,,,,,,,8.743625797527336,557.765336805246,0.7399545720238646,,COMPLETE
79,21.79129913820995,2025-05-04 05:13:27.160294,2025-05-04 05:13:35.689901,0 days 00:00:08.529607,,,,,,none,0.11572644649066846,131.0,5.0,145.0,,,,,,,HistGradientBosting,,,,,,,maxabs,,,,,,,8.058904349237345,474.8607181309497,0.778606968689173,,COMPLETE
80,21.855912322852163,2025-05-04 05:13:28.914611,2025-05-04 05:13:35.746499,0 days 00:00:06.831888,,,,,,none,0.14334707361569735,131.0,4.0,246.0,,,,,,,HistGradientBosting,,,,,,,maxabs,,,,,,,8.065355478696233,477.6809034642011,0.7772921212908782,,COMPLETE
81,22.282862351371048,2025-05-04 05:13:29.231965,2025-05-04 05:13:33.803685,0 days 00:00:04.571720,,,,,,none,0.13482500230919697,128.0,3.0,109.0,,,,,,,HistGradientBosting,,,,,,,maxabs,,,,,,,8.473584283090187,496.5259545701493,0.7685060439628252,,COMPLETE
82,22.88660481868243,2025-05-04 05:13:29.263334,2025-05-04 05:13:33.588845,0 days 00:00:04.325511,,,,,,none,0.12256228068324827,130.0,3.0,103.0,,,,,,,HistGradientBosting,,,,,,,maxabs,,,,,,,8.567171054411732,523.7966801265377,0.7557916871705046,,COMPLETE
83,21.667238324725872,2025-05-04 05:13:29.344469,2025-05-04 05:13:37.933873,0 days 00:00:08.589404,,,,,,none,0.11348241199858607,129.0,4.0,132.0,,,,,,,HistGradientBosting,,,,,,,maxabs,,,,,,,8.053270550623314,469.4692166204697,0.7811206338906667,,COMPLETE
84,22.42915686055496,2025-05-04 05:13:29.921517,2025-05-04 05:13:35.185560,0 days 00:00:05.264043,,,,,,none,0.12693145591226931,131.0,3.0,127.0,,,,,,,HistGradientBosting,,,,,,,maxabs,,,,,,,8.242292752996704,503.0670774753796,0.7654563938804482,,COMPLETE
85,21.13529324433141,2025-05-04 05:13:30.064689,2025-05-04 05:13:37.299946,0 days 00:00:07.235257,,,,,,none,0.30937161882187825,135.0,5.0,123.0,,,,,,,HistGradientBosting,,,,,,,maxabs,,,,,,,7.9306682708083365,446.700620523881,0.7917359750129145,,COMPLETE
86,20.827517897219114,2025-05-04 05:13:30.131318,2025-05-04 05:13:37.943280,0 days 00:00:07.811962,,,,,,none,0.2456955050520139,129.0,5.0,141.0,,,,,,,HistGradientBosting,,,,,,,maxabs,,,,,,,7.842835948406321,433.7855017589825,0.7977573559861703,,COMPLETE
87,21.966533717029222,2025-05-04 05:13:30.158624,2025-05-04 05:13:34.402051,0 days 00:00:04.243427,,,,,,none,0.2785414663491943,137.0,3.0,102.0,,,,,,,HistGradientBosting,,,,,,,maxabs,,,,,,,8.323988423537283,482.52860354138164,0.7750319911643075,,COMPLETE
88,21.504525096818412,2025-05-04 05:13:30.350531,2025-05-04 05:13:34.022052,0 days 00:00:03.671521,,,,,,none,0.25766398521054534,128.0,3.0,114.0,,,,,,,HistGradientBosting,,,,,,,maxabs,,,,,,,8.202636718558045,462.44459963969297,0.7843957021112871,,COMPLETE
89,21.33518128231176,2025-05-04 05:13:30.369947,2025-05-04 05:13:34.595506,0 days 00:00:04.225559,,,,,,none,0.25603742555674447,128.0,3.0,104.0,,,,,,,HistGradientBosting,,,,,,,maxabs,,,,,,,8.077976425630018,455.189960349106,0.7877780130127476,,COMPLETE
90,21.059815243182534,2025-05-04 05:13:30.598861,2025-05-04 05:13:35.427099,0 days 00:00:04.828238,,,,,,none,0.28630878069981236,130.0,3.0,132.0,,,,,,,HistGradientBosting,,,,,,,maxabs,,,,,,,8.066921986978597,443.51581807698335,0.7932208168642685,,COMPLETE
91,19.50447187415104,2025-05-04 05:13:31.539565,2025-05-04 05:13:47.470534,0 days 00:00:15.930969,,,,,,none,0.22681976515928007,131.0,13.0,102.0,,,,,,,HistGradientBosting,,,,,,,maxabs,,,,,,,7.441058480951916,380.424423089549,0.8226357477115173,,COMPLETE
92,20.262152801222317,2025-05-04 05:13:31.940017,2025-05-04 05:13:41.387328,0 days 00:00:09.447311,,,,,,none,0.42224934735176123,173.0,15.0,415.0,,,,,,,HistGradientBosting,,,,,,,maxabs,,,,,,,7.7000218533442215,410.5548361400814,0.8085881265350165,,COMPLETE
93,21.56621172572754,2025-05-04 05:13:32.773592,2025-05-04 05:13:39.005980,0 days 00:00:06.232388,,,,,,none,0.5400266521154599,175.0,13.0,996.0,,,,,,,HistGradientBosting,,,,,,,standard,,,,,,,8.13244562858184,465.1014881989081,0.7831569881273321,,COMPLETE
94,24.05843629185483,2025-05-04 05:13:33.599847,2025-05-04 05:13:39.401463,0 days 00:00:05.801616,,,,,,none,0.877019573685976,176.0,16.0,468.0,,,,,,,HistGradientBosting,,,,,,,standard,,,,,,,8.99674083681597,578.8083568092375,0.7301437415871948,,COMPLETE
95,22.01316995316536,2025-05-04 05:13:33.813174,2025-05-04 05:13:38.371222,0 days 00:00:04.558048,,,,,,none,0.7871307660057384,164.0,13.0,946.0,,,,,,,HistGradientBosting,,,,,,,standard,,,,,,,8.589495536573782,484.57965138694215,0.7740757366615568,,COMPLETE
96,19.767200144278192,2025-05-04 05:13:34.031419,2025-05-04 05:13:46.400406,0 days 00:00:12.368987,,,,,,none,0.1768271996608651,128.0,11.0,950.0,,,,,,,HistGradientBosting,,,,,,,standard,,,,,,,7.515346267728901,390.74220154395175,0.8178253177028936,,COMPLETE
97,19.48000017141591,2025-05-04 05:13:34.070170,2025-05-04 05:13:52.675259,0 days 00:00:18.605089,,,,,,none,0.13997739553294397,185.0,12.0,975.0,,,,,,,HistGradientBosting,,,,,,,standard,,,,,,,7.520515118202909,379.4704066783638,0.8230805362087084,,COMPLETE
98,20.017290862180634,2025-05-04 05:13:34.418773,2025-05-04 05:13:44.661959,0 days 00:00:10.243186,,,,,,none,0.2823242247748578,183.0,12.0,966.0,,,,,,,HistGradientBosting,,,,,,,standard,,,,,,,7.5571979944016405,400.69193346114025,0.8131864810382254,,COMPLETE
99,20.794462547935453,2025-05-04 05:13:34.610396,2025-05-04 05:13:42.480727,0 days 00:00:07.870331,,,,,,none,0.24871710012195047,184.0,12.0,988.0,,,,,,,HistGradientBosting,,,,,,,standard,,,,,,,7.706736846359844,432.40967265749015,0.7983988050757979,,COMPLETE
100,20.28056627207579,2025-05-04 05:13:34.717144,2025-05-04 05:13:49.610280,0 days 00:00:14.893136,,,,,,none,0.29469133358846966,189.0,12.0,991.0,,,,,,,HistGradientBosting,,,,,,,standard,,,,,,,7.577247161090452,411.3013683160582,0.8082400728529577,,COMPLETE
101,,2025-05-04 05:13:35.196795,2025-05-04 05:13:35.328893,0 days 00:00:00.132098,,,,,,lasso,0.3204163746856725,190.0,12.0,985.0,0.0007870268181877197,,,,,,HistGradientBosting,,,,,,,standard,,,,,,,,,,"Input X contains NaN.
Lasso does not accept missing values encoded as NaN natively. For supervised learning, you might want to consider sklearn.ensemble.HistGradientBoostingClassifier and Regressor which accept missing values encoded as NaNs natively. Alternatively, it is possible to preprocess the data, for instance by using an imputer transformer in a pipeline or drop samples with missing values. See https://scikit-learn.org/stable/modules/impute.html You can find a list of all estimators that handle NaN values at the following page: https://scikit-learn.org/stable/modules/impute.html#estimators-that-handle-nan-values",PRUNED
102,21.559704608482907,2025-05-04 05:13:35.338576,2025-05-04 05:13:41.328798,0 days 00:00:05.990222,,,,,,none,0.49105721602285196,187.0,12.0,420.0,,,,,,,HistGradientBosting,,,,,,,standard,,,,,,,8.134989579365135,464.8208628050391,0.783287823347512,,COMPLETE
103,20.014435618914913,2025-05-04 05:13:35.436710,2025-05-04 05:13:44.073799,0 days 00:00:08.637089,,,,,,none,0.4577625211007347,154.0,11.0,402.0,,,,,,,HistGradientBosting,,,,,,,standard,,,,,,,7.955365084532937,400.5776331436899,0.813239770966817,,COMPLETE
104,20.989430323178738,2025-05-04 05:13:35.700562,2025-05-04 05:13:44.281779,0 days 00:00:08.581217,,,,,,none,0.5334666452487016,162.0,11.0,339.0,,,,,,,HistGradientBosting,,,,,,,standard,,,,,,,7.97793423195159,440.55618529157505,0.7946006784719152,,COMPLETE
105,20.80875078108024,2025-05-04 05:13:35.753249,2025-05-04 05:13:47.875943,0 days 00:00:12.122694,,,,,,none,0.24433170384645525,156.0,11.0,489.0,,,,,,,HistGradientBosting,,,,,,,standard,,,,,,,7.519338261032948,433.0041090691074,0.7981216625915607,,COMPLETE
106,22.189333213410976,2025-05-04 05:13:37.311805,2025-05-04 05:13:41.996296,0 days 00:00:04.684491,,,,,,none,0.4883387937136051,149.0,11.0,332.0,,,,,,,HistGradientBosting,,,,,,,standard,,,,,,,8.242602424319928,492.36650845578345,0.770445291301409,,COMPLETE
107,22.135668406583214,2025-05-04 05:13:37.947862,2025-05-04 05:13:42.712639,0 days 00:00:04.764777,,,,,,none,0.5411795645547545,152.0,10.0,310.0,,,,,,,HistGradientBosting,,,,,,,standard,,,,,,,8.231040189506889,489.9878158062063,0.7715543027570617,,COMPLETE
108,22.466219974097044,2025-05-04 05:13:37.958464,2025-05-04 05:13:43.250381,0 days 00:00:05.291917,,,,,,none,0.6292062595856125,151.0,12.0,324.0,,,,,,,HistGradientBosting,,,,,,,standard,,,,,,,8.58799298679444,504.731039924517,0.7646806091576102,,COMPLETE
109,22.594211211574766,2025-05-04 05:13:38.283409,2025-05-04 05:13:42.494623,0 days 00:00:04.211214,,,,,,none,0.6008575191318173,151.0,10.0,307.0,,,,,,,HistGradientBosting,,,,,,,standard,,,,,,,8.540734378914603,510.4983802732508,0.7619917176286728,,COMPLETE
110,20.23188437925001,2025-05-04 05:13:38.377002,2025-05-04 05:13:52.547781,0 days 00:00:14.170779,,,,,,none,0.45362954945794415,148.0,10.0,298.0,,,,,,,HistGradientBosting,,,,,,,standard,,,,,,,7.819156181854388,409.32914553534056,0.8091595769584183,,COMPLETE
111,,2025-05-04 05:13:39.014021,2025-05-04 05:13:39.128023,0 days 00:00:00.114002,,,,,,lasso,0.19424831134232576,149.0,8.0,343.0,0.9256349271247144,,,,,,HistGradientBosting,,,,,,,standard,,,,,,,,,,"Input X contains NaN.
Lasso does not accept missing values encoded as NaN natively. For supervised learning, you might want to consider sklearn.ensemble.HistGradientBoostingClassifier and Regressor which accept missing values encoded as NaNs natively. Alternatively, it is possible to preprocess the data, for instance by using an imputer transformer in a pipeline or drop samples with missing values. See https://scikit-learn.org/stable/modules/impute.html You can find a list of all estimators that handle NaN values at the following page: https://scikit-learn.org/stable/modules/impute.html#estimators-that-handle-nan-values",PRUNED
112,19.98343551786932,2025-05-04 05:13:39.138705,2025-05-04 05:13:49.363806,0 days 00:00:10.225101,,,,,,none,0.5157261325019848,209.0,9.0,299.0,,,,,,,HistGradientBosting,,,,,,,standard,,,,,,,7.912900878847446,399.3376950968411,0.8138178639367092,,COMPLETE
113,19.451980874304756,2025-05-04 05:13:39.408827,2025-05-04 05:13:50.558031,0 days 00:00:11.149204,,,,,,none,0.4914383871608925,212.0,10.0,294.0,,,,,,,HistGradientBosting,,,,,,,standard,,,,,,,7.853472499784296,378.37955993431797,0.8235891187427837,,COMPLETE
114,23.81556421108344,2025-05-04 05:13:39.542036,2025-05-04 05:13:45.039904,0 days 00:00:05.497868,,,,,,none,,,,,,0.6150265787863967,0.012596545122277602,10.0,274.0,26.0,LightGBM,,,,,,,robust,,,,,,,8.933915864495798,567.1810986922385,0.7355646867655785,,COMPLETE
115,20.005291462707866,2025-05-04 05:13:41.339721,2025-05-04 05:13:54.079439,0 days 00:00:12.739718,,,,,,none,0.2355617214898953,211.0,9.0,269.0,,,,,,,HistGradientBosting,,,,,,,robust,,,,,,,7.464625307353387,400.2116865078923,0.8134103852794013,,COMPLETE
116,20.13777149972318,2025-05-04 05:13:41.398192,2025-05-04 05:13:57.832102,0 days 00:00:16.433910,,,,,,none,0.205804677458949,151.0,9.0,573.0,,,,,,,HistGradientBosting,,,,,,,robust,,,,,,,7.443587987143641,405.5298409750631,0.8109309164719994,,COMPLETE
117,23.49427714584063,2025-05-04 05:13:42.006333,2025-05-04 05:13:51.792879,0 days 00:00:09.786546,,,,,,none,,,,,,0.6214857898932185,0.010406495416124997,10.0,344.0,36.0,LightGBM,,,,,,,robust,,,,,,,8.663869260015252,551.9810586055694,0.742651360441344,,COMPLETE
118,19.508182980864493,2025-05-04 05:13:42.145912,2025-05-04 05:14:06.406658,0 days 00:00:24.260746,,,,,,none,0.19762989691357355,211.0,8.0,597.0,,,,,,,HistGradientBosting,,,,,,,robust,,,,,,,7.321873970282204,380.5692032148911,0.8225682472643352,,COMPLETE
119,18.24062531348736,2025-05-04 05:13:42.493522,2025-05-04 05:14:09.272981,0 days 00:00:26.779459,,,,,,none,,,,,,0.6044835329373736,0.2806840029159492,10.0,997.0,34.0,LightGBM,,,,,,,robust,,,,,,,7.053943105560666,332.7204118270359,0.8448766601640423,,COMPLETE
