number,value,datetime_start,datetime_complete,duration,params_dt_criterion,params_dt_max_depth,params_dt_min_samples_leaf,params_dt_min_samples_split,params_dt_splitter,params_feature_selector,params_hgb_learning_rate,params_hgb_max_bins,params_hgb_max_depth,params_hgb_max_iter,params_lasso_alpha,params_lgb_feature_fraction,params_lgb_learning_rate,params_lgb_max_depth,params_lgb_n_estimators,params_lgb_num_leaves,params_model,params_rf_bootstrap,params_rf_criterion,params_rf_max_depth,params_rf_min_samples_leaf,params_rf_min_samples_split,params_rf_n_estimators,params_scaler,params_xgb_alpha,params_xgb_booster,params_xgb_lambda,params_xgb_learning_rate,params_xgb_max_depth,params_xgb_n_estimators,user_attrs_MAE,user_attrs_MSE,user_attrs_R2,user_attrs_error,state
120,18.181539583467764,2025-05-04 05:13:42.502844,2025-05-04 05:13:48.237309,0 days 00:00:05.734465,,,,,,none,,,,,,0.6111493096080968,0.28114029513055655,10.0,287.0,27.0,LightGBM,,,,,,,robust,,,,,,,7.117000825995421,330.5683816252051,0.8458799953982791,,COMPLETE
121,18.611637118363937,2025-05-04 05:13:42.724114,2025-05-04 05:13:54.302200,0 days 00:00:11.578086,,,,,,none,,,,,,0.5910963033684378,0.2968094390676694,10.0,344.0,67.0,LightGBM,,,,,,,robust,,,,,,,7.257385674261872,346.3930362256623,0.83850210938313,,COMPLETE
122,18.82414890306797,2025-05-04 05:13:43.257993,2025-05-04 05:13:49.239011,0 days 00:00:05.981018,,,,,,none,,,,,,0.5898412581297959,0.28920752507027664,9.0,368.0,21.0,LightGBM,,,,,,,robust,,,,,,,7.298008855803489,354.34858192487513,0.8347930167780119,,COMPLETE
123,,2025-05-04 05:13:43.386813,2025-05-04 05:13:43.557593,0 days 00:00:00.170780,,,,,,lasso,,,,,0.00010740911063177018,0.5983201398401318,0.2311260035218987,10.0,359.0,23.0,LightGBM,,,,,,,robust,,,,,,,,,,"Input X contains NaN.
Lasso does not accept missing values encoded as NaN natively. For supervised learning, you might want to consider sklearn.ensemble.HistGradientBoostingClassifier and Regressor which accept missing values encoded as NaNs natively. Alternatively, it is possible to preprocess the data, for instance by using an imputer transformer in a pipeline or drop samples with missing values. See https://scikit-learn.org/stable/modules/impute.html You can find a list of all estimators that handle NaN values at the following page: https://scikit-learn.org/stable/modules/impute.html#estimators-that-handle-nan-values",PRUNED
124,19.519391326731583,2025-05-04 05:13:43.568078,2025-05-04 05:14:44.441983,0 days 00:01:00.873905,,,,,,none,,,,,,0.7070451174628067,0.3473641558183692,10.0,990.0,218.0,LightGBM,,,,,,,standard,,,,,,,7.612098435464754,381.00663776608417,0.8223643033338498,,COMPLETE
125,19.880979045745384,2025-05-04 05:13:44.079827,2025-05-04 05:14:24.344946,0 days 00:00:40.265119,,,,,,none,0.05136782487190957,206.0,22.0,629.0,,,,,,,HistGradientBosting,,,,,,,standard,,,,,,,7.321457499594611,395.25332781736705,0.8157221074726847,,COMPLETE
126,20.513560489724195,2025-05-04 05:13:44.289025,2025-05-04 05:14:06.176850,0 days 00:00:21.887825,,,,,,none,0.06986080674810988,206.0,22.0,629.0,,,,,,,HistGradientBosting,,,,,,,standard,,,,,,,7.499007681708136,420.80616396557355,0.8038086776238079,,COMPLETE
127,19.363890338452663,2025-05-04 05:13:44.672264,2025-05-04 05:14:30.528258,0 days 00:00:45.855994,,,,,,none,,,,,,0.6966179079604246,0.2777988339938816,10.0,963.0,231.0,LightGBM,,,,,,,standard,,,,,,,7.525510852712025,374.9602490396204,0.8251832948349878,,COMPLETE
128,,2025-05-04 05:13:45.048735,2025-05-04 05:13:45.139721,0 days 00:00:00.090986,mse,30.0,34.0,5.0,random,none,,,,,,,,,,,DecisionTree,,,,,,,standard,,,,,,,,,,"The 'criterion' parameter of DecisionTreeRegressor must be a str among {'friedman_mse', 'absolute_error', 'poisson', 'squared_error'}. Got 'mse' instead.",PRUNED
129,20.635980070555956,2025-05-04 05:13:45.144452,2025-05-04 05:14:06.070462,0 days 00:00:20.926010,,,,,,none,0.07039802306952828,200.0,24.0,635.0,,,,,,,HistGradientBosting,,,,,,,standard,,,,,,,7.565283928744138,425.84367347238253,0.801460053159019,,COMPLETE
130,19.976071630225277,2025-05-04 05:13:46.410704,2025-05-04 05:14:09.131514,0 days 00:00:22.720810,,,,,,none,0.07927185367085311,201.0,23.0,889.0,,,,,,,HistGradientBosting,,,,,,,standard,,,,,,,7.432638705350563,399.04343777589116,0.8139550547334694,,COMPLETE
131,19.728551373834158,2025-05-04 05:13:47.148824,2025-05-04 05:14:35.123022,0 days 00:00:47.974198,,,,,,none,,,,,,0.7779975152331293,0.41558358476433616,10.0,931.0,228.0,LightGBM,,,,,,,standard,,,,,,,7.781338766388944,389.2157393100136,0.8185369960714122,,COMPLETE
132,19.664376774457995,2025-05-04 05:13:47.479057,2025-05-04 05:14:23.923035,0 days 00:00:36.443978,,,,,,none,,,,,,0.7726420115248332,0.28758613399063565,9.0,949.0,215.0,LightGBM,,,,,,,standard,,,,,,,7.164256175378636,386.687713927843,0.8197156305240416,,COMPLETE
133,19.140402162774812,2025-05-04 05:13:47.883626,2025-05-04 05:14:21.684457,0 days 00:00:33.800831,,,,,,none,,,,,,0.7929837777601121,0.2910640439775901,10.0,840.0,224.0,LightGBM,,,,,,,standard,,,,,,,7.233332700140802,366.35499495275474,0.8291952992285914,,COMPLETE
134,19.857324403291887,2025-05-04 05:13:48.246604,2025-05-04 05:14:40.047732,0 days 00:00:51.801128,,,,,,none,,,,,,0.7363423698995543,0.34191313404321383,10.0,972.0,90.0,LightGBM,,,,,,,standard,,,,,,,7.655892931864338,394.3133324575715,0.8161603589729189,,COMPLETE
135,18.894517163360483,2025-05-04 05:13:49.249005,2025-05-04 05:13:59.135727,0 days 00:00:09.886722,,,,,,none,,,,,,0.6240241358473344,0.3251072244050574,10.0,251.0,80.0,LightGBM,,,,,,,robust,,,,,,,7.531522520980686,357.00277883652393,0.833555557713639,,COMPLETE
136,19.27971801540282,2025-05-04 05:13:49.372466,2025-05-04 05:13:58.055141,0 days 00:00:08.682675,,,,,,none,,,,,,0.6387878173268502,0.3037492531349868,10.0,239.0,75.0,LightGBM,,,,,,,robust,,,,,,,7.578958903190715,371.70752675344806,0.8266998027697405,,COMPLETE
137,18.788899392446226,2025-05-04 05:13:49.618476,2025-05-04 05:14:00.275910,0 days 00:00:10.657434,,,,,,none,,,,,,0.626100188933449,0.34647775213265397,10.0,258.0,80.0,LightGBM,,,,,,,robust,,,,,,,7.551340412169268,353.0227403794662,0.8354111603042468,,COMPLETE
138,19.82957563711879,2025-05-04 05:13:50.487642,2025-05-04 05:14:00.175425,0 days 00:00:09.687783,,,,,,none,,,,,,0.65487958658589,0.33287571251269743,10.0,268.0,67.0,LightGBM,,,,,,,robust,,,,,,,7.4747366639187,393.212069948215,0.8166737976211506,,COMPLETE
139,19.628147876654033,2025-05-04 05:13:50.562075,2025-05-04 05:14:01.143084,0 days 00:00:10.581009,,,,,,none,,,,,,0.6250941036058116,0.3510106960008993,10.0,261.0,80.0,LightGBM,,,,,,,robust,,,,,,,7.610826751796259,385.2641890677982,0.8203793166784831,,COMPLETE
140,19.897602479918262,2025-05-04 05:13:50.653481,2025-05-04 05:13:59.687980,0 days 00:00:09.034499,,,,,,none,,,,,,0.5818876428686117,0.3565517113614847,9.0,240.0,111.0,LightGBM,,,,,,,robust,,,,,,,7.730368334693275,395.9145844488494,0.8154138115776389,,COMPLETE
141,19.220256745455163,2025-05-04 05:13:51.328681,2025-05-04 05:14:00.981128,0 days 00:00:09.652447,,,,,,none,,,,,,0.5720913737389721,0.3285646216185604,9.0,248.0,101.0,LightGBM,,,,,,,robust,,,,,,,7.500893777710043,369.4182693612147,0.8277671170666825,,COMPLETE
142,19.775740421966518,2025-05-04 05:13:51.799054,2025-05-04 05:14:00.016429,0 days 00:00:08.217375,,,,,,none,,,,,,0.5613704478165515,0.350968467618272,8.0,258.0,96.0,LightGBM,,,,,,,robust,,,,,,,7.637647942187604,391.07990923700044,0.8176678691563906,,COMPLETE
143,19.305806126540322,2025-05-04 05:13:52.553535,2025-05-04 05:14:00.650297,0 days 00:00:08.096762,,,,,,none,,,,,,0.5462836276988531,0.3404476045529842,8.0,250.0,93.0,LightGBM,,,,,,,robust,,,,,,,7.588970095958771,372.7141501955618,0.8262304874384677,,COMPLETE
144,19.68614638783017,2025-05-04 05:13:52.682922,2025-05-04 05:14:00.284572,0 days 00:00:07.601650,,,,,,none,,,,,,0.5425321755126499,0.31844567004198615,8.0,235.0,99.0,LightGBM,,,,,,,standard,,,,,,,7.707075114957774,387.5443596030789,0.8193162389223394,,COMPLETE
145,19.375175063582763,2025-05-04 05:13:54.085417,2025-05-04 05:14:02.193721,0 days 00:00:08.108304,,,,,,none,,,,,,0.5382375164299238,0.33285878725686935,8.0,236.0,101.0,LightGBM,,,,,,,robust,,,,,,,7.629346777807512,375.3974087444793,0.8249794790453673,,COMPLETE
146,19.70655529665574,2025-05-04 05:13:54.307166,2025-05-04 05:14:01.932930,0 days 00:00:07.625764,,,,,,none,,,,,,0.5451571383985477,0.3203994736439163,8.0,232.0,99.0,LightGBM,,,,,,,robust,,,,,,,7.7465335290777855,388.3483216601504,0.8189414098617792,,COMPLETE
147,19.82103589150713,2025-05-04 05:13:57.838082,2025-05-04 05:14:07.235737,0 days 00:00:09.397655,,,,,,none,,,,,,0.5342182296361488,0.37097942655312327,9.0,234.0,97.0,LightGBM,,,,,,,robust,,,,,,,7.852815107907077,392.8734638124138,0.8168316650461938,,COMPLETE
148,19.67428934685849,2025-05-04 05:13:58.060332,2025-05-04 05:14:06.429705,0 days 00:00:08.369373,,,,,,none,,,,,,0.55111240094583,0.35590065153829614,8.0,260.0,91.0,LightGBM,,,,,,,robust,,,,,,,7.721274641395278,387.07766130390945,0.8195338264110822,,COMPLETE
149,19.412124061170204,2025-05-04 05:13:59.141867,2025-05-04 05:14:07.303767,0 days 00:00:08.161900,,,,,,none,,,,,,0.5431992621153076,0.36856100399371733,8.0,242.0,94.0,LightGBM,,,,,,,robust,,,,,,,7.814649308941271,376.83056056626316,0.8243113045385304,,COMPLETE
150,19.676744451884016,2025-05-04 05:13:59.693805,2025-05-04 05:14:10.310375,0 days 00:00:10.616570,,,,,,none,,,,,,0.5472299936235232,0.3497462874376157,8.0,241.0,101.0,LightGBM,,,,,,,robust,,,,,,,7.76618238304816,387.17427222474845,0.819488783762142,,COMPLETE
151,19.479040289629545,2025-05-04 05:14:00.022467,2025-05-04 05:14:07.425107,0 days 00:00:07.402640,,,,,,none,,,,,,0.5543510870940513,0.37991089932825145,8.0,234.0,96.0,LightGBM,,,,,,,robust,,,,,,,7.724694906587625,379.4330106050111,0.8230979712790829,,COMPLETE
152,20.01516464225436,2025-05-04 05:14:00.181161,2025-05-04 05:14:08.295556,0 days 00:00:08.114395,,,,,,none,,,,,,0.6929067882603399,0.3904835453472955,8.0,254.0,81.0,LightGBM,,,,,,,robust,,,,,,,7.660015517087842,400.606815656549,0.8132261652825891,,COMPLETE
153,20.23909391635028,2025-05-04 05:14:00.285514,2025-05-04 05:14:21.476016,0 days 00:00:21.190502,,,,,,none,,,,,,0.5296609217510012,0.4606805245522295,11.0,453.0,58.0,LightGBM,,,,,,,robust,,,,,,,8.002874551767386,409.6209225548469,0.8090235425459076,,COMPLETE
154,20.582151971641277,2025-05-04 05:14:00.290287,2025-05-04 05:14:21.097201,0 days 00:00:20.806914,,,,,,none,,,,,,0.5327769220956106,0.46367875400107916,11.0,470.0,56.0,LightGBM,,,,,,,robust,,,,,,,8.006012538733893,423.6249797837369,0.8024944687308373,,COMPLETE
155,19.284716626574202,2025-05-04 05:14:00.657380,2025-05-04 05:14:07.794332,0 days 00:00:07.136952,,,,,,none,,,,,,0.5556804937514763,0.495416420264217,8.0,201.0,125.0,LightGBM,,,,,,,robust,,,,,,,8.126649937096154,371.9002953672675,0.8266099287790617,,COMPLETE
156,19.96011612672571,2025-05-04 05:14:00.986550,2025-05-04 05:14:08.022229,0 days 00:00:07.035679,,,,,,none,,,,,,0.5414899616384208,0.44588836370078144,8.0,192.0,105.0,LightGBM,,,,,,,robust,,,,,,,8.04001537255849,398.40623579237564,0.8142521356948996,,COMPLETE
157,20.20445403654162,2025-05-04 05:14:01.147545,2025-05-04 05:14:09.823719,0 days 00:00:08.676174,,,,,,none,,,,,,0.6733729219399769,0.4686145288447905,11.0,199.0,62.0,LightGBM,,,,,,,robust,,,,,,,7.836158138761618,408.21996291472294,0.8096767081787525,,COMPLETE
158,20.098261415003368,2025-05-04 05:14:01.941342,2025-05-04 05:14:16.720514,0 days 00:00:14.779172,,,,,,none,,,,,,0.6679345903931828,0.46780284345077716,11.0,320.0,60.0,LightGBM,,,,,,,robust,,,,,,,7.936420856407104,403.9401119058132,0.8116720915664344,,COMPLETE
159,20.322594268912898,2025-05-04 05:14:02.202693,2025-05-04 05:14:10.817865,0 days 00:00:08.615172,,,,,,none,,,,,,0.6978299017076058,0.48028550196208897,11.0,182.0,51.0,LightGBM,,,,,,,robust,,,,,,,7.977206368763389,413.0078378188514,0.8074444701811894,,COMPLETE
160,19.979221259596322,2025-05-04 05:14:03.138318,2025-05-04 05:14:09.977020,0 days 00:00:06.838702,,,,,,none,,,,,,0.6786427056508691,0.20895518789361353,11.0,193.0,50.0,LightGBM,,,,,,,robust,,,,,,,7.298577928017315,399.16928213990565,0.8138963826551973,,COMPLETE
161,21.078636402206858,2025-05-04 05:14:03.551947,2025-05-04 05:14:15.168266,0 days 00:00:11.616319,,,,,,none,,,,,,0.5228134604183383,0.49873872101244937,11.0,188.0,119.0,LightGBM,,,,,,,robust,,,,,,,8.50332254580685,444.3089125764401,0.7928510545557714,,COMPLETE
162,20.225270073089558,2025-05-04 05:14:04.233405,2025-05-04 05:14:11.544283,0 days 00:00:07.310878,,,,,,none,,,,,,0.680646056554167,0.49786031996508345,11.0,181.0,51.0,LightGBM,,,,,,,robust,,,,,,,8.02927053780014,409.06154952941205,0.8092843375222155,,COMPLETE
163,,2025-05-04 05:14:04.764213,2025-05-04 05:14:04.922442,0 days 00:00:00.158229,,,,,,lasso,,,,,0.005682213160794097,0.6841647150581905,0.48694153046491695,11.0,419.0,127.0,LightGBM,,,,,,,robust,,,,,,,,,,"Input X contains NaN.
Lasso does not accept missing values encoded as NaN natively. For supervised learning, you might want to consider sklearn.ensemble.HistGradientBoostingClassifier and Regressor which accept missing values encoded as NaNs natively. Alternatively, it is possible to preprocess the data, for instance by using an imputer transformer in a pipeline or drop samples with missing values. See https://scikit-learn.org/stable/modules/impute.html You can find a list of all estimators that handle NaN values at the following page: https://scikit-learn.org/stable/modules/impute.html#estimators-that-handle-nan-values",PRUNED
164,,2025-05-04 05:14:04.855372,2025-05-04 05:14:05.039063,0 days 00:00:00.183691,,,,,,lasso,,,,,0.003455619815386568,0.6711139429890782,0.2025118217249218,11.0,188.0,121.0,LightGBM,,,,,,,robust,,,,,,,,,,"Input X contains NaN.
Lasso does not accept missing values encoded as NaN natively. For supervised learning, you might want to consider sklearn.ensemble.HistGradientBoostingClassifier and Regressor which accept missing values encoded as NaNs natively. Alternatively, it is possible to preprocess the data, for instance by using an imputer transformer in a pipeline or drop samples with missing values. See https://scikit-learn.org/stable/modules/impute.html You can find a list of all estimators that handle NaN values at the following page: https://scikit-learn.org/stable/modules/impute.html#estimators-that-handle-nan-values",PRUNED
165,20.09085510984748,2025-05-04 05:14:04.930127,2025-05-04 05:14:12.260012,0 days 00:00:07.329885,,,,,,none,,,,,,0.6499289104958168,0.2095111636754474,11.0,184.0,62.0,LightGBM,,,,,,,robust,,,,,,,7.2968322580270994,403.6424590448846,0.8118108654566368,,COMPLETE
166,19.200025717911725,2025-05-04 05:14:05.044096,2025-05-04 05:14:18.046211,0 days 00:00:13.002115,,,,,,none,,,,,,0.5350568137369687,0.4730756187131248,9.0,312.0,67.0,LightGBM,,,,,,,robust,,,,,,,7.944148700588252,368.6409875684717,0.8281295070595953,,COMPLETE
167,19.85746146975873,2025-05-04 05:14:05.200892,2025-05-04 05:14:17.928277,0 days 00:00:12.727385,,,,,,none,,,,,,0.5177018631510847,0.43682861649145943,9.0,317.0,66.0,LightGBM,,,,,,,robust,,,,,,,7.975981604625034,394.3187760229525,0.8161578210341196,,COMPLETE
168,19.874823721286877,2025-05-04 05:14:05.371135,2025-05-04 05:14:18.782379,0 days 00:00:13.411244,,,,,,none,,,,,,0.5199473783605142,0.43768006310634133,9.0,312.0,68.0,LightGBM,,,,,,,robust,,,,,,,7.974029054652525,395.00861795222755,0.8158361978928149,,COMPLETE
169,19.720455182690454,2025-05-04 05:14:05.988647,2025-05-04 05:14:18.520117,0 days 00:00:12.531470,,,,,,none,,,,,,0.5256657681559711,0.43065606684474333,9.0,316.0,64.0,LightGBM,,,,,,,robust,,,,,,,8.034465954429429,388.8963526125028,0.8186859028696005,,COMPLETE
170,19.899572285835486,2025-05-04 05:14:06.074544,2025-05-04 05:14:17.853059,0 days 00:00:11.778515,,,,,,none,,,,,,0.5144807673339608,0.4840077830670513,9.0,302.0,58.0,LightGBM,,,,,,,robust,,,,,,,8.13078160543766,395.9929771591917,0.8153772627558209,,COMPLETE
171,20.24521893645979,2025-05-04 05:14:06.181862,2025-05-04 05:14:18.727187,0 days 00:00:12.545325,,,,,,none,,,,,,0.5290722737746572,0.4488810205046527,9.0,317.0,67.0,LightGBM,,,,,,,robust,,,,,,,7.883878266355695,409.86888978519,0.8089079334531878,,COMPLETE
172,20.089675926820163,2025-05-04 05:14:06.412028,2025-05-04 05:14:14.858757,0 days 00:00:08.446729,,,,,,none,,,,,,0.5166174068399328,0.4705810429351134,9.0,175.0,50.0,LightGBM,,,,,,,robust,,,,,,,8.14591257668266,403.5950788446576,0.811832955399544,,COMPLETE
173,20.093939470737226,2025-05-04 05:14:06.435872,2025-05-04 05:14:13.336997,0 days 00:00:06.901125,,,,,,none,,,,,,0.5135853811146966,0.4737852859243748,9.0,183.0,53.0,LightGBM,,,,,,,robust,,,,,,,8.11163085998299,403.7664034536515,0.8117530791893731,,COMPLETE
174,20.48934071050632,2025-05-04 05:14:07.239690,2025-05-04 05:14:10.485395,0 days 00:00:03.245705,,,,,,none,,,,,,0.5079797849515982,0.19752411976890175,6.0,171.0,58.0,LightGBM,,,,,,,robust,,,,,,,7.761172754584692,419.8130827512116,0.8042716791987766,,COMPLETE
175,19.323665779539823,2025-05-04 05:14:07.307274,2025-05-04 05:14:11.865220,0 days 00:00:04.557946,,,,,,none,,,,,,0.5278181394513617,0.46759641952718517,7.0,168.0,55.0,LightGBM,,,,,,,robust,,,,,,,7.970142972351912,373.4040591593584,0.8259088330438389,,COMPLETE
176,19.94671836692222,2025-05-04 05:14:07.429671,2025-05-04 05:14:12.125644,0 days 00:00:04.695973,,,,,,none,,,,,,0.4951189918174642,0.5041078150647903,7.0,174.0,50.0,LightGBM,,,,,,,robust,,,,,,,8.0896803319141,397.8715736093122,0.8145014098018453,,COMPLETE
177,19.803745994133674,2025-05-04 05:14:07.797695,2025-05-04 05:14:12.643797,0 days 00:00:04.846102,,,,,,none,,,,,,0.5111063501017757,0.48809821975657147,7.0,169.0,70.0,LightGBM,,,,,,,robust,,,,,,,8.07376444006517,392.1883554001655,0.8171510812926274,,COMPLETE
178,19.50782141931345,2025-05-04 05:14:08.026700,2025-05-04 05:14:15.225125,0 days 00:00:07.198425,,,,,,none,,,,,,0.5800578279156083,0.24240211284457278,7.0,317.0,57.0,LightGBM,,,,,,,robust,,,,,,,7.409748342142065,380.55509652782473,0.8225748241869825,,COMPLETE
179,20.14288626820533,2025-05-04 05:14:08.298671,2025-05-04 05:14:12.475992,0 days 00:00:04.177321,,,,,,none,,,,,,0.5196522816212458,0.23659154603699462,7.0,173.0,51.0,LightGBM,,,,,,,robust,,,,,,,7.601762053118565,405.7358672138548,0.8108348614146024,,COMPLETE
180,19.503584016582412,2025-05-04 05:14:09.013533,2025-05-04 05:14:15.285919,0 days 00:00:06.272386,,,,,,none,,,,,,0.5036309117836693,0.2736682054994535,6.0,328.0,55.0,LightGBM,,,,,,,robust,,,,,,,7.553647719432607,380.3897894918889,0.8226518948403034,,COMPLETE
181,19.816485107478073,2025-05-04 05:14:09.135497,2025-05-04 05:14:14.943641,0 days 00:00:05.808144,,,,,,none,,,,,,0.49749979356108454,0.23508339895015332,6.0,314.0,142.0,LightGBM,,,,,,,robust,,,,,,,7.667716275348539,392.6930820149003,0.8169157639649293,,COMPLETE
182,18.94238880905109,2025-05-04 05:14:09.276848,2025-05-04 05:14:28.104972,0 days 00:00:18.828124,,,,,,none,,,,,,0.4995961080024366,0.23015681495509718,6.0,930.0,46.0,LightGBM,,,,,,,robust,,,,,,,7.293350953898456,358.8140937932639,0.8327110732287785,,COMPLETE
183,18.081574814505913,2025-05-04 05:14:09.828094,2025-05-04 05:14:38.127351,0 days 00:00:28.299257,,,,,,none,,,,,,0.5032156837131627,0.24905237338931938,9.0,914.0,42.0,LightGBM,,,,,,,robust,,,,,,,7.131847421999826,326.9433477725746,0.8475700851500638,,COMPLETE
184,18.997342716643047,2025-05-04 05:14:09.981588,2025-05-04 05:14:56.339134,0 days 00:00:46.357546,,,,,,none,,,,,,0.5140585573683495,0.2720630191304226,9.0,954.0,143.0,LightGBM,,,,,,,robust,,,,,,,7.434219148395536,360.89903029359067,0.8317390189099568,,COMPLETE
185,18.15005278659119,2025-05-04 05:14:10.314010,2025-05-04 05:14:30.564888,0 days 00:00:20.250878,,,,,,none,,,,,,0.5024256056611535,0.26183913629364464,6.0,963.0,142.0,LightGBM,,,,,,,robust,,,,,,,7.206957185548467,329.42441615604656,0.846413343332235,,COMPLETE
186,19.40707421001076,2025-05-04 05:14:10.490031,2025-05-04 05:14:22.442463,0 days 00:00:11.952432,,,,,,none,,,,,,0.5851793977669313,0.2621634909441036,9.0,315.0,145.0,LightGBM,,,,,,,robust,,,,,,,7.338977811742041,376.63452939286475,0.8244026996235585,,COMPLETE
187,19.659719698990113,2025-05-04 05:14:10.822221,2025-05-04 05:14:23.112839,0 days 00:00:12.290618,,,,,,none,,,,,,0.5821863891694739,0.2704408670368869,9.0,326.0,135.0,LightGBM,,,,,,,robust,,,,,,,7.397768538755087,386.5045786428598,0.8198010131938105,,COMPLETE
188,19.098051753119407,2025-05-04 05:14:11.547689,2025-05-04 05:14:52.876789,0 days 00:00:41.329100,,,,,,none,,,,,,0.5860519099283975,0.2605214980969918,9.0,941.0,138.0,LightGBM,,,,,,,robust,,,,,,,7.295707066736192,364.73558076482726,0.8299503143358088,,COMPLETE
189,18.699609923927383,2025-05-04 05:14:11.870199,2025-05-04 05:14:55.077116,0 days 00:00:43.206917,,,,,,none,,,,,,0.42249507299243977,0.25819563226424364,9.0,838.0,152.0,LightGBM,,,,,,,robust,,,,,,,7.515568688758245,349.67541130704353,0.8369717765056782,,COMPLETE
190,19.80073324595437,2025-05-04 05:14:12.129403,2025-05-04 05:14:52.673587,0 days 00:00:40.544184,,,,,,none,,,,,,0.5856201621491772,0.2847480877742155,9.0,909.0,144.0,LightGBM,,,,,,,robust,,,,,,,7.4568112171412,392.06903707744266,0.8172067107522771,,COMPLETE
191,18.776876895414457,2025-05-04 05:14:12.264222,2025-05-04 05:14:55.603888,0 days 00:00:43.339666,,,,,,none,,,,,,0.4465675419801393,0.26852520155578957,9.0,996.0,76.0,LightGBM,,,,,,,robust,,,,,,,7.6121188293911715,352.5711059455493,0.8356217246077393,,COMPLETE
192,18.866506946196065,2025-05-04 05:14:12.479719,2025-05-04 05:14:58.238340,0 days 00:00:45.758621,,,,,,none,,,,,,0.4475170240085762,0.2774801968832798,9.0,851.0,145.0,LightGBM,,,,,,,robust,,,,,,,7.580202288791772,355.9450843508643,0.8340486837597407,,COMPLETE
193,18.541599271242198,2025-05-04 05:14:12.647685,2025-05-04 05:14:53.336539,0 days 00:00:40.688854,,,,,,none,,,,,,0.5856334027083391,0.2815148947275946,9.0,886.0,140.0,LightGBM,,,,,,,robust,,,,,,,7.333543721425999,343.79090353532916,0.8397152946860822,,COMPLETE
