number,value,datetime_start,datetime_complete,duration,params_dt_criterion,params_dt_max_depth,params_dt_min_samples_leaf,params_dt_min_samples_split,params_dt_splitter,params_feature_selector,params_hgb_learning_rate,params_hgb_max_bins,params_hgb_max_depth,params_hgb_max_iter,params_lasso_alpha,params_lgb_feature_fraction,params_lgb_learning_rate,params_lgb_max_depth,params_lgb_n_estimators,params_lgb_num_leaves,params_model,params_rf_bootstrap,params_rf_criterion,params_rf_max_depth,params_rf_min_samples_leaf,params_rf_min_samples_split,params_rf_n_estimators,params_scaler,params_xgb_alpha,params_xgb_booster,params_xgb_lambda,params_xgb_learning_rate,params_xgb_max_depth,params_xgb_n_estimators,user_attrs_MAE,user_attrs_MSE,user_attrs_R2,user_attrs_error,state
Lasso does not accept missing values encoded as NaN natively. For supervised learning, you might want to consider sklearn.ensemble.HistGradientBoostingClassifier and Regressor which accept missing values encoded as NaNs natively. Alternatively, it is possible to preprocess the data, for instance by using an imputer transformer in a pipeline or drop samples with missing values. See https://scikit-learn.org/stable/modules/impute.html You can find a list of all estimators that handle NaN values at the following page: https://scikit-learn.org/stable/modules/impute.html#estimators-that-handle-nan-values",PRUNED
33,,2025-05-04 05:04:42.698035,2025-05-04 05:04:42.883563,0 days 00:00:00.185528,,,,,,lasso,0.01980580071406739,207.0,16.0,209.0,0.0001399859577725362,,,,,,HistGradientBosting,,,,,,,standard,,,,,,,,,,"Input X contains NaN.
Lasso does not accept missing values encoded as NaN natively. For supervised learning, you might want to consider sklearn.ensemble.HistGradientBoostingClassifier and Regressor which accept missing values encoded as NaNs natively. Alternatively, it is possible to preprocess the data, for instance by using an imputer transformer in a pipeline or drop samples with missing values. See https://scikit-learn.org/stable/modules/impute.html You can find a list of all estimators that handle NaN values at the following page: https://scikit-learn.org/stable/modules/impute.html#estimators-that-handle-nan-values",PRUNED
34,110.3490656806106,2025-05-04 05:04:42.699758,2025-05-04 05:05:22.588540,0 days 00:00:39.888782,,,,,,none,,,,,,,,,,,XGBoost,,,,,,,standard,0.8003739648072848,dart,0.13965768630247333,0.012002349092046727,14.0,167.0,27.959708793622227,12176.91629658371,0.8043413162231445,,COMPLETE
35,87.83201800872644,2025-05-04 05:04:42.761606,2025-05-04 05:05:31.788232,0 days 00:00:49.026626,,,,,,none,0.04584876911502504,136.0,39.0,725.0,,,,,,,HistGradientBosting,,,,,,,robust,,,,,,,22.797813927297657,7714.463387485245,0.876044001352095,,COMPLETE
36,,2025-05-04 05:04:42.778204,2025-05-04 05:04:43.051576,0 days 00:00:00.273372,,,,,,lasso,,,,,0.0017857046385044131,,,,,,RandomForest,False,mse,16.0,3.0,7.0,61.0,robust,,,,,,,,,,"Input X contains NaN.
Lasso does not accept missing values encoded as NaN natively. For supervised learning, you might want to consider sklearn.ensemble.HistGradientBoostingClassifier and Regressor which accept missing values encoded as NaNs natively. Alternatively, it is possible to preprocess the data, for instance by using an imputer transformer in a pipeline or drop samples with missing values. See https://scikit-learn.org/stable/modules/impute.html You can find a list of all estimators that handle NaN values at the following page: https://scikit-learn.org/stable/modules/impute.html#estimators-that-handle-nan-values",PRUNED
37,,2025-05-04 05:04:42.785406,2025-05-04 05:04:43.095540,0 days 00:00:00.310134,mae,28.0,1.0,5.0,best,lasso,,,,,0.6425773501262727,,,,,,DecisionTree,,,,,,,robust,,,,,,,,,,"Input X contains NaN.
Lasso does not accept missing values encoded as NaN natively. For supervised learning, you might want to consider sklearn.ensemble.HistGradientBoostingClassifier and Regressor which accept missing values encoded as NaNs natively. Alternatively, it is possible to preprocess the data, for instance by using an imputer transformer in a pipeline or drop samples with missing values. See https://scikit-learn.org/stable/modules/impute.html You can find a list of all estimators that handle NaN values at the following page: https://scikit-learn.org/stable/modules/impute.html#estimators-that-handle-nan-values",PRUNED
38,,2025-05-04 05:04:42.799870,2025-05-04 05:04:43.130789,0 days 00:00:00.330919,mse,29.0,1.0,7.0,best,lasso,,,,,0.6035925611287343,,,,,,DecisionTree,,,,,,,robust,,,,,,,,,,"Input X contains NaN.
Lasso does not accept missing values encoded as NaN natively. For supervised learning, you might want to consider sklearn.ensemble.HistGradientBoostingClassifier and Regressor which accept missing values encoded as NaNs natively. Alternatively, it is possible to preprocess the data, for instance by using an imputer transformer in a pipeline or drop samples with missing values. See https://scikit-learn.org/stable/modules/impute.html You can find a list of all estimators that handle NaN values at the following page: https://scikit-learn.org/stable/modules/impute.html#estimators-that-handle-nan-values",PRUNED
39,,2025-05-04 05:04:42.807666,2025-05-04 05:04:43.150151,0 days 00:00:00.342485,mse,30.0,1.0,7.0,best,lasso,,,,,0.8254457748472215,,,,,,DecisionTree,,,,,,,robust,,,,,,,,,,"Input X contains NaN.
Lasso does not accept missing values encoded as NaN natively. For supervised learning, you might want to consider sklearn.ensemble.HistGradientBoostingClassifier and Regressor which accept missing values encoded as NaNs natively. Alternatively, it is possible to preprocess the data, for instance by using an imputer transformer in a pipeline or drop samples with missing values. See https://scikit-learn.org/stable/modules/impute.html You can find a list of all estimators that handle NaN values at the following page: https://scikit-learn.org/stable/modules/impute.html#estimators-that-handle-nan-values",PRUNED
40,,2025-05-04 05:04:42.823593,2025-05-04 05:04:43.205477,0 days 00:00:00.381884,mae,30.0,1.0,4.0,best,lasso,,,,,0.652107010125627,,,,,,DecisionTree,,,,,,,robust,,,,,,,,,,"Input X contains NaN.
Lasso does not accept missing values encoded as NaN natively. For supervised learning, you might want to consider sklearn.ensemble.HistGradientBoostingClassifier and Regressor which accept missing values encoded as NaNs natively. Alternatively, it is possible to preprocess the data, for instance by using an imputer transformer in a pipeline or drop samples with missing values. See https://scikit-learn.org/stable/modules/impute.html You can find a list of all estimators that handle NaN values at the following page: https://scikit-learn.org/stable/modules/impute.html#estimators-that-handle-nan-values",PRUNED
41,,2025-05-04 05:04:42.853819,2025-05-04 05:04:43.176799,0 days 00:00:00.322980,,,,,,lasso,,,,,0.40141408056226463,0.42973558299362535,0.06379627622510986,1.0,55.0,25.0,LightGBM,,,,,,,robust,,,,,,,,,,"Input X contains NaN.
Lasso does not accept missing values encoded as NaN natively. For supervised learning, you might want to consider sklearn.ensemble.HistGradientBoostingClassifier and Regressor which accept missing values encoded as NaNs natively. Alternatively, it is possible to preprocess the data, for instance by using an imputer transformer in a pipeline or drop samples with missing values. See https://scikit-learn.org/stable/modules/impute.html You can find a list of all estimators that handle NaN values at the following page: https://scikit-learn.org/stable/modules/impute.html#estimators-that-handle-nan-values",PRUNED
42,,2025-05-04 05:04:42.866087,2025-05-04 05:04:43.189676,0 days 00:00:00.323589,,,,,,lasso,,,,,0.5667902228039882,0.9720100107136028,0.07192795532201166,1.0,39.0,28.0,LightGBM,,,,,,,robust,,,,,,,,,,"Input X contains NaN.
Lasso does not accept missing values encoded as NaN natively. For supervised learning, you might want to consider sklearn.ensemble.HistGradientBoostingClassifier and Regressor which accept missing values encoded as NaNs natively. Alternatively, it is possible to preprocess the data, for instance by using an imputer transformer in a pipeline or drop samples with missing values. See https://scikit-learn.org/stable/modules/impute.html You can find a list of all estimators that handle NaN values at the following page: https://scikit-learn.org/stable/modules/impute.html#estimators-that-handle-nan-values",PRUNED
43,,2025-05-04 05:04:42.874965,2025-05-04 05:04:43.479108,0 days 00:00:00.604143,mse,29.0,1.0,7.0,best,lasso,,,,,0.9047381243053559,,,,,,DecisionTree,,,,,,,robust,,,,,,,,,,"Input X contains NaN.
Lasso does not accept missing values encoded as NaN natively. For supervised learning, you might want to consider sklearn.ensemble.HistGradientBoostingClassifier and Regressor which accept missing values encoded as NaNs natively. Alternatively, it is possible to preprocess the data, for instance by using an imputer transformer in a pipeline or drop samples with missing values. See https://scikit-learn.org/stable/modules/impute.html You can find a list of all estimators that handle NaN values at the following page: https://scikit-learn.org/stable/modules/impute.html#estimators-that-handle-nan-values",PRUNED
44,,2025-05-04 05:04:42.880504,2025-05-04 05:04:43.369449,0 days 00:00:00.488945,mse,29.0,1.0,7.0,best,lasso,,,,,0.8786470100365984,,,,,,DecisionTree,,,,,,,robust,,,,,,,,,,"Input X contains NaN.
Lasso does not accept missing values encoded as NaN natively. For supervised learning, you might want to consider sklearn.ensemble.HistGradientBoostingClassifier and Regressor which accept missing values encoded as NaNs natively. Alternatively, it is possible to preprocess the data, for instance by using an imputer transformer in a pipeline or drop samples with missing values. See https://scikit-learn.org/stable/modules/impute.html You can find a list of all estimators that handle NaN values at the following page: https://scikit-learn.org/stable/modules/impute.html#estimators-that-handle-nan-values",PRUNED
45,,2025-05-04 05:04:42.897833,2025-05-04 05:04:43.366974,0 days 00:00:00.469141,mse,30.0,2.0,7.0,best,lasso,,,,,0.3453492700110088,,,,,,DecisionTree,,,,,,,robust,,,,,,,,,,"Input X contains NaN.
Lasso does not accept missing values encoded as NaN natively. For supervised learning, you might want to consider sklearn.ensemble.HistGradientBoostingClassifier and Regressor which accept missing values encoded as NaNs natively. Alternatively, it is possible to preprocess the data, for instance by using an imputer transformer in a pipeline or drop samples with missing values. See https://scikit-learn.org/stable/modules/impute.html You can find a list of all estimators that handle NaN values at the following page: https://scikit-learn.org/stable/modules/impute.html#estimators-that-handle-nan-values",PRUNED
46,,2025-05-04 05:04:42.906933,2025-05-04 05:04:43.494628,0 days 00:00:00.587695,mse,30.0,1.0,7.0,best,lasso,,,,,0.3174470199529453,,,,,,DecisionTree,,,,,,,robust,,,,,,,,,,"Input X contains NaN.
Lasso does not accept missing values encoded as NaN natively. For supervised learning, you might want to consider sklearn.ensemble.HistGradientBoostingClassifier and Regressor which accept missing values encoded as NaNs natively. Alternatively, it is possible to preprocess the data, for instance by using an imputer transformer in a pipeline or drop samples with missing values. See https://scikit-learn.org/stable/modules/impute.html You can find a list of all estimators that handle NaN values at the following page: https://scikit-learn.org/stable/modules/impute.html#estimators-that-handle-nan-values",PRUNED
47,,2025-05-04 05:04:42.923218,2025-05-04 05:04:43.648223,0 days 00:00:00.725005,mse,29.0,1.0,7.0,best,lasso,,,,,0.5512644595972196,,,,,,DecisionTree,,,,,,,robust,,,,,,,,,,"Input X contains NaN.
Lasso does not accept missing values encoded as NaN natively. For supervised learning, you might want to consider sklearn.ensemble.HistGradientBoostingClassifier and Regressor which accept missing values encoded as NaNs natively. Alternatively, it is possible to preprocess the data, for instance by using an imputer transformer in a pipeline or drop samples with missing values. See https://scikit-learn.org/stable/modules/impute.html You can find a list of all estimators that handle NaN values at the following page: https://scikit-learn.org/stable/modules/impute.html#estimators-that-handle-nan-values",PRUNED
48,,2025-05-04 05:04:42.971219,2025-05-04 05:04:43.626808,0 days 00:00:00.655589,mse,30.0,1.0,7.0,best,lasso,,,,,0.0035688161543778385,,,,,,DecisionTree,,,,,,,maxabs,,,,,,,,,,"Input X contains NaN.
Lasso does not accept missing values encoded as NaN natively. For supervised learning, you might want to consider sklearn.ensemble.HistGradientBoostingClassifier and Regressor which accept missing values encoded as NaNs natively. Alternatively, it is possible to preprocess the data, for instance by using an imputer transformer in a pipeline or drop samples with missing values. See https://scikit-learn.org/stable/modules/impute.html You can find a list of all estimators that handle NaN values at the following page: https://scikit-learn.org/stable/modules/impute.html#estimators-that-handle-nan-values",PRUNED
49,,2025-05-04 05:04:42.993233,2025-05-04 05:04:43.574857,0 days 00:00:00.581624,mse,30.0,1.0,7.0,best,lasso,,,,,0.002835953926520796,,,,,,DecisionTree,,,,,,,maxabs,,,,,,,,,,"Input X contains NaN.
Lasso does not accept missing values encoded as NaN natively. For supervised learning, you might want to consider sklearn.ensemble.HistGradientBoostingClassifier and Regressor which accept missing values encoded as NaNs natively. Alternatively, it is possible to preprocess the data, for instance by using an imputer transformer in a pipeline or drop samples with missing values. See https://scikit-learn.org/stable/modules/impute.html You can find a list of all estimators that handle NaN values at the following page: https://scikit-learn.org/stable/modules/impute.html#estimators-that-handle-nan-values",PRUNED
50,107.84678822661296,2025-05-04 05:04:43.009454,2025-05-04 05:04:44.629523,0 days 00:00:01.620069,,,,,,none,,,,,,0.4513698293724501,0.06895418961639878,0.0,61.0,24.0,LightGBM,,,,,,,maxabs,,,,,,,27.056588652820817,11630.929730795902,0.8131142196716826,,COMPLETE
51,131.4084170632522,2025-05-04 05:04:43.018073,2025-05-04 05:04:44.502780,0 days 00:00:01.484707,,,,,,none,,,,,,,,,,,XGBoost,,,,,,,maxabs,0.055647902062216925,gblinear,0.013171484245393734,0.9255545337330912,29.0,115.0,32.39636037769802,17268.172075069626,0.7225350141525269,,COMPLETE
52,94.41202619275765,2025-05-04 05:04:43.032750,2025-05-04 05:04:45.009293,0 days 00:00:01.976543,,,,,,none,,,,,,0.9992531612874016,0.07677171219259839,0.0,78.0,25.0,LightGBM,,,,,,,maxabs,,,,,,,23.72851368118042,8913.630689821957,0.8567757809923745,,COMPLETE
53,131.7871105960493,2025-05-04 05:04:43.049954,2025-05-04 05:04:44.582227,0 days 00:00:01.532273,,,,,,none,,,,,,,,,,,XGBoost,,,,,,,maxabs,0.007051116992341511,gblinear,0.01194479723923043,0.9425372954680067,30.0,111.0,32.34790188514413,17367.84251925533,0.7209334373474121,,COMPLETE
54,131.86742780380766,2025-05-04 05:04:43.062129,2025-05-04 05:04:44.419733,0 days 00:00:01.357604,,,,,,none,,,,,,,,,,,XGBoost,,,,,,,maxabs,0.008060379495255177,gblinear,0.023178263435423025,0.9867501747121621,30.0,108.0,32.86240514534845,17389.018515592426,0.7205932140350342,,COMPLETE
55,131.4770921736538,2025-05-04 05:04:43.079863,2025-05-04 05:04:44.637030,0 days 00:00:01.557167,,,,,,none,,,,,,,,,,,XGBoost,,,,,,,maxabs,0.044866042410318996,gblinear,0.00245676446684822,0.9313899438969121,30.0,120.0,32.36989890565405,17286.225766439456,0.722244918346405,,COMPLETE
56,131.1800179664141,2025-05-04 05:04:43.082864,2025-05-04 05:04:44.593623,0 days 00:00:01.510759,,,,,,none,,,,,,,,,,,XGBoost,,,,,,,maxabs,0.08725010250125798,gblinear,0.014591907707901947,0.9849816447771487,30.0,110.0,32.49574308754098,17208.197113668728,0.7234987020492554,,COMPLETE
57,136.82491656611498,2025-05-04 05:04:43.105349,2025-05-04 05:04:44.672113,0 days 00:00:01.566764,,,,,,none,,,,,,,,,,,XGBoost,,,,,,,maxabs,0.037995442277169,gblinear,0.023409621547038545,0.010750951505882246,30.0,113.0,39.81986968342582,18721.057793324326,0.6991900205612183,,COMPLETE
58,131.52486037691125,2025-05-04 05:04:43.109123,2025-05-04 05:04:44.624773,0 days 00:00:01.515650,,,,,,none,,,,,,,,,,,XGBoost,,,,,,,maxabs,0.039124654122621005,gblinear,0.03133321859559121,0.9895958006180611,29.0,111.0,32.47257039310332,17298.788897166,0.7220430374145508,,COMPLETE
59,136.58423534358067,2025-05-04 05:04:43.114473,2025-05-04 05:04:44.576729,0 days 00:00:01.462256,,,,,,none,,,,,,,,,,,XGBoost,,,,,,,maxabs,0.11186676330414869,gblinear,0.0012021510191383353,0.010812408456709782,29.0,112.0,40.052637767680686,18655.25334439063,0.7002473473548889,,COMPLETE
60,131.50499326796066,2025-05-04 05:04:43.116989,2025-05-04 05:04:44.482143,0 days 00:00:01.365154,,,,,,none,,,,,,,,,,,XGBoost,,,,,,,maxabs,0.04799923225700367,gblinear,0.006321224039948628,0.897373835657074,28.0,110.0,32.965220315963414,17293.56325440638,0.7221269607543945,,COMPLETE
61,131.0720100518356,2025-05-04 05:04:43.127559,2025-05-04 05:04:44.708891,0 days 00:00:01.581332,,,,,,none,,,,,,,,,,,XGBoost,,,,,,,maxabs,0.10475725305570172,gblinear,0.0103884325407222,0.8236428316543858,28.0,105.0,32.58594458316728,17179.871819028493,0.7239538431167603,,COMPLETE
62,131.6395758909757,2025-05-04 05:04:43.131106,2025-05-04 05:04:44.795209,0 days 00:00:01.664103,,,,,,none,,,,,,,,,,,XGBoost,,,,,,,maxabs,0.026917677261287777,gblinear,0.008997248791654977,0.9417405814234898,30.0,107.0,32.45006131950084,17328.977940755947,0.7215579748153687,,COMPLETE
63,136.72600324627328,2025-05-04 05:04:43.134002,2025-05-04 05:04:44.694329,0 days 00:00:01.560327,,,,,,none,,,,,,,,,,,XGBoost,,,,,,,maxabs,0.06883234573248964,gblinear,0.005612039802149041,0.01082050882618945,29.0,112.0,39.92471220788104,18693.99996369993,0.69962477684021,,COMPLETE
64,131.48875731680172,2025-05-04 05:04:43.163731,2025-05-04 05:04:44.540498,0 days 00:00:01.376767,,,,,,none,,,,,,,,,,,XGBoost,,,,,,,maxabs,0.05095173134531672,gblinear,0.007401573550288809,0.9927148686456391,30.0,100.0,32.64811813499901,17289.293300716778,0.7221956253051758,,COMPLETE
65,131.86924004184678,2025-05-04 05:04:43.165379,2025-05-04 05:04:44.589952,0 days 00:00:01.424573,,,,,,none,,,,,,,,,,,XGBoost,,,,,,,maxabs,0.0004352923465921199,gblinear,0.016034367574044514,0.8712183596537381,30.0,101.0,32.66140469114904,17389.496469214206,0.7205855250358582,,COMPLETE
66,131.378907596883,2025-05-04 05:04:43.179590,2025-05-04 05:04:44.689405,0 days 00:00:01.509815,,,,,,none,,,,,,,,,,,XGBoost,,,,,,,maxabs,0.057947961705923534,gblinear,0.03547145529888728,0.9252104607334225,30.0,111.0,32.431622422317766,17260.417361350326,0.7226595878601074,,COMPLETE
67,131.68539844905592,2025-05-04 05:04:43.193616,2025-05-04 05:04:44.683192,0 days 00:00:01.489576,,,,,,none,,,,,,,,,,,XGBoost,,,,,,,maxabs,0.020726989281822372,gblinear,0.046934695101606604,0.9861790711668452,30.0,107.0,32.40226820709857,17341.044164686624,0.7213640809059143,,COMPLETE
68,131.70345673473597,2025-05-04 05:04:43.211839,2025-05-04 05:04:44.644867,0 days 00:00:01.433028,,,,,,none,,,,,,,,,,,XGBoost,,,,,,,maxabs,0.020023777215218308,gblinear,0.008249882827869648,0.9111717333208228,30.0,102.0,32.491361715922686,17345.800515878465,0.7212876081466675,,COMPLETE
69,131.35349672160092,2025-05-04 05:04:43.221877,2025-05-04 05:04:44.810879,0 days 00:00:01.589002,,,,,,none,,,,,,,,,,,XGBoost,,,,,,,maxabs,0.060108989881595076,gblinear,0.09599796667455407,0.9195261752617739,30.0,109.0,32.50551273550471,17253.74110099162,0.7227668762207031,,COMPLETE
70,136.91349435971603,2025-05-04 05:04:43.227879,2025-05-04 05:04:44.734640,0 days 00:00:01.506761,,,,,,none,,,,,,,,,,,XGBoost,,,,,,,maxabs,0.027684012005275416,gblinear,0.0035372143854159876,0.011009313117191765,29.0,113.0,39.646627322954295,18745.30493778799,0.6988004446029663,,COMPLETE
71,131.7219865515135,2025-05-04 05:04:43.240486,2025-05-04 05:04:44.858228,0 days 00:00:01.617742,,,,,,none,,,,,,,,,,,XGBoost,,,,,,,maxabs,0.01187976854943998,gblinear,0.001458707835032845,0.7461600555522214,30.0,121.0,32.33335036337551,17350.681741077107,0.7212092280387878,,COMPLETE
72,131.7603727319629,2025-05-04 05:04:43.412698,2025-05-04 05:04:44.882069,0 days 00:00:01.469371,,,,,,none,,,,,,,,,,,XGBoost,,,,,,,maxabs,0.010247842126044236,gblinear,0.01315931169386143,0.8154402382421431,30.0,114.0,32.388987421609045,17360.795822465792,0.7210466861724854,,COMPLETE
73,131.82676071633122,2025-05-04 05:04:43.423057,2025-05-04 05:04:44.907075,0 days 00:00:01.484018,,,,,,none,,,,,,,,,,,XGBoost,,,,,,,maxabs,0.000569823427795102,gblinear,0.005673987538095095,0.9096753680581103,30.0,119.0,32.45834505032669,17378.29484096085,0.7207655310630798,,COMPLETE
74,136.94223238909098,2025-05-04 05:04:43.538966,2025-05-04 05:04:44.889804,0 days 00:00:01.350838,,,,,,none,,,,,,,,,,,XGBoost,,,,,,,maxabs,0.041340744730964774,gblinear,0.0034935652198909706,0.011582794304340817,30.0,113.0,39.37866515826276,18753.175011707797,0.6986739635467529,,COMPLETE
75,131.7869829008357,2025-05-04 05:04:43.561058,2025-05-04 05:04:44.909762,0 days 00:00:01.348704,,,,,,none,,,,,,,,,,,XGBoost,,,,,,,maxabs,0.002153741186940481,gblinear,0.02271885444532354,0.9545925709970748,29.0,108.0,32.40860087703039,17367.808862105165,0.7209340333938599,,COMPLETE
76,131.65765459511744,2025-05-04 05:04:43.617888,2025-05-04 05:04:44.845293,0 days 00:00:01.227405,,,,,,none,,,,,,,,,,,XGBoost,,,,,,,maxabs,0.020815246310471124,gblinear,0.014076616444282134,0.9944933613983152,29.0,101.0,32.204531472027654,17333.738013487244,0.721481442451477,,COMPLETE
