number,value,datetime_start,datetime_complete,duration,params_dt_criterion,params_dt_max_depth,params_dt_min_samples_leaf,params_dt_min_samples_split,params_dt_splitter,params_feature_selector,params_hgb_learning_rate,params_hgb_max_bins,params_hgb_max_depth,params_hgb_max_iter,params_lasso_alpha,params_lgb_feature_fraction,params_lgb_learning_rate,params_lgb_max_depth,params_lgb_n_estimators,params_lgb_num_leaves,params_model,params_rf_bootstrap,params_rf_criterion,params_rf_max_depth,params_rf_min_samples_leaf,params_rf_min_samples_split,params_rf_n_estimators,params_scaler,params_xgb_alpha,params_xgb_booster,params_xgb_lambda,params_xgb_learning_rate,params_xgb_max_depth,params_xgb_n_estimators,user_attrs_MAE,user_attrs_MSE,user_attrs_R2,user_attrs_error,state
0,,2025-05-04 05:04:42.630546,2025-05-04 05:04:42.760857,0 days 00:00:00.130311,mse,30.0,1.0,6.0,random,lasso,,,,,0.2359684941636755,,,,,,DecisionTree,,,,,,,maxabs,,,,,,,,,,"Input X contains NaN.
Lasso does not accept missing values encoded as NaN natively. For supervised learning, you might want to consider sklearn.ensemble.HistGradientBoostingClassifier and Regressor which accept missing values encoded as NaNs natively. Alternatively, it is possible to preprocess the data, for instance by using an imputer transformer in a pipeline or drop samples with missing values. See https://scikit-learn.org/stable/modules/impute.html You can find a list of all estimators that handle NaN values at the following page: https://scikit-learn.org/stable/modules/impute.html#estimators-that-handle-nan-values",PRUNED
1,,2025-05-04 05:04:42.631439,2025-05-04 05:04:42.905153,0 days 00:00:00.273714,,,,,,lasso,,,,,0.00023523957712245404,0.5011565946373515,0.0845389960298255,10.0,338.0,92.0,LightGBM,,,,,,,robust,,,,,,,,,,"Input X contains NaN.
Lasso does not accept missing values encoded as NaN natively. For supervised learning, you might want to consider sklearn.ensemble.HistGradientBoostingClassifier and Regressor which accept missing values encoded as NaNs natively. Alternatively, it is possible to preprocess the data, for instance by using an imputer transformer in a pipeline or drop samples with missing values. See https://scikit-learn.org/stable/modules/impute.html You can find a list of all estimators that handle NaN values at the following page: https://scikit-learn.org/stable/modules/impute.html#estimators-that-handle-nan-values",PRUNED
2,,2025-05-04 05:04:42.633290,2025-05-04 05:04:42.802078,0 days 00:00:00.168788,mse,5.0,9.0,9.0,random,lasso,,,,,0.005678284791220096,,,,,,DecisionTree,,,,,,,standard,,,,,,,,,,"Input X contains NaN.
Lasso does not accept missing values encoded as NaN natively. For supervised learning, you might want to consider sklearn.ensemble.HistGradientBoostingClassifier and Regressor which accept missing values encoded as NaNs natively. Alternatively, it is possible to preprocess the data, for instance by using an imputer transformer in a pipeline or drop samples with missing values. See https://scikit-learn.org/stable/modules/impute.html You can find a list of all estimators that handle NaN values at the following page: https://scikit-learn.org/stable/modules/impute.html#estimators-that-handle-nan-values",PRUNED
3,,2025-05-04 05:04:42.633773,2025-05-04 05:04:42.768568,0 days 00:00:00.134795,,,,,,lasso,,,,,0.00039418659982804946,0.7610722013736035,0.3765105599925766,12.0,644.0,293.0,LightGBM,,,,,,,maxabs,,,,,,,,,,"Input X contains NaN.
Lasso does not accept missing values encoded as NaN natively. For supervised learning, you might want to consider sklearn.ensemble.HistGradientBoostingClassifier and Regressor which accept missing values encoded as NaNs natively. Alternatively, it is possible to preprocess the data, for instance by using an imputer transformer in a pipeline or drop samples with missing values. See https://scikit-learn.org/stable/modules/impute.html You can find a list of all estimators that handle NaN values at the following page: https://scikit-learn.org/stable/modules/impute.html#estimators-that-handle-nan-values",PRUNED
4,,2025-05-04 05:04:42.635119,2025-05-04 05:04:42.751222,0 days 00:00:00.116103,,,,,,none,,,,,,,,,,,RandomForest,False,mse,6.0,32.0,9.0,97.0,maxabs,,,,,,,,,,"The 'criterion' parameter of RandomForestRegressor must be a str among {'friedman_mse', 'absolute_error', 'poisson', 'squared_error'}. Got 'mse' instead.",PRUNED
5,,2025-05-04 05:04:42.636382,2025-05-04 05:04:42.795965,0 days 00:00:00.159583,,,,,,lasso,,,,,0.00030435059789599183,,,,,,XGBoost,,,,,,,maxabs,0.6480626505444571,dart,0.8008030134122855,0.6342980446116531,16.0,41.0,,,,"Input X contains NaN.
Lasso does not accept missing values encoded as NaN natively. For supervised learning, you might want to consider sklearn.ensemble.HistGradientBoostingClassifier and Regressor which accept missing values encoded as NaNs natively. Alternatively, it is possible to preprocess the data, for instance by using an imputer transformer in a pipeline or drop samples with missing values. See https://scikit-learn.org/stable/modules/impute.html You can find a list of all estimators that handle NaN values at the following page: https://scikit-learn.org/stable/modules/impute.html#estimators-that-handle-nan-values",PRUNED
6,,2025-05-04 05:04:42.637608,2025-05-04 05:04:42.790323,0 days 00:00:00.152715,,,,,,lasso,,,,,0.00043776785946257585,0.4508039863024778,0.031767156365631655,8.0,611.0,97.0,LightGBM,,,,,,,maxabs,,,,,,,,,,"Input X contains NaN.
Lasso does not accept missing values encoded as NaN natively. For supervised learning, you might want to consider sklearn.ensemble.HistGradientBoostingClassifier and Regressor which accept missing values encoded as NaNs natively. Alternatively, it is possible to preprocess the data, for instance by using an imputer transformer in a pipeline or drop samples with missing values. See https://scikit-learn.org/stable/modules/impute.html You can find a list of all estimators that handle NaN values at the following page: https://scikit-learn.org/stable/modules/impute.html#estimators-that-handle-nan-values",PRUNED
7,,2025-05-04 05:04:42.638978,2025-05-04 05:04:42.811294,0 days 00:00:00.172316,mse,13.0,17.0,10.0,random,lasso,,,,,0.04193497135346158,,,,,,DecisionTree,,,,,,,standard,,,,,,,,,,"Input X contains NaN.
Lasso does not accept missing values encoded as NaN natively. For supervised learning, you might want to consider sklearn.ensemble.HistGradientBoostingClassifier and Regressor which accept missing values encoded as NaNs natively. Alternatively, it is possible to preprocess the data, for instance by using an imputer transformer in a pipeline or drop samples with missing values. See https://scikit-learn.org/stable/modules/impute.html You can find a list of all estimators that handle NaN values at the following page: https://scikit-learn.org/stable/modules/impute.html#estimators-that-handle-nan-values",PRUNED
8,3458.240689569556,2025-05-04 05:04:42.642167,2025-05-04 05:04:43.048827,0 days 00:00:00.406660,,,,,,none,,,,,,,,,,,XGBoost,,,,,,,maxabs,0.8944335212431127,gblinear,0.020301114575632218,0.9755323433057573,28.0,21.0,1359.647938999282,11959428.666994518,-191.16412353515625,,COMPLETE
9,140.66841799648503,2025-05-04 05:04:42.643219,2025-05-04 05:04:43.194928,0 days 00:00:00.551709,,,,,,none,,,,,,0.8377321647930042,0.014264531233445822,2.0,129.0,240.0,LightGBM,,,,,,,maxabs,,,,,,,42.65603854196021,19787.60382163383,0.6820527793885504,,COMPLETE
10,,2025-05-04 05:04:42.644536,2025-05-04 05:04:42.786697,0 days 00:00:00.142161,mse,14.0,24.0,7.0,random,none,,,,,,,,,,,DecisionTree,,,,,,,maxabs,,,,,,,,,,"The 'criterion' parameter of DecisionTreeRegressor must be a str among {'friedman_mse', 'absolute_error', 'poisson', 'squared_error'}. Got 'mse' instead.",PRUNED
11,,2025-05-04 05:04:42.647364,2025-05-04 05:04:42.826675,0 days 00:00:00.179311,,,,,,lasso,,,,,0.06889824639237517,0.619328721210432,0.6363920379119776,10.0,692.0,216.0,LightGBM,,,,,,,standard,,,,,,,,,,"Input X contains NaN.
Lasso does not accept missing values encoded as NaN natively. For supervised learning, you might want to consider sklearn.ensemble.HistGradientBoostingClassifier and Regressor which accept missing values encoded as NaNs natively. Alternatively, it is possible to preprocess the data, for instance by using an imputer transformer in a pipeline or drop samples with missing values. See https://scikit-learn.org/stable/modules/impute.html You can find a list of all estimators that handle NaN values at the following page: https://scikit-learn.org/stable/modules/impute.html#estimators-that-handle-nan-values",PRUNED
12,172.50413724614185,2025-05-04 05:04:42.648542,2025-05-04 05:04:43.079072,0 days 00:00:00.430530,,,,,,none,,,,,,,,,,,XGBoost,,,,,,,maxabs,0.007574768375677721,gblinear,0.041975251465266705,0.7994851579914181,19.0,29.0,77.02892717565169,29757.67736703574,0.5218535661697388,,COMPLETE
13,95.00611518524386,2025-05-04 05:04:42.649147,2025-05-04 05:04:46.815535,0 days 00:00:04.166388,,,,,,none,,,,,,0.5701105978195087,0.07602495405393267,8.0,215.0,66.0,LightGBM,,,,,,,robust,,,,,,,23.223380280265744,9026.161922591822,0.8549676291305487,,COMPLETE
14,,2025-05-04 05:04:42.650616,2025-05-04 05:04:42.978881,0 days 00:00:00.328265,mse,15.0,1.0,2.0,random,lasso,,,,,0.00015302964220157038,,,,,,DecisionTree,,,,,,,robust,,,,,,,,,,"Input X contains NaN.
Lasso does not accept missing values encoded as NaN natively. For supervised learning, you might want to consider sklearn.ensemble.HistGradientBoostingClassifier and Regressor which accept missing values encoded as NaNs natively. Alternatively, it is possible to preprocess the data, for instance by using an imputer transformer in a pipeline or drop samples with missing values. See https://scikit-learn.org/stable/modules/impute.html You can find a list of all estimators that handle NaN values at the following page: https://scikit-learn.org/stable/modules/impute.html#estimators-that-handle-nan-values",PRUNED
15,,2025-05-04 05:04:42.652220,2025-05-04 05:04:42.827962,0 days 00:00:00.175742,,,,,,lasso,,,,,0.04997800047658226,,,,,,XGBoost,,,,,,,standard,0.17611485651066006,dart,0.8460441396475255,0.13222329487793522,18.0,69.0,,,,"Input X contains NaN.
Lasso does not accept missing values encoded as NaN natively. For supervised learning, you might want to consider sklearn.ensemble.HistGradientBoostingClassifier and Regressor which accept missing values encoded as NaNs natively. Alternatively, it is possible to preprocess the data, for instance by using an imputer transformer in a pipeline or drop samples with missing values. See https://scikit-learn.org/stable/modules/impute.html You can find a list of all estimators that handle NaN values at the following page: https://scikit-learn.org/stable/modules/impute.html#estimators-that-handle-nan-values",PRUNED
16,90.22585919872564,2025-05-04 05:04:42.653825,2025-05-04 05:05:17.988287,0 days 00:00:35.334462,,,,,,none,0.0425590048515384,217.0,25.0,865.0,,,,,,,HistGradientBosting,,,,,,,maxabs,,,,,,,22.734881077141225,8140.705668148265,0.8691951403345863,,COMPLETE
17,,2025-05-04 05:04:42.654840,2025-05-04 05:04:42.831006,0 days 00:00:00.176166,,,,,,lasso,0.1278121773758153,140.0,22.0,670.0,0.01472569090862288,,,,,,HistGradientBosting,,,,,,,standard,,,,,,,,,,"Input X contains NaN.
Lasso does not accept missing values encoded as NaN natively. For supervised learning, you might want to consider sklearn.ensemble.HistGradientBoostingClassifier and Regressor which accept missing values encoded as NaNs natively. Alternatively, it is possible to preprocess the data, for instance by using an imputer transformer in a pipeline or drop samples with missing values. See https://scikit-learn.org/stable/modules/impute.html You can find a list of all estimators that handle NaN values at the following page: https://scikit-learn.org/stable/modules/impute.html#estimators-that-handle-nan-values",PRUNED
18,,2025-05-04 05:04:42.655616,2025-05-04 05:04:42.818934,0 days 00:00:00.163318,,,,,,lasso,,,,,0.0021370434795937427,,,,,,XGBoost,,,,,,,maxabs,0.4469092982821814,dart,0.931008194560737,0.10041188827944071,5.0,172.0,,,,"Input X contains NaN.
Lasso does not accept missing values encoded as NaN natively. For supervised learning, you might want to consider sklearn.ensemble.HistGradientBoostingClassifier and Regressor which accept missing values encoded as NaNs natively. Alternatively, it is possible to preprocess the data, for instance by using an imputer transformer in a pipeline or drop samples with missing values. See https://scikit-learn.org/stable/modules/impute.html You can find a list of all estimators that handle NaN values at the following page: https://scikit-learn.org/stable/modules/impute.html#estimators-that-handle-nan-values",PRUNED
19,,2025-05-04 05:04:42.657742,2025-05-04 05:04:42.854429,0 days 00:00:00.196687,mae,7.0,17.0,3.0,random,none,,,,,,,,,,,DecisionTree,,,,,,,standard,,,,,,,,,,"The 'criterion' parameter of DecisionTreeRegressor must be a str among {'friedman_mse', 'absolute_error', 'poisson', 'squared_error'}. Got 'mae' instead.",PRUNED
20,,2025-05-04 05:04:42.658472,2025-05-04 05:04:42.812733,0 days 00:00:00.154261,,,,,,none,,,,,,,,,,,RandomForest,False,mse,15.0,22.0,8.0,87.0,standard,,,,,,,,,,"The 'criterion' parameter of RandomForestRegressor must be a str among {'friedman_mse', 'absolute_error', 'poisson', 'squared_error'}. Got 'mse' instead.",PRUNED
21,,2025-05-04 05:04:42.659470,2025-05-04 05:04:43.000049,0 days 00:00:00.340579,,,,,,lasso,0.04577508620433775,248.0,36.0,267.0,0.00013301804056258058,,,,,,HistGradientBosting,,,,,,,robust,,,,,,,,,,"Input X contains NaN.
Lasso does not accept missing values encoded as NaN natively. For supervised learning, you might want to consider sklearn.ensemble.HistGradientBoostingClassifier and Regressor which accept missing values encoded as NaNs natively. Alternatively, it is possible to preprocess the data, for instance by using an imputer transformer in a pipeline or drop samples with missing values. See https://scikit-learn.org/stable/modules/impute.html You can find a list of all estimators that handle NaN values at the following page: https://scikit-learn.org/stable/modules/impute.html#estimators-that-handle-nan-values",PRUNED
22,,2025-05-04 05:04:42.661938,2025-05-04 05:04:42.921008,0 days 00:00:00.259070,,,,,,none,,,,,,,,,,,RandomForest,True,mae,28.0,26.0,3.0,124.0,robust,,,,,,,,,,"The 'criterion' parameter of RandomForestRegressor must be a str among {'friedman_mse', 'absolute_error', 'poisson', 'squared_error'}. Got 'mae' instead.",PRUNED
23,129.48989910478267,2025-05-04 05:04:42.666350,2025-05-04 05:04:46.360477,0 days 00:00:03.694127,,,,,,none,,,,,,0.7140895170364788,0.029849116975308006,1.0,965.0,274.0,LightGBM,,,,,,,robust,,,,,,,33.34027531220038,16767.633970166793,0.7305776553290388,,COMPLETE
24,,2025-05-04 05:04:42.670117,2025-05-04 05:04:43.030887,0 days 00:00:00.360770,,,,,,lasso,0.025322838702960343,159.0,5.0,311.0,0.7086395316679118,,,,,,HistGradientBosting,,,,,,,robust,,,,,,,,,,"Input X contains NaN.
Lasso does not accept missing values encoded as NaN natively. For supervised learning, you might want to consider sklearn.ensemble.HistGradientBoostingClassifier and Regressor which accept missing values encoded as NaNs natively. Alternatively, it is possible to preprocess the data, for instance by using an imputer transformer in a pipeline or drop samples with missing values. See https://scikit-learn.org/stable/modules/impute.html You can find a list of all estimators that handle NaN values at the following page: https://scikit-learn.org/stable/modules/impute.html#estimators-that-handle-nan-values",PRUNED
25,,2025-05-04 05:04:42.671689,2025-05-04 05:04:42.839167,0 days 00:00:00.167478,,,,,,lasso,,,,,0.05517097502496556,0.7414014640351188,0.886372127882867,14.0,441.0,185.0,LightGBM,,,,,,,maxabs,,,,,,,,,,"Input X contains NaN.
Lasso does not accept missing values encoded as NaN natively. For supervised learning, you might want to consider sklearn.ensemble.HistGradientBoostingClassifier and Regressor which accept missing values encoded as NaNs natively. Alternatively, it is possible to preprocess the data, for instance by using an imputer transformer in a pipeline or drop samples with missing values. See https://scikit-learn.org/stable/modules/impute.html You can find a list of all estimators that handle NaN values at the following page: https://scikit-learn.org/stable/modules/impute.html#estimators-that-handle-nan-values",PRUNED
26,,2025-05-04 05:04:42.672492,2025-05-04 05:04:42.898761,0 days 00:00:00.226269,,,,,,none,,,,,,,,,,,RandomForest,False,mae,12.0,2.0,9.0,193.0,standard,,,,,,,,,,"The 'criterion' parameter of RandomForestRegressor must be a str among {'friedman_mse', 'absolute_error', 'poisson', 'squared_error'}. Got 'mae' instead.",PRUNED
27,,2025-05-04 05:04:42.676725,2025-05-04 05:04:42.848233,0 days 00:00:00.171508,,,,,,lasso,0.07770955726321951,168.0,14.0,638.0,0.03357907865177231,,,,,,HistGradientBosting,,,,,,,standard,,,,,,,,,,"Input X contains NaN.
Lasso does not accept missing values encoded as NaN natively. For supervised learning, you might want to consider sklearn.ensemble.HistGradientBoostingClassifier and Regressor which accept missing values encoded as NaNs natively. Alternatively, it is possible to preprocess the data, for instance by using an imputer transformer in a pipeline or drop samples with missing values. See https://scikit-learn.org/stable/modules/impute.html You can find a list of all estimators that handle NaN values at the following page: https://scikit-learn.org/stable/modules/impute.html#estimators-that-handle-nan-values",PRUNED
28,,2025-05-04 05:04:42.678952,2025-05-04 05:04:43.008074,0 days 00:00:00.329122,,,,,,lasso,,,,,0.0018301278665226416,,,,,,XGBoost,,,,,,,robust,0.7813043840581816,dart,0.7525451190210966,0.057577951584504655,21.0,50.0,,,,"Input X contains NaN.
Lasso does not accept missing values encoded as NaN natively. For supervised learning, you might want to consider sklearn.ensemble.HistGradientBoostingClassifier and Regressor which accept missing values encoded as NaNs natively. Alternatively, it is possible to preprocess the data, for instance by using an imputer transformer in a pipeline or drop samples with missing values. See https://scikit-learn.org/stable/modules/impute.html You can find a list of all estimators that handle NaN values at the following page: https://scikit-learn.org/stable/modules/impute.html#estimators-that-handle-nan-values",PRUNED
29,,2025-05-04 05:04:42.687207,2025-05-04 05:04:43.033485,0 days 00:00:00.346278,,,,,,lasso,,,,,0.2848426354377663,,,,,,RandomForest,False,mse,18.0,35.0,7.0,253.0,robust,,,,,,,,,,"Input X contains NaN.
Lasso does not accept missing values encoded as NaN natively. For supervised learning, you might want to consider sklearn.ensemble.HistGradientBoostingClassifier and Regressor which accept missing values encoded as NaNs natively. Alternatively, it is possible to preprocess the data, for instance by using an imputer transformer in a pipeline or drop samples with missing values. See https://scikit-learn.org/stable/modules/impute.html You can find a list of all estimators that handle NaN values at the following page: https://scikit-learn.org/stable/modules/impute.html#estimators-that-handle-nan-values",PRUNED
30,,2025-05-04 05:04:42.691854,2025-05-04 05:04:43.058725,0 days 00:00:00.366871,,,,,,lasso,,,,,0.00013604349867483761,,,,,,XGBoost,,,,,,,robust,0.9428694263296314,gblinear,0.7772177053021211,0.41653575670673176,4.0,30.0,,,,"Input X contains NaN.
Lasso does not accept missing values encoded as NaN natively. For supervised learning, you might want to consider sklearn.ensemble.HistGradientBoostingClassifier and Regressor which accept missing values encoded as NaNs natively. Alternatively, it is possible to preprocess the data, for instance by using an imputer transformer in a pipeline or drop samples with missing values. See https://scikit-learn.org/stable/modules/impute.html You can find a list of all estimators that handle NaN values at the following page: https://scikit-learn.org/stable/modules/impute.html#estimators-that-handle-nan-values",PRUNED
31,102.81169667025492,2025-05-04 05:04:42.693816,2025-05-04 05:05:13.662237,0 days 00:00:30.968421,,,,,,none,,,,,,,,,,,XGBoost,,,,,,,standard,0.8025540498855694,dart,0.6611797581485277,0.01786543751076987,9.0,162.0,23.902898560107595,10570.244972216506,0.8301572799682617,,COMPLETE
32,,2025-05-04 05:04:42.696242,2025-05-04 05:04:43.041504,0 days 00:00:00.345262,,,,,,lasso,0.26284133091624395,201.0,30.0,958.0,0.6934060676077775,,,,,,HistGradientBosting,,,,,,,robust,,,,,,,,,,"Input X contains NaN.
