number,value,datetime_start,datetime_complete,duration,params_dt_criterion,params_dt_max_depth,params_dt_min_samples_leaf,params_dt_min_samples_split,params_dt_splitter,params_feature_selector,params_hgb_learning_rate,params_hgb_max_bins,params_hgb_max_depth,params_hgb_max_iter,params_lasso_alpha,params_lgb_feature_fraction,params_lgb_learning_rate,params_lgb_max_depth,params_lgb_n_estimators,params_lgb_num_leaves,params_model,params_rf_bootstrap,params_rf_criterion,params_rf_max_depth,params_rf_min_samples_leaf,params_rf_min_samples_split,params_rf_n_estimators,params_scaler,params_xgb_alpha,params_xgb_booster,params_xgb_lambda,params_xgb_learning_rate,params_xgb_max_depth,params_xgb_n_estimators,user_attrs_MAE,user_attrs_MSE,user_attrs_R2,user_attrs_error,state
156,86.95264995816848,2025-05-04 05:05:07.527201,2025-05-04 05:05:26.501280,0 days 00:00:18.974079,,,,,,none,,,,,,0.5358397170162589,0.33742336220096053,6.0,817.0,145.0,LightGBM,,,,,,,standard,,,,,,,23.01680275334183,7560.763334747777,0.8785136538181648,,COMPLETE
157,96.72349024977302,2025-05-04 05:05:07.702025,2025-05-04 05:05:10.167725,0 days 00:00:02.465700,,,,,,none,0.8471305322781436,253.0,3.0,992.0,,,,,,,HistGradientBosting,,,,,,,maxabs,,,,,,,27.068578924194206,9355.433566097938,0.8496768923226653,,COMPLETE
158,98.16479689183443,2025-05-04 05:05:07.816821,2025-05-04 05:05:09.858866,0 days 00:00:02.042045,,,,,,none,0.9738851676681906,241.0,4.0,952.0,,,,,,,HistGradientBosting,,,,,,,maxabs,,,,,,,28.266932059849562,9636.327348815106,0.8451634909878196,,COMPLETE
159,86.11641433283107,2025-05-04 05:05:07.819311,2025-05-04 05:05:24.748086,0 days 00:00:16.928775,,,,,,none,,,,,,0.5468518538603455,0.14666649633883178,6.0,806.0,150.0,LightGBM,,,,,,,maxabs,,,,,,,21.798068936482785,7416.036817543832,0.8808391195141912,,COMPLETE
160,85.65625267901062,2025-05-04 05:05:07.895411,2025-05-04 05:05:28.638945,0 days 00:00:20.743534,,,,,,none,,,,,,0.642845051067966,0.1432710552794789,7.0,820.0,149.0,LightGBM,,,,,,,standard,,,,,,,21.763807296456818,7336.993623010513,0.8821091855735613,,COMPLETE
161,108.5417583150436,2025-05-04 05:05:08.447227,2025-05-04 05:05:11.192915,0 days 00:00:02.745688,,,,,,none,0.9392811003062951,255.0,40.0,997.0,,,,,,,HistGradientBosting,,,,,,,standard,,,,,,,27.890916316517743,11781.313298121335,0.8106978564936165,,COMPLETE
162,,2025-05-04 05:05:08.638677,2025-05-04 05:05:08.684029,0 days 00:00:00.045352,,,,,,none,0.6993479160653663,256.0,4.0,991.0,,,,,,,HistGradientBosting,,,,,,,standard,,,,,,,,,,"The 'max_bins' parameter of HistGradientBoostingRegressor must be an int in the range [2, 255]. Got 256 instead.",PRUNED
163,83.41344112561883,2025-05-04 05:05:08.686486,2025-05-04 05:05:18.163199,0 days 00:00:09.476713,,,,,,none,,,,,,0.5386795855002482,0.14760662338317818,6.0,455.0,137.0,LightGBM,,,,,,,standard,,,,,,,22.64638484084315,6957.802160417078,0.8882020340406082,,COMPLETE
164,82.70612717544857,2025-05-04 05:05:09.160428,2025-05-04 05:05:22.073518,0 days 00:00:12.913090,,,,,,none,,,,,,0.5397409477773802,0.1393819624282273,7.0,484.0,147.0,LightGBM,,,,,,,standard,,,,,,,22.4539686583143,6840.303472361472,0.8900900029745692,,COMPLETE
165,83.37557648588408,2025-05-04 05:05:09.237185,2025-05-04 05:05:27.131381,0 days 00:00:17.894196,,,,,,none,,,,,,0.6502674141549052,0.13980102058676847,6.0,922.0,149.0,LightGBM,,,,,,,standard,,,,,,,21.121606991558384,6951.486754353506,0.8883035099860054,,COMPLETE
166,86.41914406523932,2025-05-04 05:05:09.622367,2025-05-04 05:05:35.168010,0 days 00:00:25.545643,,,,,,none,,,,,,0.5384880991746255,0.5021618633026832,7.0,820.0,144.0,LightGBM,,,,,,,standard,,,,,,,24.00527981209438,7468.268460968589,0.8799998614612928,,COMPLETE
167,98.54833946768638,2025-05-04 05:05:09.865015,2025-05-04 05:05:14.270759,0 days 00:00:04.405744,,,,,,none,,,,,,0.5515581535622627,0.14712970067183695,2.0,826.0,150.0,LightGBM,,,,,,,standard,,,,,,,25.76791640591954,9711.775211838352,0.8439511947155904,,COMPLETE
168,81.759038249553,2025-05-04 05:05:10.172699,2025-05-04 05:05:16.803301,0 days 00:00:06.630602,,,,,,none,,,,,,0.874905528982776,0.5171207241381817,3.0,788.0,146.0,LightGBM,,,,,,,standard,,,,,,,22.69224508975709,6684.540335491872,0.8925928050767249,,COMPLETE
169,96.40868832891819,2025-05-04 05:05:10.383570,2025-05-04 05:05:15.081329,0 days 00:00:04.697759,,,,,,none,,,,,,0.875116000528147,0.49355735516672194,2.0,797.0,142.0,LightGBM,,,,,,,standard,,,,,,,25.828689410025074,9294.635185302486,0.8506538007126774,,COMPLETE
170,100.48517916770159,2025-05-04 05:05:10.934961,2025-05-04 05:05:15.195460,0 days 00:00:04.260499,,,,,,none,,,,,,0.6535185432167392,0.14135371072871059,2.0,798.0,146.0,LightGBM,,,,,,,standard,,,,,,,25.588120582648035,10097.271232365089,0.8377570446109048,,COMPLETE
171,92.40313739741475,2025-05-04 05:05:11.038859,2025-05-04 05:05:15.095001,0 days 00:00:04.056142,,,,,,none,,,,,,0.6437461135605742,0.44983992326066363,2.0,771.0,147.0,LightGBM,,,,,,,standard,,,,,,,26.060036675173993,8538.33980088551,0.8628059550414269,,COMPLETE
172,91.66762023143559,2025-05-04 05:05:11.198605,2025-05-04 05:05:15.312470,0 days 00:00:04.113865,,,,,,none,,,,,,0.8643271892799363,0.4832172320411426,2.0,741.0,147.0,LightGBM,,,,,,,standard,,,,,,,25.63621385261626,8402.952598894699,0.8649813566194732,,COMPLETE
173,,2025-05-04 05:05:11.227792,2025-05-04 05:05:11.354361,0 days 00:00:00.126569,,,,,,none,,,,,,,,,,,RandomForest,True,mae,4.0,13.0,4.0,12.0,standard,,,,,,,,,,"The 'criterion' parameter of RandomForestRegressor must be a str among {'friedman_mse', 'absolute_error', 'poisson', 'squared_error'}. Got 'mae' instead.",PRUNED
174,95.77505598617411,2025-05-04 05:05:11.351799,2025-05-04 05:05:15.718805,0 days 00:00:04.367006,,,,,,none,,,,,,0.8671009192415811,0.5021360115584792,2.0,808.0,148.0,LightGBM,,,,,,,standard,,,,,,,25.982961848931012,9172.861349154784,0.8526104627267018,,COMPLETE
175,94.7363807729969,2025-05-04 05:05:11.358300,2025-05-04 05:05:15.365320,0 days 00:00:04.007020,,,,,,none,,,,,,0.5371946986291853,0.47952525049338796,2.0,726.0,148.0,LightGBM,,,,,,,standard,,,,,,,26.806969310977067,8974.981841966257,0.8557899906722619,,COMPLETE
176,97.56012780873627,2025-05-04 05:05:11.458491,2025-05-04 05:05:15.572048,0 days 00:00:04.113557,,,,,,none,,,,,,0.8494601906048829,0.5090459822485218,2.0,754.0,51.0,LightGBM,,,,,,,standard,,,,,,,26.270011507638042,9517.978538056956,0.8470651196934683,,COMPLETE
177,95.60997829540219,2025-05-04 05:05:11.521959,2025-05-04 05:05:16.332386,0 days 00:00:04.810427,,,,,,none,,,,,,0.8560678258295341,0.49127894762871616,2.0,788.0,148.0,LightGBM,,,,,,,standard,,,,,,,25.87282606582142,9141.267949647277,0.853118105473829,,COMPLETE
178,94.86872653161382,2025-05-04 05:05:11.647816,2025-05-04 05:05:16.977360,0 days 00:00:05.329544,,,,,,none,,,,,,0.874748856235684,0.47375792852379495,2.0,911.0,158.0,LightGBM,,,,,,,standard,,,,,,,25.883279395116453,9000.075273730128,0.8553867894076296,,COMPLETE
179,95.5792950181627,2025-05-04 05:05:11.741755,2025-05-04 05:05:16.019172,0 days 00:00:04.277417,,,,,,none,,,,,,0.8579774578186842,0.466596063137919,2.0,792.0,52.0,LightGBM,,,,,,,standard,,,,,,,25.83110285430713,9135.40163616898,0.8532123653995115,,COMPLETE
180,93.17207527962275,2025-05-04 05:05:11.773743,2025-05-04 05:05:15.824722,0 days 00:00:04.050979,,,,,,none,,,,,,0.487651426699952,0.2873605580180167,2.0,792.0,58.0,LightGBM,,,,,,,standard,,,,,,,26.175494889882135,8681.035611911688,0.8605131187325117,,COMPLETE
181,95.34273382810257,2025-05-04 05:05:12.143283,2025-05-04 05:05:32.298564,0 days 00:00:20.155281,,,,,,none,,,,,,0.8720335961722385,0.5159532764616503,6.0,926.0,111.0,LightGBM,,,,,,,standard,,,,,,,22.86600437737952,9090.236893816415,0.8539380724851229,,COMPLETE
182,95.43275203311876,2025-05-04 05:05:12.396365,2025-05-04 05:05:16.426278,0 days 00:00:04.029913,,,,,,none,,,,,,0.6602031926491565,0.5436166224445604,2.0,795.0,166.0,LightGBM,,,,,,,standard,,,,,,,25.9202680554127,9107.410160614732,0.8536621324321199,,COMPLETE
183,100.21718158170486,2025-05-04 05:05:13.218605,2025-05-04 05:05:17.290954,0 days 00:00:04.072349,,,,,,none,,,,,,0.8597618317892888,0.27661619488453776,2.0,801.0,148.0,LightGBM,,,,,,,standard,,,,,,,25.628225852130804,10043.483484180406,0.8386213061552749,,COMPLETE
184,100.09457457775943,2025-05-04 05:05:13.340758,2025-05-04 05:05:17.372375,0 days 00:00:04.031617,,,,,,none,,,,,,0.9571649116941199,0.5036852726445282,2.0,772.0,147.0,LightGBM,,,,,,,standard,,,,,,,26.374656009481292,10018.923859902645,0.8390159302011555,,COMPLETE
185,85.63345906530505,2025-05-04 05:05:13.668205,2025-05-04 05:05:28.716383,0 days 00:00:15.048178,,,,,,none,,,,,,0.882615326413228,0.28895859636661286,6.0,791.0,147.0,LightGBM,,,,,,,standard,,,,,,,21.242278401348546,7333.089311489274,0.8821719200515592,,COMPLETE
186,84.93289656684951,2025-05-04 05:05:14.275429,2025-05-04 05:05:32.124302,0 days 00:00:17.848873,,,,,,none,,,,,,0.48904001380613066,0.4505464584207123,6.0,798.0,145.0,LightGBM,,,,,,,standard,,,,,,,23.24533276860585,7213.596919235157,0.8840919238248242,,COMPLETE
187,81.65574052488024,2025-05-04 05:05:15.092014,2025-05-04 05:05:34.251188,0 days 00:00:19.159174,,,,,,none,,,,,,0.4885826339198046,0.2856852548268962,6.0,914.0,113.0,LightGBM,,,,,,,standard,,,,,,,22.05367783764001,6667.659960666569,0.8928640389414699,,COMPLETE
188,87.01672242606814,2025-05-04 05:05:15.098963,2025-05-04 05:05:23.479200,0 days 00:00:08.380237,,,,,,none,,,,,,0.9610345501281502,0.2812332275628804,6.0,470.0,110.0,LightGBM,,,,,,,standard,,,,,,,21.656300704109935,7571.909981775391,0.8783345494923701,,COMPLETE
189,84.44104500450551,2025-05-04 05:05:15.211307,2025-05-04 05:05:25.998265,0 days 00:00:10.786958,,,,,,none,,,,,,0.870044317046194,0.27995463402683246,6.0,561.0,111.0,LightGBM,,,,,,,standard,,,,,,,21.31709354782249,7130.290081452926,0.8854304981044361,,COMPLETE
190,82.61714469978851,2025-05-04 05:05:15.326972,2025-05-04 05:05:25.148607,0 days 00:00:09.821635,,,,,,none,,,,,,0.4893150559891788,0.28261513089288326,6.0,489.0,111.0,LightGBM,,,,,,,standard,,,,,,,22.621573703985714,6825.592598345792,0.8903263773000414,,COMPLETE
191,88.74713024338442,2025-05-04 05:05:15.376543,2025-05-04 05:05:34.190555,0 days 00:00:18.814012,,,,,,none,,,,,,0.9626689335442182,0.2707423728236823,6.0,908.0,47.0,LightGBM,,,,,,,standard,,,,,,,21.433276148271943,7876.053126436236,0.8734475774069872,,COMPLETE
192,87.55244133625219,2025-05-04 05:05:15.577234,2025-05-04 05:05:35.426360,0 days 00:00:19.849126,,,,,,none,,,,,,0.9601244853760098,0.2830559403030509,6.0,914.0,111.0,LightGBM,,,,,,,standard,,,,,,,21.38284149841208,7665.429983937881,0.8768318700862547,,COMPLETE
193,80.7393501469756,2025-05-04 05:05:15.724917,2025-05-04 05:05:27.815403,0 days 00:00:12.090486,,,,,,none,,,,,,0.5022301922305192,0.28313142650274425,6.0,567.0,111.0,LightGBM,,,,,,,standard,,,,,,,22.563657028858476,6518.842662155929,0.8952552353120296,,COMPLETE
194,88.59401370216911,2025-05-04 05:05:15.829117,2025-05-04 05:05:32.845528,0 days 00:00:17.016411,,,,,,none,,,,,,0.9545815132060586,0.28444907754861803,6.0,915.0,111.0,LightGBM,,,,,,,standard,,,,,,,20.96621162453178,7848.8992638601285,0.873883885674161,,COMPLETE
195,83.14446719652562,2025-05-04 05:05:16.023072,2025-05-04 05:05:33.344910,0 days 00:00:17.321838,,,,,,none,,,,,,0.9563019822159144,0.2824068869332763,6.0,910.0,111.0,LightGBM,,,,,,,standard,,,,,,,20.688572300539672,6913.002425394126,0.888921876188403,,COMPLETE
196,89.94741062647006,2025-05-04 05:05:16.338851,2025-05-04 05:05:37.172292,0 days 00:00:20.833441,,,,,,none,,,,,,0.9585576820295113,0.2809058951708471,7.0,917.0,111.0,LightGBM,,,,,,,standard,,,,,,,21.23982468747323,8090.536678406819,0.8700012556678507,,COMPLETE
197,80.82036003177713,2025-05-04 05:05:16.429347,2025-05-04 05:05:26.118540,0 days 00:00:09.689193,,,,,,none,,,,,,0.9643525052174862,0.2867760579855112,4.0,912.0,112.0,LightGBM,,,,,,,standard,,,,,,,21.63703443142766,6531.930595666078,0.8950449383947974,,COMPLETE
198,85.24676484726363,2025-05-04 05:05:16.807656,2025-05-04 05:05:34.496799,0 days 00:00:17.689143,,,,,,none,,,,,,0.9548206493012313,0.2807566032516008,6.0,907.0,113.0,LightGBM,,,,,,,standard,,,,,,,21.18645778930277,7267.010916924663,0.883233667703456,,COMPLETE
199,88.64939816225926,2025-05-04 05:05:16.982346,2025-05-04 05:05:27.381856,0 days 00:00:10.399510,,,,,,none,,,,,,0.9521711984884579,0.2811192873940289,6.0,578.0,107.0,LightGBM,,,,,,,standard,,,,,,,21.531297598313003,7858.715794530776,0.8737261536581516,,COMPLETE
200,87.11697615894705,2025-05-04 05:05:17.295790,2025-05-04 05:05:27.692689,0 days 00:00:10.396899,,,,,,none,,,,,,0.9576300855179153,0.28574254575342356,6.0,528.0,112.0,LightGBM,,,,,,,standard,,,,,,,21.74694702217672,7589.36753507855,0.8780540415237728,,COMPLETE
201,85.84788839700379,2025-05-04 05:05:17.376396,2025-05-04 05:05:34.068284,0 days 00:00:16.691888,,,,,,none,,,,,,0.9585290636028232,0.2812353320452087,6.0,930.0,111.0,LightGBM,,,,,,,standard,,,,,,,20.894633070251125,7369.859942224417,0.881581089552437,,COMPLETE
202,80.9719148545694,2025-05-04 05:05:17.994333,2025-05-04 05:05:28.254325,0 days 00:00:10.259992,,,,,,none,,,,,,0.8042505853906383,0.2970932628695606,6.0,557.0,116.0,LightGBM,,,,,,,standard,,,,,,,21.41386306179039,6556.450995215639,0.8946509446118543,,COMPLETE
203,88.33155953891153,2025-05-04 05:05:18.169786,2025-05-04 05:05:38.567867,0 days 00:00:20.398081,,,,,,none,,,,,,0.7772519775314355,0.29413573494432366,6.0,923.0,114.0,LightGBM,,,,,,,standard,,,,,,,21.547596424406784,7802.464410576273,0.8746300009023708,,COMPLETE
204,82.48848616226579,2025-05-04 05:05:20.197531,2025-05-04 05:05:30.659509,0 days 00:00:10.461978,,,,,,none,,,,,,0.7854528318312146,0.2927555969773063,4.0,909.0,112.0,LightGBM,,,,,,,standard,,,,,,,21.44762729736903,6804.350349342313,0.8906676977596115,,COMPLETE
205,86.27391655270574,2025-05-04 05:05:22.077725,2025-05-04 05:05:26.882212,0 days 00:00:04.804487,,,,,,none,,,,,,0.7908855166462128,0.300671072372464,8.0,176.0,110.0,LightGBM,,,,,,,standard,,,,,,,22.59491011118826,7443.188677343233,0.8804028434276338,,COMPLETE
206,89.36635792027852,2025-05-04 05:05:22.592932,2025-05-04 05:05:37.942375,0 days 00:00:15.349443,,,,,,none,,,,,,0.7928532271825822,0.2932851160235425,8.0,615.0,111.0,LightGBM,,,,,,,standard,,,,,,,22.259114316847644,7986.3459279353265,0.8716753926590923,,COMPLETE
207,82.79781699811926,2025-05-04 05:05:23.482499,2025-05-04 05:05:43.962439,0 days 00:00:20.479940,,,,,,none,,,,,,0.8060760484288533,0.29778768184552995,7.0,921.0,117.0,LightGBM,,,,,,,standard,,,,,,,20.82852087125371,6855.478499654046,0.8898461706341874,,COMPLETE
208,86.76331707871597,2025-05-04 05:05:24.752264,2025-05-04 05:05:53.775293,0 days 00:00:29.023029,,,,,,none,,,,,,0.5114357979723997,0.30495252829411124,8.0,909.0,111.0,LightGBM,,,,,,,standard,,,,,,,22.729198220175228,7527.873190501806,0.8790421326599074,,COMPLETE
209,84.62340335875928,2025-05-04 05:05:25.153041,2025-05-04 05:05:39.755003,0 days 00:00:14.601962,,,,,,none,,,,,,0.5123815009734379,0.2910021891106695,7.0,566.0,112.0,LightGBM,,,,,,,standard,,,,,,,22.711089908582135,7161.12039601927,0.8849351166062362,,COMPLETE
210,92.46045477397575,2025-05-04 05:05:26.004126,2025-05-04 05:05:36.592893,0 days 00:00:10.588767,,,,,,none,,,,,,0.7931669748684741,0.30348805815852825,7.0,492.0,114.0,LightGBM,,,,,,,standard,,,,,,,22.178089136069993,8548.935697010416,0.8626357001812037,,COMPLETE
211,85.15826344832163,2025-05-04 05:05:26.122194,2025-05-04 05:05:49.954625,0 days 00:00:23.832431,,,,,,none,,,,,,0.5031254282923905,0.3012056568305846,7.0,904.0,138.0,LightGBM,,,,,,,standard,,,,,,,22.43786210123331,7251.9298335337535,0.8834759905532145,,COMPLETE
212,,2025-05-04 05:05:26.507713,2025-05-04 05:05:26.551667,0 days 00:00:00.043954,,,,,,none,,,,,,,,,,,RandomForest,True,mae,22.0,14.0,5.0,189.0,standard,,,,,,,,,,"The 'criterion' parameter of RandomForestRegressor must be a str among {'friedman_mse', 'absolute_error', 'poisson', 'squared_error'}. Got 'mae' instead.",PRUNED
213,81.27509556247175,2025-05-04 05:05:26.555019,2025-05-04 05:05:40.128035,0 days 00:00:13.573016,,,,,,none,,,,,,0.5128859911601051,0.4191497438979671,7.0,517.0,112.0,LightGBM,,,,,,,standard,,,,,,,23.48684647960063,6605.641158688914,0.893860557059186,,COMPLETE
214,81.87356138116046,2025-05-04 05:05:26.885919,2025-05-04 05:05:51.581032,0 days 00:00:24.695113,,,,,,none,,,,,,0.5188510544621154,0.41759965111246594,7.0,911.0,114.0,LightGBM,,,,,,,standard,,,,,,,23.201012172828463,6703.280053234648,0.8922916952897559,,COMPLETE
215,81.15903611316757,2025-05-04 05:05:27.134227,2025-05-04 05:05:49.446567,0 days 00:00:22.312340,,,,,,none,,,,,,0.5107585773968294,0.17862479214020668,7.0,909.0,115.0,LightGBM,,,,,,,standard,,,,,,,21.833973933008338,6586.789142818439,0.8941634712524845,,COMPLETE
216,83.60292561846418,2025-05-04 05:05:27.389693,2025-05-04 05:06:04.277244,0 days 00:00:36.887551,,,,,,none,,,,,,0.5107739407188497,0.1813645026320494,15.0,506.0,137.0,LightGBM,,,,,,,standard,,,,,,,22.17584029123929,6989.449171966455,0.8876935298551857,,COMPLETE
217,82.15144672933164,2025-05-04 05:05:27.697028,2025-05-04 05:05:51.755506,0 days 00:00:24.058478,,,,,,none,,,,,,0.5055990077884136,0.42711191122420866,7.0,899.0,138.0,LightGBM,,,,,,,standard,,,,,,,23.200539671728485,6748.860199722214,0.8915593134904528,,COMPLETE
218,95.57887806567874,2025-05-04 05:05:27.818278,2025-05-04 05:06:01.202543,0 days 00:00:33.384265,,,,,,none,,,,,,0.5076704808087414,0.79379049035247,7.0,935.0,137.0,LightGBM,,,,,,,standard,,,,,,,28.151248368157322,9135.321932293884,0.8532136460813862,,COMPLETE
219,82.21815181432893,2025-05-04 05:05:28.258438,2025-05-04 05:05:38.553707,0 days 00:00:10.295269,,,,,,none,,,,,,0.5009268258828066,0.40996169851200204,7.0,416.0,117.0,LightGBM,,,,,,,standard,,,,,,,23.36122643289409,6759.824487764041,0.8913831393088639,,COMPLETE
220,86.33654482168325,2025-05-04 05:05:28.643354,2025-05-04 05:05:32.862537,0 days 00:00:04.219183,,,,,,none,,,,,,0.47732574934309774,0.40292411350641405,4.0,412.0,117.0,LightGBM,,,,,,,standard,,,,,,,24.358926136649043,7453.99897174652,0.8802291436158476,,COMPLETE
221,92.1188018586114,2025-05-04 05:05:28.723379,2025-05-04 05:06:18.926470,0 days 00:00:50.203091,,,,,,none,,,,,,0.500865858761768,0.4218959013144486,11.0,909.0,116.0,LightGBM,,,,,,,standard,,,,,,,25.047212735679004,8485.873655866108,0.8636489810659764,,COMPLETE
222,88.4341979478352,2025-05-04 05:05:30.532126,2025-05-04 05:06:25.710353,0 days 00:00:55.178227,,,,,,none,,,,,,0.4696585421295302,0.4209620751748179,12.0,895.0,122.0,LightGBM,,,,,,,standard,,,,,,,24.74062577684045,7820.607366676901,0.8743384798815403,,COMPLETE
223,87.50407733553529,2025-05-04 05:05:30.664797,2025-05-04 05:05:40.422758,0 days 00:00:09.757961,,,,,,none,,,,,,0.46504312711947715,0.42892891022847235,4.0,936.0,115.0,LightGBM,,,,,,,standard,,,,,,,23.67308830678273,7656.96355034334,0.876967908742281,,COMPLETE
224,100.54000805051028,2025-05-04 05:05:30.835256,2025-05-04 05:05:37.735609,0 days 00:00:06.900353,,,,,,none,,,,,,0.4791319774698221,0.8649923042867135,4.0,635.0,116.0,LightGBM,,,,,,,standard,,,,,,,27.663038571127554,10108.293218796673,0.8375799433315823,,COMPLETE
225,90.08028767309933,2025-05-04 05:05:31.644182,2025-05-04 05:05:35.718227,0 days 00:00:04.074045,,,,,,none,,,,,,0.5054398705028637,0.4227246370018763,4.0,408.0,116.0,LightGBM,,,,,,,standard,,,,,,,24.52966169621132,8114.458227268333,0.8696168842178358,,COMPLETE
226,80.0584023981845,2025-05-04 05:05:31.791411,2025-05-04 05:05:41.265030,0 days 00:00:09.473619,,,,,,none,,,,,,0.510148844550047,0.25487047591177553,4.0,908.0,116.0,LightGBM,,,,,,,standard,,,,,,,22.223576953941187,6409.347794549633,0.897014598858038,,COMPLETE
227,84.17398829326208,2025-05-04 05:05:32.127212,2025-05-04 05:05:41.519943,0 days 00:00:09.392731,,,,,,none,,,,,,0.5113647159410787,0.4039477455443991,4.0,907.0,116.0,LightGBM,,,,,,,standard,,,,,,,23.22631462359861,7085.2603051942215,0.8861540365548349,,COMPLETE
228,78.71851469761378,2025-05-04 05:05:32.301768,2025-05-04 05:05:41.276606,0 days 00:00:08.974838,,,,,,none,,,,,,0.520614845348891,0.25450394072635635,4.0,900.0,116.0,LightGBM,,,,,,,standard,,,,,,,22.20805506161784,6196.604556198437,0.9004329572377266,,COMPLETE
229,80.44493856385985,2025-05-04 05:05:32.848978,2025-05-04 05:05:43.150234,0 days 00:00:10.301256,,,,,,none,,,,,,0.8156576535979145,0.41115387975247536,4.0,894.0,117.0,LightGBM,,,,,,,standard,,,,,,,21.559759256248824,6471.388140543187,0.8960177345710718,,COMPLETE
230,80.76470193484066,2025-05-04 05:05:32.874960,2025-05-04 05:05:41.961085,0 days 00:00:09.086125,,,,,,none,,,,,,0.8026059731656973,0.24635132368505874,4.0,898.0,117.0,LightGBM,,,,,,,standard,,,,,,,21.509399168090376,6522.937078623654,0.8951894462277283,,COMPLETE
231,78.94608831503595,2025-05-04 05:05:33.349156,2025-05-04 05:05:43.422811,0 days 00:00:10.073655,,,,,,none,,,,,,0.5157042475048134,0.2520624834675177,4.0,977.0,124.0,LightGBM,,,,,,,standard,,,,,,,22.133523603043344,6232.484860245456,0.8998564325079375,,COMPLETE
232,96.4284579201248,2025-05-04 05:05:34.073260,2025-05-04 05:05:49.131868,0 days 00:00:15.058608,,,,,,none,,,,,,0.5209300972223216,0.7920250612405108,5.0,894.0,124.0,LightGBM,,,,,,,standard,,,,,,,26.541679251745936,9298.44749685328,0.8505925444902158,,COMPLETE
233,88.76947364089693,2025-05-04 05:05:34.201649,2025-05-04 05:05:45.145622,0 days 00:00:10.943973,,,,,,none,,,,,,0.5095035422286631,0.8372551816049598,4.0,973.0,124.0,LightGBM,,,,,,,standard,,,,,,,25.954076932520945,7880.019450481896,0.8733838465117394,,COMPLETE
234,83.3570621155416,2025-05-04 05:05:34.255378,2025-05-04 05:05:43.770264,0 days 00:00:09.514886,,,,,,none,,,,,,0.5113813491589416,0.4001391561057041,4.0,973.0,125.0,LightGBM,,,,,,,standard,,,,,,,23.23392209787148,6948.3998045342605,0.8883531110960763,,COMPLETE
235,80.934055999318,2025-05-04 05:05:34.502285,2025-05-04 05:05:48.040175,0 days 00:00:13.537890,,,,,,none,,,,,,0.8139857503066105,0.2547732955348401,5.0,974.0,124.0,LightGBM,,,,,,,standard,,,,,,,20.885137586586485,6550.321420500743,0.8947494346191184,,COMPLETE
