number,value,datetime_start,datetime_complete,duration,params_dt_criterion,params_dt_max_depth,params_dt_min_samples_leaf,params_dt_min_samples_split,params_dt_splitter,params_feature_selector,params_hgb_learning_rate,params_hgb_max_bins,params_hgb_max_depth,params_hgb_max_iter,params_lasso_alpha,params_lgb_feature_fraction,params_lgb_learning_rate,params_lgb_max_depth,params_lgb_n_estimators,params_lgb_num_leaves,params_model,params_rf_bootstrap,params_rf_criterion,params_rf_max_depth,params_rf_min_samples_leaf,params_rf_min_samples_split,params_rf_n_estimators,params_scaler,params_xgb_alpha,params_xgb_booster,params_xgb_lambda,params_xgb_learning_rate,params_xgb_max_depth,params_xgb_n_estimators,user_attrs_MAE,user_attrs_MSE,user_attrs_R2,user_attrs_error,state
77,131.34897329986816,2025-05-04 05:04:43.672506,2025-05-04 05:04:44.952503,0 days 00:00:01.279997,,,,,,none,,,,,,,,,,,XGBoost,,,,,,,maxabs,0.06228835263069626,gblinear,0.00046462748874899484,0.7384904430131258,30.0,115.0,32.453961465114226,17252.55278692948,0.7227859497070312,,COMPLETE
78,131.57294388617103,2025-05-04 05:04:43.707670,2025-05-04 05:04:44.861346,0 days 00:00:01.153676,,,,,,none,,,,,,,,,,,XGBoost,,,,,,,maxabs,0.03504797855513453,gblinear,0.012431279606304028,0.8877348092084972,30.0,107.0,32.44595888643548,17311.439562873515,0.7218397855758667,,COMPLETE
79,131.5701232946231,2025-05-04 05:04:44.434978,2025-05-04 05:04:45.768400,0 days 00:00:01.333422,,,,,,none,,,,,,,,,,,XGBoost,,,,,,,maxabs,0.0352778518259633,gblinear,0.0009953830480266823,0.9877182036406373,30.0,125.0,32.44068779940651,17310.697343762327,0.7218517065048218,,COMPLETE
80,131.77859670316175,2025-05-04 05:04:44.504230,2025-05-04 05:04:45.718235,0 days 00:00:01.214005,,,,,,none,,,,,,,,,,,XGBoost,,,,,,,maxabs,0.004540806428122476,gblinear,0.20124790833513218,0.32880090815481666,30.0,115.0,32.31058375076325,17365.598549054557,0.720969557762146,,COMPLETE
81,130.72085300110558,2025-05-04 05:04:44.528758,2025-05-04 05:04:45.834850,0 days 00:00:01.306092,,,,,,none,,,,,,,,,,,XGBoost,,,,,,,maxabs,0.1594718684134629,gblinear,0.20791450669389608,0.9935798955359136,30.0,111.0,32.67544131535389,17087.941409336658,0.7254309058189392,,COMPLETE
82,103.70489679913229,2025-05-04 05:04:44.553904,2025-05-04 05:05:02.205070,0 days 00:00:17.651166,,,,,,none,,,,,,,,,,,XGBoost,,,,,,,maxabs,0.24875712082855317,gbtree,0.22741002465849816,0.3697732722287426,25.0,143.0,23.823089427926835,10754.705620118679,0.8271933794021606,,COMPLETE
83,90.28174135747368,2025-05-04 05:04:44.618015,2025-05-04 05:05:00.974707,0 days 00:00:16.356692,,,,,,none,,,,,,0.5919944999358289,0.2185914375425901,5.0,840.0,126.0,LightGBM,,,,,,,maxabs,,,,,,,22.004395310381906,8150.792822537774,0.8690330599366296,,COMPLETE
84,102.34328982420854,2025-05-04 05:04:44.623728,2025-05-04 05:05:01.593757,0 days 00:00:16.970029,,,,,,none,,,,,,,,,,,XGBoost,,,,,,,maxabs,0.22177154855042303,gbtree,0.19600193795921078,0.44069326961704997,25.0,144.0,23.942746004689827,10474.148972041949,0.8317013382911682,,COMPLETE
85,104.18875989428054,2025-05-04 05:04:44.634114,2025-05-04 05:04:57.326470,0 days 00:00:12.692356,,,,,,none,,,,,,,,,,,XGBoost,,,,,,,maxabs,0.2204869946386417,gbtree,0.2106024259258632,0.42819350811208223,25.0,86.0,23.80989167533056,10855.297688308041,0.8255770802497864,,COMPLETE
86,85.29555454869063,2025-05-04 05:04:44.677064,2025-05-04 05:05:04.381754,0 days 00:00:19.704690,,,,,,none,,,,,,0.5883704092844009,0.21528324135158278,5.0,978.0,111.0,LightGBM,,,,,,,maxabs,,,,,,,21.205283111009777,7275.331625768658,0.8830999705527393,,COMPLETE
87,82.87728944380996,2025-05-04 05:04:44.711150,2025-05-04 05:05:04.165548,0 days 00:00:19.454398,,,,,,none,,,,,,0.5911535889581707,0.24523496193664096,5.0,944.0,114.0,LightGBM,,,,,,,maxabs,,,,,,,21.028631163593996,6868.645105553052,0.8896346096090015,,COMPLETE
88,86.9387463704645,2025-05-04 05:04:44.729367,2025-05-04 05:05:03.510653,0 days 00:00:18.781286,,,,,,none,,,,,,0.5835810116882584,0.21062006075647438,5.0,986.0,116.0,LightGBM,,,,,,,maxabs,,,,,,,21.921010461994562,7558.345620467954,0.878552501651507,,COMPLETE
89,84.84029459466106,2025-05-04 05:04:44.733757,2025-05-04 05:05:02.837225,0 days 00:00:18.103468,,,,,,none,,,,,,0.5823570963296403,0.23708917352258335,5.0,873.0,117.0,LightGBM,,,,,,,maxabs,,,,,,,21.276783160430913,7197.8755869088745,0.884344534194554,,COMPLETE
90,86.22946851183544,2025-05-04 05:04:44.741679,2025-05-04 05:05:10.375109,0 days 00:00:25.633430,,,,,,none,,,,,,0.6361734003168352,0.23350504723174825,6.0,959.0,120.0,LightGBM,,,,,,,maxabs,,,,,,,21.21047778666969,7435.521239833619,0.8805260438144703,,COMPLETE
91,84.52131154782624,2025-05-04 05:04:44.782267,2025-05-04 05:05:04.717444,0 days 00:00:19.935177,,,,,,none,,,,,,0.5896976490433878,0.23389064382591152,5.0,981.0,103.0,LightGBM,,,,,,,maxabs,,,,,,,21.464767563280397,7143.852105764705,0.8852125834961457,,COMPLETE
92,83.35170699767286,2025-05-04 05:04:44.803274,2025-05-04 05:04:59.228438,0 days 00:00:14.425164,,,,,,none,,,,,,0.5902185536503732,0.2087153469693698,4.0,974.0,104.0,LightGBM,,,,,,,maxabs,,,,,,,21.62383583041165,6947.507059425907,0.8883674557245859,,COMPLETE
93,85.58830167060376,2025-05-04 05:04:44.814345,2025-05-04 05:04:59.069490,0 days 00:00:14.255145,,,,,,none,,,,,,0.5881375373589245,0.23077860743417491,4.0,980.0,124.0,LightGBM,,,,,,,maxabs,,,,,,,21.90731184875982,7325.357382858274,0.882296156681742,,COMPLETE
94,87.50076846041254,2025-05-04 05:04:44.862323,2025-05-04 05:05:03.799132,0 days 00:00:18.936809,,,,,,none,,,,,,0.6227597983359641,0.24081206616244655,5.0,921.0,107.0,LightGBM,,,,,,,maxabs,,,,,,,21.631092040636993,7656.384481162727,0.8769772132259455,,COMPLETE
95,81.81403443307228,2025-05-04 05:04:44.881448,2025-05-04 05:05:04.850807,0 days 00:00:19.969359,,,,,,none,,,,,,0.5957115636188034,0.22645066372261294,5.0,992.0,125.0,LightGBM,,,,,,,maxabs,,,,,,,21.045041091484126,6693.5362302159365,0.8924482590392051,,COMPLETE
96,82.4140077963899,2025-05-04 05:04:44.892343,2025-05-04 05:04:59.401493,0 days 00:00:14.509150,,,,,,none,,,,,,0.6281787039811194,0.275997957704254,4.0,980.0,109.0,LightGBM,,,,,,,maxabs,,,,,,,21.770188445997018,6792.068681063414,0.8908650396070099,,COMPLETE
97,89.16786743431733,2025-05-04 05:04:44.918660,2025-05-04 05:04:49.677185,0 days 00:00:04.758525,,,,,,none,,,,,,0.9684315089679568,0.22112207576616996,4.0,241.0,69.0,LightGBM,,,,,,,maxabs,,,,,,,23.129804005444235,7950.908582783988,0.8722447999252918,,COMPLETE
98,86.97409601334506,2025-05-04 05:04:44.931564,2025-05-04 05:04:49.871837,0 days 00:00:04.940273,,,,,,none,,,,,,0.9967759663319278,0.2238118622595229,4.0,256.0,93.0,LightGBM,,,,,,,maxabs,,,,,,,22.40421061103225,7564.493377338566,0.8784537194933626,,COMPLETE
99,86.63833775842517,2025-05-04 05:04:44.957941,2025-05-04 05:04:59.646385,0 days 00:00:14.688444,,,,,,none,,,,,,0.9755287025756314,0.2132039407331351,4.0,959.0,89.0,LightGBM,,,,,,,maxabs,,,,,,,21.205761839876615,7506.20156954296,0.8793903522681086,,COMPLETE
100,85.84416475527483,2025-05-04 05:04:44.965449,2025-05-04 05:04:59.336330,0 days 00:00:14.370881,,,,,,none,,,,,,0.9916310435954806,0.2725039496855255,4.0,928.0,87.0,LightGBM,,,,,,,maxabs,,,,,,,21.550076166098695,7369.220622530769,0.8815913621413523,,COMPLETE
101,82.73540416500498,2025-05-04 05:04:44.994614,2025-05-04 05:04:59.288345,0 days 00:00:14.293731,,,,,,none,,,,,,0.9677032998772235,0.22775786789940802,4.0,947.0,96.0,LightGBM,,,,,,,maxabs,,,,,,,20.961316390240114,6845.147102346724,0.8900121755273773,,COMPLETE
102,90.46293890747826,2025-05-04 05:04:45.004901,2025-05-04 05:04:49.798335,0 days 00:00:04.793434,,,,,,none,,,,,,0.9818250396164195,0.18627487178458488,4.0,246.0,97.0,LightGBM,,,,,,,maxabs,,,,,,,22.637073690389826,8183.543315778144,0.8685068250072621,,COMPLETE
103,91.1855557252004,2025-05-04 05:04:45.034849,2025-05-04 05:04:50.749123,0 days 00:00:05.714274,,,,,,none,,,,,,0.9921844151579655,0.20879747236272297,4.0,276.0,104.0,LightGBM,,,,,,,maxabs,,,,,,,22.663911775790393,8314.805572913627,0.8663977030436525,,COMPLETE
104,87.40250657997527,2025-05-04 05:04:45.073218,2025-05-04 05:04:59.865222,0 days 00:00:14.792004,,,,,,none,,,,,,0.9985699694017289,0.2068988174332357,4.0,954.0,87.0,LightGBM,,,,,,,maxabs,,,,,,,20.82801807552203,7639.19815646262,0.877253363093316,,COMPLETE
105,83.49026897393891,2025-05-04 05:04:45.107469,2025-05-04 05:04:59.051769,0 days 00:00:13.944300,,,,,,none,,,,,,0.9794329901878012,0.20197364551640698,4.0,933.0,88.0,LightGBM,,,,,,,maxabs,,,,,,,20.986635581533754,6970.625013340667,0.8879959964382732,,COMPLETE
106,86.17150608205876,2025-05-04 05:04:45.109623,2025-05-04 05:05:01.226850,0 days 00:00:16.117227,,,,,,none,,,,,,0.9832319479264162,0.21031018673713195,4.0,957.0,85.0,LightGBM,,,,,,,maxabs,,,,,,,21.019170125284816,7425.528460450289,0.8806866077948164,,COMPLETE
107,86.6380576917555,2025-05-04 05:04:45.125250,2025-05-04 05:04:58.753058,0 days 00:00:13.627808,,,,,,none,,,,,,0.9410761574196608,0.22403154114073132,4.0,899.0,94.0,LightGBM,,,,,,,maxabs,,,,,,,21.460971136719493,7506.153040599955,0.8793911320311707,,COMPLETE
108,86.81382038489527,2025-05-04 05:04:45.723933,2025-05-04 05:04:52.106056,0 days 00:00:06.382123,,,,,,none,,,,,,0.9486252904336907,0.21711593288674397,5.0,269.0,96.0,LightGBM,,,,,,,maxabs,,,,,,,22.438509209703415,7536.6394098208575,0.8789012770468232,,COMPLETE
109,82.69438663310831,2025-05-04 05:04:45.772923,2025-05-04 05:05:06.411739,0 days 00:00:20.638816,,,,,,none,,,,,,0.9293505385134995,0.2142362008416759,5.0,894.0,99.0,LightGBM,,,,,,,maxabs,,,,,,,20.481557346121406,6838.361580626003,0.8901212052912107,,COMPLETE
110,82.40990666740647,2025-05-04 05:04:45.841531,2025-05-04 05:04:59.068556,0 days 00:00:13.227025,,,,,,none,,,,,,0.9817396553015261,0.2230308434017148,4.0,910.0,95.0,LightGBM,,,,,,,maxabs,,,,,,,20.95753819118802,6791.392716930645,0.8908759009987774,,COMPLETE
111,89.04358279701535,2025-05-04 05:04:46.363808,2025-05-04 05:06:12.837277,0 days 00:01:26.473469,,,,,,none,,,,,,0.949773894821807,0.18816756147623387,-1.0,944.0,91.0,LightGBM,,,,,,,standard,,,,,,,20.72224712884294,7928.759637328927,0.8726006891835563,,COMPLETE
112,86.19431223750959,2025-05-04 05:04:46.820056,2025-05-04 05:05:06.037218,0 days 00:00:19.217162,,,,,,none,,,,,,0.5926889055266942,0.15841496634233,-1.0,226.0,65.0,LightGBM,,,,,,,standard,,,,,,,22.192091801347825,7429.459462097295,0.8806234444598745,,COMPLETE
113,92.20651500130991,2025-05-04 05:04:49.683210,2025-05-04 05:05:46.999228,0 days 00:00:57.316018,,,,,,none,,,,,,0.9902373619590406,0.1771396479417091,-1.0,917.0,59.0,LightGBM,,,,,,,standard,,,,,,,20.365582670643644,8502.04140868679,0.8633891976116884,,COMPLETE
114,76.09029163048591,2025-05-04 05:04:49.803433,2025-05-04 05:05:02.604125,0 days 00:00:12.800692,,,,,,none,,,,,,0.98291412563132,0.19565632042593636,4.0,995.0,72.0,LightGBM,,,,,,,standard,,,,,,,21.117932154535563,5789.732480412395,0.9069705778009173,,COMPLETE
115,89.39504194408023,2025-05-04 05:04:49.875535,2025-05-04 05:04:54.309164,0 days 00:00:04.433629,,,,,,none,,,,,,0.9992018077554442,0.18318001029125588,5.0,245.0,74.0,LightGBM,,,,,,,standard,,,,,,,23.207767508451838,7991.473524183863,0.8715930024419475,,COMPLETE
116,86.99650306071757,2025-05-04 05:04:50.752936,2025-05-04 05:04:54.006451,0 days 00:00:03.253515,,,,,,none,,,,,,0.9882857538600399,0.225082719975298,4.0,266.0,91.0,LightGBM,,,,,,,standard,,,,,,,22.902573175050527,7568.391544793441,0.8783910837382238,,COMPLETE
117,85.30280146597187,2025-05-04 05:04:52.112986,2025-05-04 05:04:55.312150,0 days 00:00:03.199164,,,,,,none,,,,,,0.9957995266133207,0.20465728928810206,4.0,268.0,93.0,LightGBM,,,,,,,standard,,,,,,,23.198192408497988,7276.567937943013,0.8830801054885714,,COMPLETE
118,86.40108615736676,2025-05-04 05:04:54.010371,2025-05-04 05:04:58.949232,0 days 00:00:04.938861,,,,,,none,,,,,,0.9963658097649923,0.23552905356033502,5.0,267.0,96.0,LightGBM,,,,,,,standard,,,,,,,22.725785001437007,7465.147689172714,0.8800500060228883,,COMPLETE
119,87.17496398968808,2025-05-04 05:04:54.313836,2025-05-04 05:04:58.427195,0 days 00:00:04.113359,,,,,,none,,,,,,0.9984127152557257,0.22524107827742695,5.0,262.0,90.0,LightGBM,,,,,,,standard,,,,,,,22.761069505159902,7599.474346603413,0.8778916452749627,,COMPLETE
120,85.03284796246555,2025-05-04 05:04:55.318475,2025-05-04 05:04:58.542588,0 days 00:00:03.224113,,,,,,none,,,,,,0.9985616559759587,0.22441896367482736,4.0,269.0,101.0,LightGBM,,,,,,,standard,,,,,,,22.854741408329467,7230.585232607782,0.8838189556034877,,COMPLETE
121,86.12913430164322,2025-05-04 05:04:57.330867,2025-05-04 05:05:00.497899,0 days 00:00:03.167032,,,,,,none,,,,,,0.9940735939820393,0.2221091783031435,4.0,264.0,103.0,LightGBM,,,,,,,standard,,,,,,,23.27901229576944,7418.227775550496,0.8808039152006738,,COMPLETE
122,82.81192093517907,2025-05-04 05:04:58.431580,2025-05-04 05:05:01.774531,0 days 00:00:03.342951,,,,,,none,,,,,,0.949427689845722,0.2238864111508333,4.0,264.0,102.0,LightGBM,,,,,,,standard,,,,,,,22.93086370933801,6857.81424897435,0.8898086398138247,,COMPLETE
123,88.13802275928316,2025-05-04 05:04:58.547837,2025-05-04 05:05:02.728617,0 days 00:00:04.180780,,,,,,none,,,,,,0.9272105802576812,0.21446769030799942,5.0,259.0,84.0,LightGBM,,,,,,,standard,,,,,,,22.965338563112336,7768.311055915916,0.8751787770092051,,COMPLETE
124,86.20753325739342,2025-05-04 05:04:58.756931,2025-05-04 05:05:03.985640,0 days 00:00:05.228709,,,,,,none,,,,,,0.9139782420527564,0.21580502504962643,5.0,325.0,84.0,LightGBM,,,,,,,standard,,,,,,,22.49521191413744,7431.738790324592,0.8805868202136412,,COMPLETE
125,88.19498869998037,2025-05-04 05:04:58.953088,2025-05-04 05:05:04.242319,0 days 00:00:05.289231,,,,,,none,,,,,,0.9180725623205201,0.22359320172479324,5.0,287.0,77.0,LightGBM,,,,,,,standard,,,,,,,22.762867880367384,7778.3560317896645,0.8750173743356446,,COMPLETE
126,80.43090390092496,2025-05-04 05:04:59.056047,2025-05-04 05:05:11.630052,0 days 00:00:12.574005,,,,,,none,,,,,,0.9246089684840391,0.31995224472256395,4.0,951.0,131.0,LightGBM,,,,,,,standard,,,,,,,21.192702815601734,6469.130302319827,0.8960540135159192,,COMPLETE
127,79.91491597372108,2025-05-04 05:04:59.074174,2025-05-04 05:05:13.335648,0 days 00:00:14.261474,,,,,,none,,,,,,0.9112120864334359,0.3138426282180982,4.0,962.0,126.0,LightGBM,,,,,,,standard,,,,,,,21.322286841913446,6386.393795086899,0.8973834237241956,,COMPLETE
128,79.2169669815679,2025-05-04 05:04:59.080220,2025-05-04 05:05:13.214646,0 days 00:00:14.134426,,,,,,none,,,,,,0.9502846834448996,0.2984267863809974,4.0,952.0,130.0,LightGBM,,,,,,,standard,,,,,,,21.413008276326963,6275.327857758818,0.8991680312186846,,COMPLETE
129,81.05172649863057,2025-05-04 05:04:59.240690,2025-05-04 05:05:07.886139,0 days 00:00:08.645449,,,,,,none,,,,,,0.885201497653287,0.2949856969353172,3.0,963.0,126.0,LightGBM,,,,,,,standard,,,,,,,22.163151975407054,6569.382368408814,0.8944431633058144,,COMPLETE
130,83.92532840232076,2025-05-04 05:04:59.295587,2025-05-04 05:05:07.523681,0 days 00:00:08.228094,,,,,,none,,,,,,0.9311194930065909,0.3506055643282958,3.0,951.0,130.0,LightGBM,,,,,,,standard,,,,,,,22.831678363414138,7043.460747437387,0.886825671853953,,COMPLETE
131,85.70345787705769,2025-05-04 05:04:59.346962,2025-05-04 05:05:07.695119,0 days 00:00:08.348157,,,,,,none,,,,,,0.9120280421706091,0.341745910646706,3.0,956.0,133.0,LightGBM,,,,,,,standard,,,,,,,22.338328584631196,7345.082692084601,0.8819792104106955,,COMPLETE
132,87.64865444271854,2025-05-04 05:04:59.419851,2025-05-04 05:05:07.809572,0 days 00:00:08.389721,,,,,,none,,,,,,0.5972153074399904,0.36627553286152,3.0,998.0,127.0,LightGBM,,,,,,,standard,,,,,,,23.51803337058393,7682.286625619084,0.876561017565672,,COMPLETE
133,88.17004069409884,2025-05-04 05:04:59.651478,2025-05-04 05:05:07.041140,0 days 00:00:07.389662,,,,,,none,,,,,,0.6057974345583754,0.35517382339245046,3.0,873.0,129.0,LightGBM,,,,,,,standard,,,,,,,23.35269174857897,7773.956075999046,0.8750880728258231,,COMPLETE
134,82.213173270769,2025-05-04 05:04:59.868122,2025-05-04 05:05:20.191845,0 days 00:00:20.323723,,,,,,none,,,,,,0.607846783521076,0.366762581230111,6.0,855.0,127.0,LightGBM,,,,,,,standard,,,,,,,22.264245063274334,6759.005859249486,0.8913962930319353,,COMPLETE
135,86.00102975110896,2025-05-04 05:05:00.506537,2025-05-04 05:05:07.810639,0 days 00:00:07.304102,,,,,,none,,,,,,0.5960253163719553,0.3404193844782056,3.0,856.0,131.0,LightGBM,,,,,,,standard,,,,,,,23.925755880933753,7396.177118251128,0.8811582251648405,,COMPLETE
136,85.22151053559254,2025-05-04 05:05:00.982195,2025-05-04 05:05:08.442130,0 days 00:00:07.459935,,,,,,none,,,,,,0.9062798195179576,0.3657947381099782,3.0,869.0,122.0,LightGBM,,,,,,,standard,,,,,,,22.488178476329413,7262.705857968112,0.8833028413912932,,COMPLETE
137,86.78187585711585,2025-05-04 05:05:01.231565,2025-05-04 05:05:08.631163,0 days 00:00:07.399598,,,,,,none,,,,,,0.901492558777053,0.35198804480264034,3.0,862.0,121.0,LightGBM,,,,,,,standard,,,,,,,22.74215319107039,7531.093977279866,0.878990381057566,,COMPLETE
138,84.56623271134714,2025-05-04 05:05:01.598524,2025-05-04 05:05:09.228459,0 days 00:00:07.629935,,,,,,none,,,,,,0.9339701302123542,0.3684891921536784,3.0,882.0,119.0,LightGBM,,,,,,,standard,,,,,,,22.408600376195878,7151.447714989718,0.8850905372461949,,COMPLETE
139,84.38458385814596,2025-05-04 05:05:01.780665,2025-05-04 05:05:09.154401,0 days 00:00:07.373736,,,,,,none,,,,,,0.9220032965287596,0.34077416754584733,3.0,853.0,120.0,LightGBM,,,,,,,standard,,,,,,,22.428178503197557,7120.757992912468,0.8855836597042629,,COMPLETE
140,84.2299932583586,2025-05-04 05:05:02.210071,2025-05-04 05:05:09.613489,0 days 00:00:07.403418,,,,,,none,,,,,,0.9096748244365297,0.37469806899250885,3.0,856.0,129.0,LightGBM,,,,,,,standard,,,,,,,22.82848687651998,7094.691764303136,0.8860024918687264,,COMPLETE
141,83.83936065846932,2025-05-04 05:05:02.609226,2025-05-04 05:05:10.930930,0 days 00:00:08.321704,,,,,,none,,,,,,0.910123751559673,0.34004526868839086,3.0,874.0,126.0,LightGBM,,,,,,,standard,,,,,,,22.788235779745616,7029.038395620893,0.8870574102046936,,COMPLETE
142,87.91467155051109,2025-05-04 05:05:02.734593,2025-05-04 05:05:11.220362,0 days 00:00:08.485769,,,,,,none,,,,,,0.9012971330465644,0.34222708167597654,3.0,878.0,129.0,LightGBM,,,,,,,standard,,,,,,,22.949799367762253,7728.989473834245,0.8758105961948734,,COMPLETE
143,88.93031977179707,2025-05-04 05:05:02.842837,2025-05-04 05:05:11.034153,0 days 00:00:08.191316,,,,,,none,,,,,,0.5591040019399219,0.13222927465657036,3.0,996.0,129.0,LightGBM,,,,,,,standard,,,,,,,23.61908887939431,7908.601774714082,0.8729245857225021,,COMPLETE
144,85.52328803282481,2025-05-04 05:05:03.515054,2025-05-04 05:05:11.509629,0 days 00:00:07.994575,,,,,,none,,,,,,0.6554054759111925,0.14065340188784156,3.0,851.0,133.0,LightGBM,,,,,,,standard,,,,,,,23.068410559943658,7314.232795945515,0.8824749065456086,,COMPLETE
145,81.8206988361899,2025-05-04 05:05:03.802536,2025-05-04 05:05:12.140274,0 days 00:00:08.337738,,,,,,none,,,,,,0.9069918263299138,0.3345679460301126,3.0,861.0,130.0,LightGBM,,,,,,,standard,,,,,,,22.76927474027636,6694.626758042489,0.8924307364379555,,COMPLETE
146,80.35459566422165,2025-05-04 05:05:03.990093,2025-05-04 05:05:12.391092,0 days 00:00:08.400999,,,,,,none,,,,,,0.6434719173336408,0.34957473710828624,3.0,862.0,129.0,LightGBM,,,,,,,standard,,,,,,,22.96306959825134,6456.861044360548,0.8962511559543004,,COMPLETE
147,80.75917033083046,2025-05-04 05:05:04.169340,2025-05-04 05:05:11.342932,0 days 00:00:07.173592,,,,,,none,,,,,,0.5430794229400068,0.35630065155838,3.0,853.0,125.0,LightGBM,,,,,,,standard,,,,,,,23.778355609645672,6522.043592524086,0.8952038027624849,,COMPLETE
148,87.62660228230769,2025-05-04 05:05:04.244811,2025-05-04 05:05:11.435827,0 days 00:00:07.191016,,,,,,none,,,,,,0.5312004433063969,0.13253433436580828,3.0,857.0,131.0,LightGBM,,,,,,,standard,,,,,,,24.799672271059173,7678.421427541732,0.8766231235688487,,COMPLETE
149,80.09092396644517,2025-05-04 05:05:04.387625,2025-05-04 05:05:11.756291,0 days 00:00:07.368666,,,,,,none,,,,,,0.5223264815321914,0.357594922167069,3.0,863.0,117.0,LightGBM,,,,,,,standard,,,,,,,23.366680607747114,6414.556101798902,0.8969309117765236,,COMPLETE
150,87.77159687515385,2025-05-04 05:05:04.721313,2025-05-04 05:05:30.526785,0 days 00:00:25.805472,,,,,,none,,,,,,0.5492283046623858,0.35721894424878964,7.0,858.0,138.0,LightGBM,,,,,,,standard,,,,,,,22.987946490533577,7703.853218014517,0.8762144855564404,,COMPLETE
151,,2025-05-04 05:05:04.853653,2025-05-04 05:05:04.906296,0 days 00:00:00.052643,,,,,,none,,,,,,,,,,,RandomForest,True,mae,28.0,12.0,2.0,293.0,standard,,,,,,,,,,"The 'criterion' parameter of RandomForestRegressor must be a str among {'friedman_mse', 'absolute_error', 'poisson', 'squared_error'}. Got 'mae' instead.",PRUNED
152,89.45429849000043,2025-05-04 05:05:04.909207,2025-05-04 05:05:30.832302,0 days 00:00:25.923095,,,,,,none,,,,,,0.5400664882963668,0.33385257358527093,7.0,870.0,120.0,LightGBM,,,,,,,standard,,,,,,,23.3832229526975,8002.071518338092,0.871422713870589,,COMPLETE
153,85.72934473296662,2025-05-04 05:05:06.042387,2025-05-04 05:05:31.637744,0 days 00:00:25.595357,,,,,,none,,,,,,0.534395186706228,0.3412547817662085,7.0,852.0,139.0,LightGBM,,,,,,,standard,,,,,,,22.789747339200193,7349.520548343833,0.8819079029357827,,COMPLETE
154,91.44813714283985,2025-05-04 05:05:06.416480,2025-05-04 05:05:11.734847,0 days 00:00:05.318367,,,,,,none,0.9261099391981985,242.0,40.0,991.0,,,,,,,HistGradientBosting,,,,,,,maxabs,,,,,,,26.679162059451833,8362.761786895646,0.8656271425915597,,COMPLETE
155,85.05592656059027,2025-05-04 05:05:07.046052,2025-05-04 05:05:39.231029,0 days 00:00:32.184977,,,,,,none,,,,,,0.5457208810330317,0.32499566245597955,7.0,827.0,142.0,LightGBM,,,,,,,standard,,,,,,,22.954456330526728,7234.5106430805245,0.8837558821075345,,COMPLETE
