number,value,datetime_start,datetime_complete,duration,params_dt_criterion,params_dt_max_depth,params_dt_min_samples_leaf,params_dt_min_samples_split,params_dt_splitter,params_feature_selector,params_hgb_learning_rate,params_hgb_max_bins,params_hgb_max_depth,params_hgb_max_iter,params_lasso_alpha,params_lgb_feature_fraction,params_lgb_learning_rate,params_lgb_max_depth,params_lgb_n_estimators,params_lgb_num_leaves,params_model,params_rf_bootstrap,params_rf_criterion,params_rf_max_depth,params_rf_min_samples_leaf,params_rf_min_samples_split,params_rf_n_estimators,params_scaler,params_xgb_alpha,params_xgb_booster,params_xgb_lambda,params_xgb_learning_rate,params_xgb_max_depth,params_xgb_n_estimators,user_attrs_MAE,user_attrs_MSE,user_attrs_R2,user_attrs_error,state
Lasso does not accept missing values encoded as NaN natively. For supervised learning, you might want to consider sklearn.ensemble.HistGradientBoostingClassifier and Regressor which accept missing values encoded as NaNs natively. Alternatively, it is possible to preprocess the data, for instance by using an imputer transformer in a pipeline or drop samples with missing values. See https://scikit-learn.org/stable/modules/impute.html You can find a list of all estimators that handle NaN values at the following page: https://scikit-learn.org/stable/modules/impute.html#estimators-that-handle-nan-values",PRUNED
454,,2025-05-04 05:07:10.178081,2025-05-04 05:07:10.594537,0 days 00:00:00.416456,,,,,,lasso,,,,,0.0010810463554471754,,,,,,XGBoost,,,,,,,standard,0.5475238984771063,dart,0.4403156303531119,0.038976473740954115,12.0,186.0,,,,"Input X contains NaN.
Lasso does not accept missing values encoded as NaN natively. For supervised learning, you might want to consider sklearn.ensemble.HistGradientBoostingClassifier and Regressor which accept missing values encoded as NaNs natively. Alternatively, it is possible to preprocess the data, for instance by using an imputer transformer in a pipeline or drop samples with missing values. See https://scikit-learn.org/stable/modules/impute.html You can find a list of all estimators that handle NaN values at the following page: https://scikit-learn.org/stable/modules/impute.html#estimators-that-handle-nan-values",PRUNED
455,,2025-05-04 05:07:10.338843,2025-05-04 05:07:10.630650,0 days 00:00:00.291807,,,,,,lasso,,,,,0.0012159790376844953,,,,,,XGBoost,,,,,,,standard,0.5677102561742773,dart,0.42648097728433265,0.04014589675702169,13.0,196.0,,,,"Input X contains NaN.
Lasso does not accept missing values encoded as NaN natively. For supervised learning, you might want to consider sklearn.ensemble.HistGradientBoostingClassifier and Regressor which accept missing values encoded as NaNs natively. Alternatively, it is possible to preprocess the data, for instance by using an imputer transformer in a pipeline or drop samples with missing values. See https://scikit-learn.org/stable/modules/impute.html You can find a list of all estimators that handle NaN values at the following page: https://scikit-learn.org/stable/modules/impute.html#estimators-that-handle-nan-values",PRUNED
456,,2025-05-04 05:07:10.522407,2025-05-04 05:07:10.778090,0 days 00:00:00.255683,,,,,,none,,,,,,,,,,,RandomForest,True,mae,13.0,30.0,7.0,44.0,standard,,,,,,,,,,"The 'criterion' parameter of RandomForestRegressor must be a str among {'friedman_mse', 'absolute_error', 'poisson', 'squared_error'}. Got 'mae' instead.",PRUNED
457,81.49084338598178,2025-05-04 05:07:10.567639,2025-05-04 05:07:35.786153,0 days 00:00:25.218514,,,,,,none,,,,,,0.6370385517187296,0.11864419836698174,5.0,977.0,94.0,LightGBM,,,,,,,standard,,,,,,,21.650637118400184,6640.75755575861,0.8932963067868013,,COMPLETE
458,,2025-05-04 05:07:10.617604,2025-05-04 05:07:10.925561,0 days 00:00:00.307957,,,,,,none,,,,,,,,,,,RandomForest,True,mae,3.0,30.0,7.0,52.0,standard,,,,,,,,,,"The 'criterion' parameter of RandomForestRegressor must be a str among {'friedman_mse', 'absolute_error', 'poisson', 'squared_error'}. Got 'mae' instead.",PRUNED
459,,2025-05-04 05:07:10.655250,2025-05-04 05:07:10.946542,0 days 00:00:00.291292,,,,,,none,,,,,,,,,,,RandomForest,True,mae,13.0,29.0,7.0,47.0,standard,,,,,,,,,,"The 'criterion' parameter of RandomForestRegressor must be a str among {'friedman_mse', 'absolute_error', 'poisson', 'squared_error'}. Got 'mae' instead.",PRUNED
460,79.62207901384653,2025-05-04 05:07:10.794203,2025-05-04 05:07:37.752067,0 days 00:00:26.957864,,,,,,none,,,,,,0.6408341115203433,0.22893029004799448,5.0,982.0,120.0,LightGBM,,,,,,,standard,,,,,,,21.406853200210666,6339.675466487221,0.8981340938338144,,COMPLETE
461,78.93295597786421,2025-05-04 05:07:10.943292,2025-05-04 05:07:33.733378,0 days 00:00:22.790086,,,,,,none,,,,,,0.797838602722084,0.22982532209220488,5.0,978.0,96.0,LightGBM,,,,,,,standard,,,,,,,20.686486434915988,6230.411539403449,0.8998897466274789,,COMPLETE
462,79.37784144909156,2025-05-04 05:07:10.954653,2025-05-04 05:07:33.628432,0 days 00:00:22.673779,,,,,,none,,,,,,0.6347140837591954,0.1567897144560292,5.0,982.0,128.0,LightGBM,,,,,,,standard,,,,,,,21.390146013499407,6300.841713117118,0.898758074587686,,COMPLETE
463,84.86806270501421,2025-05-04 05:07:11.730651,2025-05-04 05:07:34.890083,0 days 00:00:23.159432,,,,,,none,,,,,,0.6311502960253841,0.22595972800282912,5.0,984.0,90.0,LightGBM,,,,,,,standard,,,,,,,21.51465695387929,7202.588067302225,0.8842688140590208,,COMPLETE
464,83.41676657257649,2025-05-04 05:07:11.990534,2025-05-04 05:07:35.106267,0 days 00:00:23.115733,,,,,,none,,,,,,0.632016446495165,0.22703331219947234,5.0,980.0,91.0,LightGBM,,,,,,,standard,,,,,,,21.643986513451694,6958.356945423716,0.8881931197550541,,COMPLETE
465,87.53715926575632,2025-05-04 05:07:12.120098,2025-05-04 05:08:12.702850,0 days 00:01:00.582752,,,,,,none,,,,,,0.630779237049542,0.15842649044129037,0.0,978.0,119.0,LightGBM,,,,,,,standard,,,,,,,22.128170014221357,7662.754252318386,0.876874863742242,,COMPLETE
466,84.47765292799171,2025-05-04 05:07:12.715241,2025-05-04 05:07:38.038004,0 days 00:00:25.322763,,,,,,none,,,,,,0.8658284726079489,0.23448759749501188,5.0,981.0,94.0,LightGBM,,,,,,,standard,,,,,,,21.206736780615014,7136.473844222226,0.8853311374035072,,COMPLETE
467,87.79355538736436,2025-05-04 05:07:13.175558,2025-05-04 05:08:10.446814,0 days 00:00:57.271256,,,,,,none,,,,,,0.6298666486466169,0.22760007862009224,0.0,981.0,98.0,LightGBM,,,,,,,standard,,,,,,,22.736614639235842,7707.708367554214,0.876152541013168,,COMPLETE
468,83.45881029291569,2025-05-04 05:07:13.466639,2025-05-04 05:07:37.212568,0 days 00:00:23.745929,,,,,,none,,,,,,0.6284945631471552,0.22952774980717147,5.0,981.0,91.0,LightGBM,,,,,,,standard,,,,,,,21.42945815346483,6965.373015508889,0.8880803855400726,,COMPLETE
469,80.5243405621529,2025-05-04 05:07:14.372799,2025-05-04 05:07:37.064561,0 days 00:00:22.691762,,,,,,none,,,,,,0.8275193567738774,0.22632435362189465,5.0,984.0,127.0,LightGBM,,,,,,,standard,,,,,,,20.662598599578875,6484.169422969583,0.8958123649234907,,COMPLETE
470,81.53589260312484,2025-05-04 05:07:15.001155,2025-05-04 05:07:37.457089,0 days 00:00:22.455934,,,,,,none,,,,,,0.6239383151765252,0.15885419775824874,5.0,982.0,120.0,LightGBM,,,,,,,standard,,,,,,,21.70536463329583,6648.101782588308,0.8931782997492089,,COMPLETE
471,82.83390084970621,2025-05-04 05:07:15.762252,2025-05-04 05:07:38.793971,0 days 00:00:23.031719,,,,,,none,,,,,,0.6249951528870976,0.22422085124781438,5.0,984.0,119.0,LightGBM,,,,,,,standard,,,,,,,21.448262692025953,6861.45512997896,0.8897501381374001,,COMPLETE
472,,2025-05-04 05:07:16.442017,2025-05-04 05:07:16.510778,0 days 00:00:00.068761,mae,17.0,14.0,8.0,best,none,,,,,,,,,,,DecisionTree,,,,,,,standard,,,,,,,,,,"The 'criterion' parameter of DecisionTreeRegressor must be a str among {'friedman_mse', 'absolute_error', 'poisson', 'squared_error'}. Got 'mae' instead.",PRUNED
473,82.69315426876273,2025-05-04 05:07:16.514285,2025-05-04 05:07:43.162669,0 days 00:00:26.648384,,,,,,none,,,,,,0.627000315062407,0.22393946438482257,5.0,990.0,96.0,LightGBM,,,,,,,standard,,,,,,,21.453066118160077,6838.157762917391,0.8901244802341775,,COMPLETE
474,80.43387513877526,2025-05-04 05:07:17.639013,2025-05-04 05:07:40.053095,0 days 00:00:22.414082,,,,,,none,,,,,,0.7702422199110062,0.1206985231200632,5.0,987.0,94.0,LightGBM,,,,,,,standard,,,,,,,20.786404561520065,6469.6082698400905,0.8960463335337455,,COMPLETE
475,80.11125181785457,2025-05-04 05:07:19.403615,2025-05-04 05:07:47.295729,0 days 00:00:27.892114,,,,,,none,,,,,,0.6231968713461495,0.22057636234723724,5.0,984.0,95.0,LightGBM,,,,,,,standard,,,,,,,21.27217705805208,6417.812667823707,0.8968785852732412,,COMPLETE
476,80.08573628403992,2025-05-04 05:07:19.691235,2025-05-04 05:07:46.774805,0 days 00:00:27.083570,,,,,,none,,,,,,0.6263552702667238,0.2202793565527221,5.0,984.0,118.0,LightGBM,,,,,,,standard,,,,,,,21.09894585796956,6413.725156156788,0.8969442634112021,,COMPLETE
477,81.54288090308948,2025-05-04 05:07:23.355569,2025-05-04 05:07:45.180393,0 days 00:00:21.824824,,,,,,none,,,,,,0.6273542418990952,0.1578005520520909,5.0,980.0,20.0,LightGBM,,,,,,,standard,,,,,,,21.706401425421618,6649.241425975436,0.893159987959126,,COMPLETE
478,82.57845992224205,2025-05-04 05:07:25.083511,2025-05-04 05:07:47.230222,0 days 00:00:22.146711,,,,,,none,,,,,,0.9398927727376392,0.2130030663279238,5.0,982.0,95.0,LightGBM,,,,,,,standard,,,,,,,20.70373102309694,6819.202043129336,0.8904290607420363,,COMPLETE
479,81.73247970616394,2025-05-04 05:07:25.624341,2025-05-04 05:07:48.603467,0 days 00:00:22.979126,,,,,,none,,,,,,0.6303558354016886,0.214001975171305,5.0,979.0,96.0,LightGBM,,,,,,,standard,,,,,,,21.57008953805283,6680.198238918501,0.8926625738849937,,COMPLETE
480,78.91791078387506,2025-05-04 05:07:26.918849,2025-05-04 05:07:49.828384,0 days 00:00:22.909535,,,,,,none,,,,,,0.6208036427502646,0.21126650827752308,5.0,985.0,119.0,LightGBM,,,,,,,standard,,,,,,,21.436059074697027,6228.036642491664,0.8999279064713461,,COMPLETE
481,78.66975416369577,2025-05-04 05:07:30.204198,2025-05-04 05:07:52.968799,0 days 00:00:22.764601,,,,,,none,,,,,,0.6325264670560256,0.2127059606595667,5.0,984.0,96.0,LightGBM,,,,,,,standard,,,,,,,21.209164791011727,6188.9302201763285,0.9005562684698628,,COMPLETE
482,79.88801493774693,2025-05-04 05:07:30.514005,2025-05-04 05:07:53.138094,0 days 00:00:22.624089,,,,,,none,,,,,,0.6254604877999487,0.15546473602379007,5.0,982.0,119.0,LightGBM,,,,,,,standard,,,,,,,21.277471500744284,6382.094930693677,0.8974524978777885,,COMPLETE
483,82.60359165144011,2025-05-04 05:07:31.218314,2025-05-04 05:07:59.675132,0 days 00:00:28.456818,,,,,,none,,,,,,0.49560077238816125,0.11429746403422439,5.0,984.0,119.0,LightGBM,,,,,,,standard,,,,,,,22.10528772951864,6823.353353717867,0.8903623574829951,,COMPLETE
484,78.26556483553595,2025-05-04 05:07:32.382062,2025-05-04 05:07:59.102934,0 days 00:00:26.720872,,,,,,none,,,,,,0.9449281938075285,0.3658675536407053,5.0,984.0,95.0,LightGBM,,,,,,,standard,,,,,,,21.130025513539344,6125.498639025482,0.9015754871235055,,COMPLETE
485,79.30443660704557,2025-05-04 05:07:33.035087,2025-05-04 05:07:55.575226,0 days 00:00:22.540139,,,,,,none,,,,,,0.6213430087631651,0.21143367462236035,5.0,984.0,95.0,LightGBM,,,,,,,standard,,,,,,,21.31216731984529,6289.19366556091,0.898945235417235,,COMPLETE
486,85.33057943246313,2025-05-04 05:07:33.631952,2025-05-04 05:07:55.789459,0 days 00:00:22.157507,,,,,,none,,,,,,0.7957198270389532,0.0710640165625003,5.0,984.0,119.0,LightGBM,,,,,,,standard,,,,,,,21.921780803709733,7281.307786279898,0.8830039456049181,,COMPLETE
487,81.21208270216619,2025-05-04 05:07:33.738012,2025-05-04 05:07:55.144914,0 days 00:00:21.406902,,,,,,none,,,,,,0.619425378238701,0.12429665858293909,5.0,982.0,51.0,LightGBM,,,,,,,standard,,,,,,,21.936920424466443,6595.402376823481,0.8940250738074444,,COMPLETE
488,76.58070976605099,2025-05-04 05:07:34.412819,2025-05-04 05:07:54.327720,0 days 00:00:19.914901,,,,,,none,,,,,,0.7747845856293233,0.36521231189634895,5.0,840.0,23.0,LightGBM,,,,,,,standard,,,,,,,20.891577747924373,5864.605108272138,0.9057675244073653,,COMPLETE
489,82.46900287198955,2025-05-04 05:07:34.893407,2025-05-04 05:07:52.390839,0 days 00:00:17.497432,,,,,,none,,,,,,0.8224840201658913,0.11467464112949934,5.0,836.0,97.0,LightGBM,,,,,,,standard,,,,,,,21.22410758017792,6801.136434700221,0.8907193389404714,,COMPLETE
490,83.1015403339562,2025-05-04 05:07:35.110173,2025-05-04 05:07:57.565261,0 days 00:00:22.455088,,,,,,none,,,,,,0.796164511088293,0.3626386753811098,5.0,940.0,100.0,LightGBM,,,,,,,standard,,,,,,,21.38123908172602,6905.866005876147,0.8890365441780854,,COMPLETE
491,78.46113854741593,2025-05-04 05:07:35.791538,2025-05-04 05:07:55.473759,0 days 00:00:19.682221,,,,,,none,,,,,,0.8042261457875672,0.3499152206418899,5.0,838.0,96.0,LightGBM,,,,,,,standard,,,,,,,21.11636414129944,6156.150262156797,0.9010829768393055,,COMPLETE
492,79.2855091230282,2025-05-04 05:07:36.852730,2025-05-04 05:07:58.435781,0 days 00:00:21.583051,,,,,,none,,,,,,0.9190928104401354,0.3907148638777011,5.0,944.0,99.0,LightGBM,,,,,,,standard,,,,,,,21.348366982776415,6286.191956897788,0.898993466872399,,COMPLETE
493,78.27513086412549,2025-05-04 05:07:37.067721,2025-05-04 05:07:56.491480,0 days 00:00:19.423759,,,,,,none,,,,,,0.7760195231675477,0.3699950535529466,5.0,841.0,53.0,LightGBM,,,,,,,standard,,,,,,,21.263837536654382,6126.99611179597,0.9015514257308473,,COMPLETE
494,75.35187942126416,2025-05-04 05:07:37.220088,2025-05-04 05:07:56.390271,0 days 00:00:19.170183,,,,,,none,,,,,,0.7832676488207322,0.3511474100197091,5.0,841.0,98.0,LightGBM,,,,,,,standard,,,,,,,20.75433534849039,5677.9057323167335,0.9087674100029124,,COMPLETE
495,79.07451539733002,2025-05-04 05:07:37.462566,2025-05-04 05:08:00.925683,0 days 00:00:23.463117,,,,,,none,,,,,,0.7999265208183214,0.3656928755227486,5.0,911.0,104.0,LightGBM,,,,,,,standard,,,,,,,20.971299780995828,6252.778985322582,0.8995303465037312,,COMPLETE
496,79.09540506183838,2025-05-04 05:07:37.757487,2025-05-04 05:07:58.903906,0 days 00:00:21.146419,,,,,,none,,,,,,0.7742174132430482,0.36578867516773494,5.0,945.0,118.0,LightGBM,,,,,,,standard,,,,,,,21.12578613236764,6256.083101896289,0.8994772559582231,,COMPLETE
497,84.22787741234185,2025-05-04 05:07:38.042695,2025-05-04 05:07:58.076793,0 days 00:00:20.034098,,,,,,none,,,,,,0.7984754462927576,0.21272643826022997,5.0,910.0,103.0,LightGBM,,,,,,,standard,,,,,,,21.035120334640055,7094.335333388486,0.8860082190007063,,COMPLETE
498,75.81323900298582,2025-05-04 05:07:38.801811,2025-05-04 05:07:59.828186,0 days 00:00:21.026375,,,,,,none,,,,,,0.7948106166082284,0.368040509415482,5.0,944.0,107.0,LightGBM,,,,,,,standard,,,,,,,20.61905443250675,5747.647208123852,0.9076468039611656,,COMPLETE
499,85.03622389889313,2025-05-04 05:07:40.057575,2025-05-04 05:07:58.972971,0 days 00:00:18.915396,,,,,,none,,,,,,0.7918239753818069,0.20264787161714892,5.0,914.0,52.0,LightGBM,,,,,,,standard,,,,,,,21.390044246196084,7231.1593749826825,0.883809730283738,,COMPLETE
