number,value,datetime_start,datetime_complete,duration,params_dt_criterion,params_dt_max_depth,params_dt_min_samples_leaf,params_dt_min_samples_split,params_dt_splitter,params_feature_selector,params_hgb_learning_rate,params_hgb_max_bins,params_hgb_max_depth,params_hgb_max_iter,params_lasso_alpha,params_lgb_feature_fraction,params_lgb_learning_rate,params_lgb_max_depth,params_lgb_n_estimators,params_lgb_num_leaves,params_model,params_rf_bootstrap,params_rf_criterion,params_rf_max_depth,params_rf_min_samples_leaf,params_rf_min_samples_split,params_rf_n_estimators,params_scaler,params_xgb_alpha,params_xgb_booster,params_xgb_lambda,params_xgb_learning_rate,params_xgb_max_depth,params_xgb_n_estimators,user_attrs_MAE,user_attrs_MSE,user_attrs_R2,user_attrs_error,state
236,94.99041402324053,2025-05-04 05:05:35.172308,2025-05-04 05:05:46.223615,0 days 00:00:11.051307,,,,,,none,,,,,,0.7834465013825107,0.828061848380245,4.0,980.0,123.0,LightGBM,,,,,,,standard,,,,,,,25.400303426532258,9023.178756306652,0.8550155626467815,,COMPLETE
237,79.403098709502,2025-05-04 05:05:35.429929,2025-05-04 05:05:49.500510,0 days 00:00:14.070581,,,,,,none,,,,,,0.5159781048381467,0.2532564449807151,5.0,976.0,123.0,LightGBM,,,,,,,standard,,,,,,,21.676188653921436,6304.852084670919,0.898693635937072,,COMPLETE
238,79.91919256828153,2025-05-04 05:05:35.721344,2025-05-04 05:05:49.853362,0 days 00:00:14.132018,,,,,,none,,,,,,0.5153660561592744,0.24822882976922084,5.0,981.0,124.0,LightGBM,,,,,,,standard,,,,,,,22.039133959394636,6387.077340766066,0.8973724405121396,,COMPLETE
239,101.37459329141976,2025-05-04 05:05:36.596268,2025-05-04 05:05:52.695153,0 days 00:00:16.098885,,,,,,none,,,,,,0.624588690313586,0.9109356782831438,5.0,971.0,123.0,LightGBM,,,,,,,standard,,,,,,,28.347766424476237,10276.808165000766,0.8348722451554897,,COMPLETE
240,84.29049181006691,2025-05-04 05:05:37.175831,2025-05-04 05:05:51.742283,0 days 00:00:14.566452,,,,,,none,,,,,,0.5178561717857064,0.3173835289228831,5.0,979.0,122.0,LightGBM,,,,,,,standard,,,,,,,22.599820411354575,7104.887009582957,0.8858386746663308,,COMPLETE
241,,2025-05-04 05:05:37.738974,2025-05-04 05:05:37.774965,0 days 00:00:00.035991,mae,24.0,35.0,9.0,random,none,,,,,,,,,,,DecisionTree,,,,,,,standard,,,,,,,,,,"The 'criterion' parameter of DecisionTreeRegressor must be a str among {'friedman_mse', 'absolute_error', 'poisson', 'squared_error'}. Got 'mae' instead.",PRUNED
242,78.79263774415514,2025-05-04 05:05:37.777317,2025-05-04 05:05:52.177313,0 days 00:00:14.399996,,,,,,none,,,,,,0.6162757265757294,0.31627719311055796,5.0,979.0,125.0,LightGBM,,,,,,,standard,,,,,,,21.406981665202423,6208.279762681661,0.900245360018535,,COMPLETE
243,81.70331028150586,2025-05-04 05:05:37.947086,2025-05-04 05:05:51.184189,0 days 00:00:13.237103,,,,,,none,,,,,,0.5151027538373345,0.19099992532015164,5.0,967.0,124.0,LightGBM,,,,,,,standard,,,,,,,21.590407253756865,6675.430910956021,0.8927391753112743,,COMPLETE
244,83.98140318519071,2025-05-04 05:05:38.557552,2025-05-04 05:06:41.803034,0 days 00:01:03.245482,,,,,,none,,,,,,0.5113854348139403,0.2494431324281773,14.0,970.0,124.0,LightGBM,,,,,,,standard,,,,,,,22.87019191315263,7052.876080953561,0.8866743862738705,,COMPLETE
245,84.94368641979783,2025-05-04 05:05:38.574367,2025-05-04 05:05:53.057838,0 days 00:00:14.483471,,,,,,none,,,,,,0.5080174821530714,0.40451935268152583,5.0,973.0,122.0,LightGBM,,,,,,,standard,,,,,,,23.06595730901961,7215.429862584946,0.884062472090857,,COMPLETE
246,79.71340124712826,2025-05-04 05:05:39.235240,2025-05-04 05:05:53.427612,0 days 00:00:14.192372,,,,,,none,,,,,,0.5166370565951633,0.24818385189517106,5.0,975.0,124.0,LightGBM,,,,,,,standard,,,,,,,22.04334032588862,6354.22633838567,0.8979002904223813,,COMPLETE
247,78.15297529088245,2025-05-04 05:05:39.759494,2025-05-04 05:05:54.036652,0 days 00:00:14.277158,,,,,,none,,,,,,0.6152351143458159,0.25028124129727486,5.0,970.0,124.0,LightGBM,,,,,,,standard,,,,,,,20.92285578131197,6107.887546817283,0.9018584621552478,,COMPLETE
248,77.57837453662918,2025-05-04 05:05:40.131738,2025-05-04 05:05:54.302483,0 days 00:00:14.170745,,,,,,none,,,,,,0.5213836034369136,0.25437822896134477,5.0,974.0,135.0,LightGBM,,,,,,,standard,,,,,,,21.54636059484936,6018.404195745515,0.9032962806511468,,COMPLETE
249,77.55823919533553,2025-05-04 05:05:40.425944,2025-05-04 05:05:55.346355,0 days 00:00:14.920411,,,,,,none,,,,,,0.5216641018493995,0.3953367024594915,5.0,982.0,126.0,LightGBM,,,,,,,standard,,,,,,,22.27012761433238,6015.28046708088,0.9033464727237098,,COMPLETE
250,79.02969316506429,2025-05-04 05:05:41.273152,2025-05-04 05:05:55.500213,0 days 00:00:14.227061,,,,,,none,,,,,,0.5198514567399289,0.24644175539061763,5.0,998.0,125.0,LightGBM,,,,,,,standard,,,,,,,21.88748746809982,6245.692401764209,0.8996442137292087,,COMPLETE
251,80.53312245786638,2025-05-04 05:05:41.279204,2025-05-04 05:05:55.147879,0 days 00:00:13.868675,,,,,,none,,,,,,0.5195436017081051,0.255079008573533,5.0,968.0,125.0,LightGBM,,,,,,,standard,,,,,,,21.54005469911423,6485.583812813704,0.8957896385073034,,COMPLETE
252,,2025-05-04 05:05:41.525319,2025-05-04 05:05:41.589011,0 days 00:00:00.063692,,,,,,lasso,,,,,0.1213944329412465,0.5190053389643785,0.2485461881244013,14.0,967.0,124.0,LightGBM,,,,,,,standard,,,,,,,,,,"Input X contains NaN.
Lasso does not accept missing values encoded as NaN natively. For supervised learning, you might want to consider sklearn.ensemble.HistGradientBoostingClassifier and Regressor which accept missing values encoded as NaNs natively. Alternatively, it is possible to preprocess the data, for instance by using an imputer transformer in a pipeline or drop samples with missing values. See https://scikit-learn.org/stable/modules/impute.html You can find a list of all estimators that handle NaN values at the following page: https://scikit-learn.org/stable/modules/impute.html#estimators-that-handle-nan-values",PRUNED
253,,2025-05-04 05:05:41.590878,2025-05-04 05:05:41.627960,0 days 00:00:00.037082,,,,,,none,,,,,,,,,,,RandomForest,True,mse,9.0,28.0,10.0,10.0,standard,,,,,,,,,,"The 'criterion' parameter of RandomForestRegressor must be a str among {'friedman_mse', 'absolute_error', 'poisson', 'squared_error'}. Got 'mse' instead.",PRUNED
254,79.72303420635858,2025-05-04 05:05:41.631667,2025-05-04 05:05:57.572281,0 days 00:00:15.940614,,,,,,none,,,,,,0.6202877151962776,0.25102351172754817,5.0,981.0,126.0,LightGBM,,,,,,,standard,,,,,,,21.76534335106896,6355.762183068219,0.8978756124698354,,COMPLETE
255,78.7926505978644,2025-05-04 05:05:41.967297,2025-05-04 05:05:58.349445,0 days 00:00:16.382148,,,,,,none,,,,,,0.6172360257450376,0.24961545452975356,5.0,977.0,123.0,LightGBM,,,,,,,standard,,,,,,,21.494897025760515,6208.28178823714,0.9002453274719093,,COMPLETE
256,79.5653033840054,2025-05-04 05:05:43.153953,2025-05-04 05:05:57.345311,0 days 00:00:14.191358,,,,,,none,,,,,,0.7326989680002967,0.25281340344735886,5.0,981.0,135.0,LightGBM,,,,,,,standard,,,,,,,20.610040369512905,6330.637502588823,0.8982793158388326,,COMPLETE
257,83.84469864086734,2025-05-04 05:05:43.425817,2025-05-04 05:05:57.278166,0 days 00:00:13.852349,,,,,,none,,,,,,0.8322743166452592,0.25810595207904685,5.0,978.0,124.0,LightGBM,,,,,,,standard,,,,,,,20.93522555702957,7029.93349017786,0.8870430278252435,,COMPLETE
258,81.46373497493589,2025-05-04 05:05:43.774078,2025-05-04 05:05:56.628726,0 days 00:00:12.854648,,,,,,none,,,,,,0.8332098098495675,0.2562633609830503,5.0,888.0,123.0,LightGBM,,,,,,,standard,,,,,,,20.923541818491678,6636.3401160665935,0.8933672862083096,,COMPLETE
259,80.18402460472421,2025-05-04 05:05:43.965694,2025-05-04 05:05:58.261767,0 days 00:00:14.296073,,,,,,none,,,,,,0.8119973711915552,0.2497969685411362,5.0,886.0,135.0,LightGBM,,,,,,,standard,,,,,,,20.93305087079944,6429.477801811018,0.896691149898915,,COMPLETE
260,79.25517669101099,2025-05-04 05:05:45.148845,2025-05-04 05:05:57.792920,0 days 00:00:12.644075,,,,,,none,,,,,,0.6844158259812484,0.24700180548696288,5.0,891.0,136.0,LightGBM,,,,,,,standard,,,,,,,20.654633715025827,6281.383032323372,0.8990707366730453,,COMPLETE
261,78.90403911637001,2025-05-04 05:05:46.229989,2025-05-04 05:05:58.955696,0 days 00:00:12.725707,,,,,,none,,,,,,0.8217415017411319,0.25073795020562856,5.0,889.0,132.0,LightGBM,,,,,,,standard,,,,,,,20.760405654365925,6225.847388877649,0.8999630833986823,,COMPLETE
262,82.1042953698365,2025-05-04 05:05:47.002202,2025-05-04 05:06:00.154378,0 days 00:00:13.152176,,,,,,none,,,,,,0.7164092987087062,0.24595408013589892,5.0,950.0,134.0,LightGBM,,,,,,,standard,,,,,,,21.48809942430643,6741.115318177356,0.8916837582480571,,COMPLETE
263,78.37605965179398,2025-05-04 05:05:48.043205,2025-05-04 05:06:04.379036,0 days 00:00:16.335831,,,,,,none,,,,,,0.8171721268133076,0.2539717378306919,5.0,999.0,133.0,LightGBM,,,,,,,standard,,,,,,,20.58966546494241,6142.806726541568,0.901297380771193,,COMPLETE
264,79.87969587209477,2025-05-04 05:05:49.135784,2025-05-04 05:06:04.970702,0 days 00:00:15.834918,,,,,,none,,,,,,0.6848713894960995,0.25784609238134165,5.0,1000.0,136.0,LightGBM,,,,,,,standard,,,,,,,20.993783943243788,6380.765812618354,0.8974738541471843,,COMPLETE
265,81.29941550308651,2025-05-04 05:05:49.449362,2025-05-04 05:06:02.998130,0 days 00:00:13.548768,,,,,,none,,,,,,0.8121404848915112,0.25451975629724766,5.0,1000.0,136.0,LightGBM,,,,,,,standard,,,,,,,21.113785910025427,6609.594961143502,0.8937970273608651,,COMPLETE
266,80.55025047005223,2025-05-04 05:05:49.503184,2025-05-04 05:06:02.798487,0 days 00:00:13.295303,,,,,,none,,,,,,0.8224280996675206,0.24619195037960284,5.0,948.0,135.0,LightGBM,,,,,,,standard,,,,,,,20.67022665585203,6488.342850788151,0.8957453062847947,,COMPLETE
267,81.4811011135993,2025-05-04 05:05:49.859349,2025-05-04 05:06:03.065612,0 days 00:00:13.206263,,,,,,none,,,,,,0.8123465806091581,0.24298374966087916,5.0,994.0,136.0,LightGBM,,,,,,,standard,,,,,,,20.990860182751973,6639.169838684593,0.8933218182249396,,COMPLETE
268,78.9647803570868,2025-05-04 05:05:49.958981,2025-05-04 05:06:03.562074,0 days 00:00:13.603093,,,,,,none,,,,,,0.5197422995390513,0.24846179485183312,5.0,953.0,135.0,LightGBM,,,,,,,standard,,,,,,,21.80758789301544,6235.436536842961,0.89980900496801,,COMPLETE
269,82.36607948864871,2025-05-04 05:05:51.188607,2025-05-04 05:06:05.314050,0 days 00:00:14.125443,,,,,,none,,,,,,0.5248409854639732,0.16622260706188322,5.0,1000.0,134.0,LightGBM,,,,,,,standard,,,,,,,21.603959717194677,6784.171050330398,0.8909919387385881,,COMPLETE
270,83.55262996394387,2025-05-04 05:05:51.583716,2025-05-04 05:06:06.232000,0 days 00:00:14.648284,,,,,,none,,,,,,0.8274964500096502,0.25087621879459604,5.0,941.0,135.0,LightGBM,,,,,,,standard,,,,,,,20.952093891393478,6981.041973891732,0.8878286167148723,,COMPLETE
271,80.29196800064334,2025-05-04 05:05:51.748689,2025-05-04 05:06:04.101369,0 days 00:00:12.352680,,,,,,none,,,,,,0.8197762715820639,0.18822433483017884,5.0,952.0,134.0,LightGBM,,,,,,,standard,,,,,,,20.84751266796587,6446.800125416335,0.896412814801119,,COMPLETE
272,78.0730970241535,2025-05-04 05:05:51.759730,2025-05-04 05:06:04.422660,0 days 00:00:12.662930,,,,,,none,,,,,,0.8891027576960684,0.24972389860908048,5.0,945.0,133.0,LightGBM,,,,,,,standard,,,,,,,20.83249328326557,6095.408478942885,0.9020589758193706,,COMPLETE
273,82.13988007292252,2025-05-04 05:05:52.183718,2025-05-04 05:06:04.625285,0 days 00:00:12.441567,,,,,,none,,,,,,0.7409448054988392,0.24421643683376332,5.0,952.0,134.0,LightGBM,,,,,,,standard,,,,,,,21.273514507851196,6746.959898394094,0.8915898475324241,,COMPLETE
274,81.07661488741981,2025-05-04 05:05:52.699581,2025-05-04 05:06:07.741441,0 days 00:00:15.041860,,,,,,none,,,,,,0.8205286902569914,0.24829658128976007,5.0,942.0,133.0,LightGBM,,,,,,,standard,,,,,,,20.82498173660124,6573.417481602984,0.89437832710652,,COMPLETE
275,81.71778912332871,2025-05-04 05:05:53.061685,2025-05-04 05:06:07.019155,0 days 00:00:13.957470,,,,,,none,,,,,,0.8056577867771718,0.24937665404729184,5.0,994.0,133.0,LightGBM,,,,,,,standard,,,,,,,20.792660535302314,6677.79705920482,0.892701156040925,,COMPLETE
276,78.21142709547848,2025-05-04 05:05:53.430794,2025-05-04 05:06:06.148047,0 days 00:00:12.717253,,,,,,none,,,,,,0.8237312201682969,0.25686378417275746,5.0,946.0,130.0,LightGBM,,,,,,,standard,,,,,,,20.57741481618306,6117.0273283113465,0.9017116041450901,,COMPLETE
277,80.04003506124218,2025-05-04 05:05:53.779997,2025-05-04 05:06:06.779966,0 days 00:00:12.999969,,,,,,none,,,,,,0.8204935287966854,0.2544172542241746,5.0,950.0,133.0,LightGBM,,,,,,,standard,,,,,,,20.90754656866104,6406.407212604878,0.8970618481290837,,COMPLETE
278,78.83745059568771,2025-05-04 05:05:54.039103,2025-05-04 05:06:07.354920,0 days 00:00:13.315817,,,,,,none,,,,,,0.8303391294459457,0.2476485420626476,5.0,997.0,104.0,LightGBM,,,,,,,standard,,,,,,,20.871065500783825,6215.343616427501,0.9001318580156881,,COMPLETE
279,83.61344129298192,2025-05-04 05:05:54.306017,2025-05-04 05:06:07.591201,0 days 00:00:13.285184,,,,,,none,,,,,,0.8291609069390323,0.25098494339560967,5.0,946.0,131.0,LightGBM,,,,,,,standard,,,,,,,20.86475410051719,6991.207564854934,0.8876652759980399,,COMPLETE
280,84.05241128979948,2025-05-04 05:05:55.153093,2025-05-04 05:06:09.123360,0 days 00:00:13.970267,,,,,,none,,,,,,0.8275918869964384,0.2507981490727178,5.0,1000.0,132.0,LightGBM,,,,,,,standard,,,,,,,20.86381384706846,7064.807843629611,0.8864826667097413,,COMPLETE
281,82.06053648124045,2025-05-04 05:05:55.349874,2025-05-04 05:06:08.286022,0 days 00:00:12.936148,,,,,,none,,,,,,0.7294410422180698,0.2556622717657179,5.0,949.0,133.0,LightGBM,,,,,,,standard,,,,,,,21.243186371936673,6733.9316475889955,0.8917991854679441,,COMPLETE
282,80.94224726690527,2025-05-04 05:05:55.503490,2025-05-04 05:06:11.238770,0 days 00:00:15.735280,,,,,,none,,,,,,0.7149041396276442,0.24971812621957004,5.0,998.0,134.0,LightGBM,,,,,,,standard,,,,,,,20.71804223378917,6551.647392616833,0.8947281288989959,,COMPLETE
283,,2025-05-04 05:05:56.632434,2025-05-04 05:05:56.676331,0 days 00:00:00.043897,mae,21.0,34.0,2.0,random,none,,,,,,,,,,,DecisionTree,,,,,,,standard,,,,,,,,,,"The 'criterion' parameter of DecisionTreeRegressor must be a str among {'friedman_mse', 'absolute_error', 'poisson', 'squared_error'}. Got 'mae' instead.",PRUNED
284,77.81770639335139,2025-05-04 05:05:56.679025,2025-05-04 05:06:10.381370,0 days 00:00:13.702345,,,,,,none,,,,,,0.7321515656816686,0.2524538699075302,5.0,997.0,134.0,LightGBM,,,,,,,standard,,,,,,,20.912077487850244,6055.595428321842,0.9026986919215892,,COMPLETE
285,81.29175666773735,2025-05-04 05:05:57.286839,2025-05-04 05:06:10.712270,0 days 00:00:13.425431,,,,,,none,,,,,,0.8131984950682326,0.2502820527134003,5.0,944.0,134.0,LightGBM,,,,,,,standard,,,,,,,21.01143631712946,6608.3497021266185,0.8938170361828998,,COMPLETE
286,,2025-05-04 05:05:57.351290,2025-05-04 05:05:57.435249,0 days 00:00:00.083959,,,,,,lasso,,,,,0.000677585553628224,0.694853504361488,0.2461245110893421,5.0,1000.0,132.0,LightGBM,,,,,,,standard,,,,,,,,,,"Input X contains NaN.
Lasso does not accept missing values encoded as NaN natively. For supervised learning, you might want to consider sklearn.ensemble.HistGradientBoostingClassifier and Regressor which accept missing values encoded as NaNs natively. Alternatively, it is possible to preprocess the data, for instance by using an imputer transformer in a pipeline or drop samples with missing values. See https://scikit-learn.org/stable/modules/impute.html You can find a list of all estimators that handle NaN values at the following page: https://scikit-learn.org/stable/modules/impute.html#estimators-that-handle-nan-values",PRUNED
287,92.34374000961535,2025-05-04 05:05:57.440353,2025-05-04 05:06:42.710829,0 days 00:00:45.270476,,,,,,none,,,,,,0.6853639423512193,0.24524760216352173,13.0,947.0,134.0,LightGBM,,,,,,,robust,,,,,,,21.673860522134667,8527.366318963434,0.8629822769502847,,COMPLETE
288,88.09416907951429,2025-05-04 05:05:57.577440,2025-05-04 05:06:35.395016,0 days 00:00:37.817576,,,,,,none,,,,,,0.5654742620311358,0.05203070470663779,12.0,949.0,133.0,LightGBM,,,,,,,robust,,,,,,,21.68589974206642,7760.582625810051,0.8753029574250857,,COMPLETE
289,90.7001584426788,2025-05-04 05:05:57.796407,2025-05-04 05:06:52.635773,0 days 00:00:54.839366,,,,,,none,,,,,,0.7452235817334251,0.24370285816087248,13.0,947.0,136.0,LightGBM,,,,,,,standard,,,,,,,21.978801269550466,8226.518741527037,0.8678162958611046,,COMPLETE
290,84.0657398430818,2025-05-04 05:05:58.268893,2025-05-04 05:06:11.675400,0 days 00:00:13.406507,,,,,,none,,,,,,0.7218457273670936,0.09208292151819276,5.0,945.0,134.0,LightGBM,,,,,,,robust,,,,,,,21.358193976140768,7067.04861536471,0.8864466619892294,,COMPLETE
291,83.39952470291614,2025-05-04 05:05:58.354787,2025-05-04 05:06:11.870533,0 days 00:00:13.515746,,,,,,none,,,,,,0.7222674037300892,0.2438156662955214,5.0,948.0,131.0,LightGBM,,,,,,,robust,,,,,,,21.01061185159752,6955.480720672319,0.8882393349347092,,COMPLETE
292,88.45814042624434,2025-05-04 05:05:58.960172,2025-05-04 05:06:59.247104,0 days 00:01:00.286932,,,,,,none,,,,,,0.6732685951293926,0.015094140518567853,15.0,949.0,135.0,LightGBM,,,,,,,standard,,,,,,,21.829087385777058,7824.842607669164,0.8742704280287618,,COMPLETE
293,80.11823452557675,2025-05-04 05:06:00.159352,2025-05-04 05:06:12.909865,0 days 00:00:12.750513,,,,,,none,,,,,,0.5743937487363941,0.23122491049658553,5.0,945.0,134.0,LightGBM,,,,,,,robust,,,,,,,21.106212904875264,6418.93150349532,0.8968606078215337,,COMPLETE
294,83.08983221059643,2025-05-04 05:06:01.208120,2025-05-04 05:06:15.219583,0 days 00:00:14.011463,,,,,,none,,,,,,0.5738234200383165,0.23417519158453073,5.0,998.0,133.0,LightGBM,,,,,,,standard,,,,,,,21.330361734679677,6903.920216785068,0.8890678091174373,,COMPLETE
295,,2025-05-04 05:06:02.804433,2025-05-04 05:06:02.869328,0 days 00:00:00.064895,,,,,,none,,,,,,,,,,,RandomForest,True,mae,23.0,8.0,5.0,170.0,robust,,,,,,,,,,"The 'criterion' parameter of RandomForestRegressor must be a str among {'friedman_mse', 'absolute_error', 'poisson', 'squared_error'}. Got 'mae' instead.",PRUNED
296,81.2780715235074,2025-05-04 05:06:02.871929,2025-05-04 05:06:16.959079,0 days 00:00:14.087150,,,,,,none,,,,,,0.5715272617729238,0.19431093582402506,5.0,995.0,132.0,LightGBM,,,,,,,standard,,,,,,,21.39372022839166,6606.124910580386,0.893852784133735,,COMPLETE
297,86.33357513465924,2025-05-04 05:06:03.004635,2025-05-04 05:06:16.723116,0 days 00:00:13.718481,,,,,,none,,,,,,0.4266645162796123,0.19280191123271964,5.0,952.0,130.0,LightGBM,,,,,,,standard,,,,,,,22.850677559571707,7453.486195531853,0.8802373829041272,,COMPLETE
298,78.7295662064325,2025-05-04 05:06:03.069824,2025-05-04 05:06:16.371946,0 days 00:00:13.302122,,,,,,none,,,,,,0.6143255966356379,0.2052059435733207,5.0,950.0,130.0,LightGBM,,,,,,,standard,,,,,,,21.201714506920297,6198.344595053037,0.9004049982931994,,COMPLETE
299,78.71238893998435,2025-05-04 05:06:03.566552,2025-05-04 05:06:16.779610,0 days 00:00:13.213058,,,,,,none,,,,,,0.6132722277139028,0.19754801530045382,5.0,951.0,129.0,LightGBM,,,,,,,standard,,,,,,,21.426627225652158,6195.64017263937,0.900448452952871,,COMPLETE
300,81.9922595869371,2025-05-04 05:06:04.108226,2025-05-04 05:06:19.256614,0 days 00:00:15.148388,,,,,,none,,,,,,0.6084339344089112,0.202448778028292,5.0,944.0,130.0,LightGBM,,,,,,,standard,,,,,,,21.63230171172169,6722.730632171678,0.8919791633850312,,COMPLETE
301,91.25740977248664,2025-05-04 05:06:04.280265,2025-05-04 05:07:00.005130,0 days 00:00:55.724865,,,,,,none,,,,,,0.4059832690878146,0.031017664844610448,11.0,952.0,130.0,LightGBM,,,,,,,standard,,,,,,,22.609398348295443,8327.91483838354,0.8661870633644884,,COMPLETE
302,89.51811852872756,2025-05-04 05:06:04.382909,2025-05-04 05:06:18.141328,0 days 00:00:13.758419,,,,,,none,,,,,,0.5755976053174022,0.019287941349147734,5.0,948.0,285.0,LightGBM,,,,,,,standard,,,,,,,24.730963553468026,8013.493544923316,0.8712391847460291,,COMPLETE
303,81.37715159042423,2025-05-04 05:06:04.425865,2025-05-04 05:06:17.720992,0 days 00:00:13.295127,,,,,,none,,,,,,0.5712435933155674,0.20637259101977287,5.0,949.0,130.0,LightGBM,,,,,,,standard,,,,,,,21.644595724879782,6622.240800970885,0.8935938340049814,,COMPLETE
304,84.48153152248409,2025-05-04 05:06:04.630643,2025-05-04 05:06:18.527015,0 days 00:00:13.896372,,,,,,none,,,,,,0.4090517775791527,0.09640469938986468,5.0,948.0,34.0,LightGBM,,,,,,,standard,,,,,,,22.75408090008665,7137.129168384472,0.8853206076547886,,COMPLETE
305,92.0671875241814,2025-05-04 05:06:04.974946,2025-05-04 05:06:19.731007,0 days 00:00:14.756061,,,,,,none,,,,,,0.7007370357160492,0.010631554881933182,5.0,996.0,130.0,LightGBM,,,,,,,standard,,,,,,,25.414628665547166,8476.367018612786,0.8638017337145185,,COMPLETE
306,82.3092679427456,2025-05-04 05:06:05.317096,2025-05-04 05:06:20.171183,0 days 00:00:14.854087,,,,,,none,,,,,,0.612164984093799,0.03176654290465962,5.0,989.0,130.0,LightGBM,,,,,,,standard,,,,,,,22.901614240221406,6774.815589270689,0.8911422622880327,,COMPLETE
307,,2025-05-04 05:06:06.153544,2025-05-04 05:06:06.263294,0 days 00:00:00.109750,,,,,,lasso,,,,,0.013660909410966378,0.5687909583363143,0.043886202482238006,5.0,945.0,274.0,LightGBM,,,,,,,standard,,,,,,,,,,"Input X contains NaN.
Lasso does not accept missing values encoded as NaN natively. For supervised learning, you might want to consider sklearn.ensemble.HistGradientBoostingClassifier and Regressor which accept missing values encoded as NaNs natively. Alternatively, it is possible to preprocess the data, for instance by using an imputer transformer in a pipeline or drop samples with missing values. See https://scikit-learn.org/stable/modules/impute.html You can find a list of all estimators that handle NaN values at the following page: https://scikit-learn.org/stable/modules/impute.html#estimators-that-handle-nan-values",PRUNED
308,88.1609935356597,2025-05-04 05:06:06.236751,2025-05-04 05:06:18.358059,0 days 00:00:12.121308,,,,,,none,,,,,,0.5711514865932869,0.031401616462744676,5.0,986.0,130.0,LightGBM,,,,,,,robust,,,,,,,22.716119355668233,7772.360781194632,0.8751137060229344,,COMPLETE
